], seq 486076:486248, ack 253, win 333, length 172
17:58:46.744251 IP 198.96.84.204.20132 > lamp-s-1vcpu-1gb-tor1-01.ssh: Flags [.], ack 483960, win 508, length 0
17:58:46.744270 IP lamp-s-1vcpu-1gb-tor1-01.ssh > 198.96.84.204.20132: Flags [P.], seq 486248:486420, ack 253, win 333, length 172
17:58:46.744505 IP lamp-s-1vcpu-1gb-tor1-01.ssh > 198.96.84.204.20132: Flags [P.], seq 486420:486704, ack 253, win 333, length 284
17:58:46.744652 IP lamp-s-1vcpu-1gb-tor1-01.ssh > 198.96.84.204.20132: Flags [P.], seq 486704:486876, ack 253, win 333, length 172
17:58:46.744769 IP lamp-s-1vcpu-1gb-tor1-01.ssh > 198.96.84.204.20132: Flags [P.], seq 486876:487048, ack 253, win 333, length 172
17:58:46.744901 IP lamp-s-1vcpu-1gb-tor1-01.ssh > 198.96.84.204.20132: Flags [P.], seq 487048:487220, ack 253, win 333, length 172
17:58:46.745086 IP lamp-s-1vcpu-1gb-tor1-01.ssh > 198.96.84.204.20132: Flags [P.], seq 487220:487392, ack 253, win 333, length 172
17:58:46.745235 IP 198.96.84.204.20132 > lamp-s-1vcpu-1gb-tor1-01.ssh: Flags [.], ack 484588, win 512, length 0
17:58:46.745402 IP lamp-s-1vcpu-1gb-tor1-01.ssh > 198.96.84.204.20132: Flags [P.], seq 487392:487676, ack 253, win 333, length 284
17:58:46.745635 IP lamp-s-1vcpu-1gb-tor1-01.ssh > 198.96.84.204.20132: Flags [P.], seq 487676:487848, ack 253, win 333, length 172
17:58:46.745828 IP lamp-s-1vcpu-1gb-tor1-01.ssh > 198.96.84.204.20132: Flags [P.], seq 487848:488020, ack 253, win 333, length 172
17:58:46.746024 IP lamp-s-1vcpu-1gb-tor1-01.ssh > 198.96.84.204.20132: Flags [P.], seq 488020:488192, ack 253, win 333, length 172
17:58:46.746223 IP lamp-s-1vcpu-1gb-tor1-01.ssh > 198.96.84.204.20132: Flags [P.], seq 488192:488364, ack 253, win 333, length 172
17:58:46.746419 IP lamp-s-1vcpu-1gb-tor1-01.ssh > 198.96.84.204.20132: Flags [P.], seq 488364:488536, ack 253, win 333, length 172
17:58:46.746616 IP lamp-s-1vcpu-1gb-tor1-01.ssh > 198.96.84.204.20132: Flags [P.], seq 488536:488708, ack 253, win 333, length 172
17:58:46.746812 IP lamp-s-1vcpu-1gb-tor1-01.ssh > 198.96.84.204.20132: Flags [P.], seq 488708:488880, ack 253, win 333, length 172
17:58:46.747012 IP lamp-s-1vcpu-1gb-tor1-01.ssh > 198.96.84.204.20132: Flags [P.], seq 488880:489052, ack 253, win 333, length 172
17:58:46.747203 IP lamp-s-1vcpu-1gb-tor1-01.ssh > 198.96.84.204.20132: Flags [P.], seq 489052:489224, ack 253, win 333, length 172
17:58:46.747337 IP 198.96.84.204.20132 > lamp-s-1vcpu-1gb-tor1-01.ssh: Flags [.], ack 487392, win 512, length 0
17:58:46.747527 IP lamp-s-1vcpu-1gb-tor1-01.ssh > 198.96.84.204.20132: Flags [P.], seq 489224:489508, ack 253, win 333, length 284
17:58:46.747731 IP lamp-s-1vcpu-1gb-tor1-01.ssh > 198.96.84.204.20132: Flags [P.], seq 489508:489680, ack 253, win 333, length 172
17:58:46.747931 IP lamp-s-1vcpu-1gb-tor1-01.ssh > 198.96.84.204.20132: Flags [P.], seq 489680:489852, ack 253, win 333, length 172
17:58:46.748083 IP 198.96.84.204.20132 > lamp-s-1vcpu-1gb-tor1-01.ssh: Flags [.], ack 488364, win 509, length 0
17:58:46.748264 IP lamp-s-1vcpu-1gb-tor1-01.ssh > 198.96.84.204.20132: Flags [P.], seq 489852:490136, ack 253, win 333, length 284
17:58:46.748464 IP lamp-s-1vcpu-1gb-tor1-01.ssh > 198.96.84.204.20132: Flags [P.], seq 490136:490308, ack 253, win 333, length 172
17:58:46.748626 IP lamp-s-1vcpu-1gb-tor1-01.ssh > 198.96.84.204.20132: Flags [P.], seq 490308:490480, ack 253, win 333, length 172
17:58:46.748809 IP lamp-s-1vcpu-1gb-tor1-01.ssh > 198.96.84.204.20132: Flags [P.], seq 490480:490652, ack 253, win 333, length 172
17:58:46.748918 IP 198.96.84.204.20132 > lamp-s-1vcpu-1gb-tor1-01.ssh: Flags [.], ack 489052, win 512, length 0
17:58:46.749115 IP lamp-s-1vcpu-1gb-tor1-01.ssh > 198.96.84.204.20132: Flags [P.], seq 490652:490936, ack 253, win 333, length 284
17:58:46.749317 IP lamp-s-1vcpu-1gb-tor1-01.ssh > 198.96.84.204.20132: Flags [P.], seq 490936:491108, ack 253, win 333, length 172
17:58:46.749561 IP lamp-s-1vcpu-1gb-tor1-01.ssh > 198.96.84.204.20132: Flags [P.], seq 491108:491280, ack 253, win 333, length 172
17:58:46.749754 IP lamp-s-1vcpu-1gb-tor1-01.ssh > 198.96.84.204.20132: Flags [P.], seq 491280:491452, ack 253, win 333, length 172
17:58:46.749909 IP 198.96.84.204.20132 > lamp-s-1vcpu-1gb-tor1-01.ssh: Flags [.], ack 489852, win 509, length 0
17:58:46.750066 IP lamp-s-1vcpu-1gb-tor1-01.ssh > 198.96.84.204.20132: Flags [P.], seq 491452:491736, ack 253, win 333, length 284
17:58:46.750231 IP lamp-s-1vcpu-1gb-tor1-01.ssh > 198.96.84.204.20132: Flags [P.], seq 491736:491908, ack 253, win 333, length 172
17:58:46.750422 IP lamp-s-1vcpu-1gb-tor1-01.ssh > 198.96.84.204.20132: Flags [P.], seq 491908:492080, ack 253, win 333, length 172
17:58:46.750630 IP 198.96.84.204.20132 > lamp-s-1vcpu-1gb-tor1-01.ssh: Flags [.], ack 490652, win 512, length 0
17:58:46.750655 IP lamp-s-1vcpu-1gb-tor1-01.ssh > 198.96.84.204.20132: Flags [P.], seq 492080:492252, ack 253, win 333, length 172
17:58:46.750821 IP lamp-s-1vcpu-1gb-tor1-01.ssh > 198.96.84.204.20132: Flags [P.], seq 492252:492536, ack 253, win 333, length 284
17:58:46.750956 IP lamp-s-1vcpu-1gb-tor1-01.ssh > 198.96.84.204.20132: Flags [P.], seq 492536:492708, ack 253, win 333, length 172
17:58:46.751095 IP lamp-s-1vcpu-1gb-tor1-01.ssh > 198.96.84.204.20132: Flags [P.], seq 492708:492880, ack 253, win 333, length 172
17:58:46.751286 IP lamp-s-1vcpu-1gb-tor1-01.ssh > 198.96.84.204.20132: Flags [P.], seq 492880:493052, ack 253, win 333, length 172
17:58:46.751449 IP lamp-s-1vcpu-1gb-tor1-01.ssh > 198.96.84.204.20132: Flags [P.], seq 493052:493224, ack 253, win 333, length 172
17:58:46.751626 IP lamp-s-1vcpu-1gb-tor1-01.ssh > 198.96.84.204.20132: Flags [P.], seq 493224:493396, ack 253, win 333, length 172
17:58:46.751759 IP lamp-s-1vcpu-1gb-tor1-01.ssh > 198.96.84.204.20132: Flags [P.], seq 493396:493568, ack 253, win 333, length 172
17:58:46.751932 IP lamp-s-1vcpu-1gb-tor1-01.ssh > 198.96.84.204.20132: Flags [P.], seq 493568:493740, ack 253, win 333, length 172
17:58:46.752095 IP lamp-s-1vcpu-1gb-tor1-01.ssh > 198.96.84.204.20132: Flags [P.], seq 493740:493912, ack 253, win 333, length 172
17:58:46.752246 IP lamp-s-1vcpu-1gb-tor1-01.ssh > 198.96.84.204.20132: Flags [P.], seq 493912:494084, ack 253, win 333, length 172
17:58:46.752460 IP lamp-s-1vcpu-1gb-tor1-01.ssh > 198.96.84.204.20132: Flags [P.], seq 494084:494256, ack 253, win 333, length 172
17:58:46.752599 IP lamp-s-1vcpu-1gb-tor1-01.ssh > 198.96.84.204.20132: Flags [P.], seq 494256:494428, ack 253, win 333, length 172
17:58:46.752780 IP lamp-s-1vcpu-1gb-tor1-01.ssh > 198.96.84.204.20132: Flags [P.], seq 494428:494600, ack 253, win 333, length 172
17:58:46.752957 IP lamp-s-1vcpu-1gb-tor1-01.ssh > 198.96.84.204.20132: Flags [P.], seq 494600:494772, ack 253, win 333, length 172
17:58:46.753135 IP lamp-s-1vcpu-1gb-tor1-01.ssh > 198.96.84.204.20132: Flags [P.], seq 494772:494944, ack 253, win 333, length 172
17:58:46.753272 IP lamp-s-1vcpu-1gb-tor1-01.ssh > 198.96.84.204.20132: Flags [P.], seq 494944:495116, ack 253, win 333, length 172
17:58:46.753345 IP 198.96.84.204.20132 > lamp-s-1vcpu-1gb-tor1-01.ssh: Flags [.], ack 492080, win 512, length 0
17:58:46.753569 IP lamp-s-1vcpu-1gb-tor1-01.ssh > 198.96.84.204.20132: Flags [P.], seq 495116:495400, ack 253, win 333, length 284
17:58:46.753761 IP lamp-s-1vcpu-1gb-tor1-01.ssh > 198.96.84.204.20132: Flags [P.], seq 495400:495572, ack 253, win 333, length 172
17:58:46.753897 IP lamp-s-1vcpu-1gb-tor1-01.ssh > 198.96.84.204.20132: Flags [P.], seq 495572:495744, ack 253, win 333, length 172
17:58:46.754029 IP lamp-s-1vcpu-1gb-tor1-01.ssh > 198.96.84.204.20132: Flags [P.], seq 495744:495916, ack 253, win 333, length 172
17:58:46.754159 IP 198.96.84.204.20132 > lamp-s-1vcpu-1gb-tor1-01.ssh: Flags [.], ack 493568, win 512, length 0
17:58:46.754330 IP lamp-s-1vcpu-1gb-tor1-01.ssh > 198.96.84.204.20132: Flags [P.], seq 495916:496200, ack 253, win 333, length 284
17:58:46.754467 IP lamp-s-1vcpu-1gb-tor1-01.ssh > 198.96.84.204.20132: Flags [P.], seq 496200:496372, ack 253, win 333, length 172
17:58:46.754586 IP lamp-s-1vcpu-1gb-tor1-01.ssh > 198.96.84.204.20132: Flags [P.], seq 496372:496544, ack 253, win 333, length 172
17:58:46.754723 IP lamp-s-1vcpu-1gb-tor1-01.ssh > 198.96.84.204.20132: Flags [P.], seq 496544:496716, ack 253, win 333, length 172
17:58:46.754882 IP lamp-s-1vcpu-1gb-tor1-01.ssh > 198.96.84.204.20132: Flags [P.], seq 496716:496888, ack 253, win 333, length 172
17:58:46.755051 IP lamp-s-1vcpu-1gb-tor1-01.ssh > 198.96.84.204.20132: Flags [P.], seq 496888:497060, ack 253, win 333, length 172
17:58:46.755178 IP lamp-s-1vcpu-1gb-tor1-01.ssh > 198.96.84.204.20132: Flags [P.], seq 497060:497232, ack 253, win 333, length 172
17:58:46.755293 IP lamp-s-1vcpu-1gb-tor1-01.ssh > 198.96.84.204.20132: Flags [P.], seq 497232:497404, ack 253, win 333, length 172
17:58:46.755406 IP lamp-s-1vcpu-1gb-tor1-01.ssh > 198.96.84.204.20132: Flags [P.], seq 497404:497576, ack 253, win 333, length 172
17:58:46.755572 IP lamp-s-1vcpu-1gb-tor1-01.ssh > 198.96.84.204.20132: Flags [P.], seq 497576:497748, ack 253, win 333, length 172
17:58:46.755727 IP lamp-s-1vcpu-1gb-tor1-01.ssh > 198.96.84.204.20132: Flags [P.], seq 497748:497920, ack 253, win 333, length 172
17:58:46.755876 IP lamp-s-1vcpu-1gb-tor1-01.ssh > 198.96.84.204.20132: Flags [P.], seq 497920:498092, ack 253, win 333, length 172
17:58:46.755995 IP lamp-s-1vcpu-1gb-tor1-01.ssh > 198.96.84.204.20132: Flags [P.], seq 498092:498264, ack 253, win 333, length 172
17:58:46.756104 IP 198.96.84.204.20132 > lamp-s-1vcpu-1gb-tor1-01.ssh: Flags [.], ack 495400, win 512, length 0
17:58:46.756268 IP lamp-s-1vcpu-1gb-tor1-01.ssh > 198.96.84.204.20132: Flags [P.], seq 498264:498436, ack 253, win 333, length 172
17:58:46.756452 IP lamp-s-1vcpu-1gb-tor1-01.ssh > 198.96.84.204.20132: Flags [P.], seq 498436:498584, ack 253, win 333, length 148
17:58:46.756586 IP lamp-s-1vcpu-1gb-tor1-01.ssh > 198.96.84.204.20132: Flags [P.], seq 498584:498756, ack 253, win 333, length 172
17:58:46.756693 IP lamp-s-1vcpu-1gb-tor1-01.ssh > 198.96.84.204.20132: Flags [P.], seq 498756:498928, ack 253, win 333, length 172
17:58:46.756795 IP lamp-s-1vcpu-1gb-tor1-01.ssh > 198.96.84.204.20132: Flags [P.], seq 498928:499100, ack 253, win 333, length 172
17:58:46.756897 IP lamp-s-1vcpu-1gb-tor1-01.ssh > 198.96.84.204.20132: Flags [P.], seq 499100:499272, ack 253, win 333, length 172
17:58:46.757001 IP lamp-s-1vcpu-1gb-tor1-01.ssh > 198.96.84.204.20132: Flags [P.], seq 499272:499444, ack 253, win 333, length 172
17:58:46.757156 IP lamp-s-1vcpu-1gb-tor1-01.ssh > 198.96.84.204.20132: Flags [P.], seq 499444:499616, ack 253, win 333, length 172
17:58:46.757294 IP lamp-s-1vcpu-1gb-tor1-01.ssh > 198.96.84.204.20132: Flags [P.], seq 499616:499788, ack 253, win 333, length 172
17:58:46.757470 IP lamp-s-1vcpu-1gb-tor1-01.ssh > 198.96.84.204.20132: Flags [P.], seq 499788:499960, ack 253, win 333, length 172
17:58:46.757585 IP lamp-s-1vcpu-1gb-tor1-01.ssh > 198.96.84.204.20132: Flags [P.], seq 499960:500132, ack 253, win 333, length 172
17:58:46.757634 IP lamp-s-1vcpu-1gb-tor1-01.ssh > 198.96.84.204.20132: Flags [P.], seq 500132:500304, ack 253, win 333, length 172
17:58:46.757788 IP lamp-s-1vcpu-1gb-tor1-01.ssh > 198.96.84.204.20132: Flags [P.], seq 500304:500604, ack 253, win 333, length 300
17:58:46.757978 IP lamp-s-1vcpu-1gb-tor1-01.ssh > 198.96.84.204.20132: Flags [P.], seq 500604:500776, ack 253, win 333, length 172
17:58:46.758142 IP 198.96.84.204.20132 > lamp-s-1vcpu-1gb-tor1-01.ssh: Flags [.], ack 498264, win 512, length 0
17:58:46.758334 IP lamp-s-1vcpu-1gb-tor1-01.ssh > 198.96.84.204.20132: Flags [P.], seq 500776:501060, ack 253, win 333, length 284
17:58:46.758489 IP 198.96.84.204.20132 > lamp-s-1vcpu-1gb-tor1-01.ssh: Flags [P.], seq 253:289, ack 498264, win 512, length 36
17:58:46.758680 IP lamp-s-1vcpu-1gb-tor1-01.ssh > 198.96.84.204.20132: Flags [P.], seq 501060:501360, ack 289, win 333, length 300
17:58:46.758862 IP lamp-s-1vcpu-1gb-tor1-01.ssh > 198.96.84.204.20132: Flags [P.], seq 501360:501532, ack 289, win 333, length 172
17:58:46.759035 IP lamp-s-1vcpu-1gb-tor1-01.ssh > 198.96.84.204.20132: Flags [P.], seq 501532:501704, ack 289, win 333, length 172
17:58:46.759166 IP lamp-s-1vcpu-1gb-tor1-01.ssh > 198.96.84.204.20132: Flags [P.], seq 501704:501876, ack 289, win 333, length 172
17:58:46.759279 IP lamp-s-1vcpu-1gb-tor1-01.ssh > 198.96.84.204.20132: Flags [P.], seq 501876:502048, ack 289, win 333, length 172
17:58:46.759421 IP lamp-s-1vcpu-1gb-tor1-01.ssh > 198.96.84.204.20132: Flags [P.], seq 502048:502220, ack 289, win 333, length 172
17:58:46.759593 IP lamp-s-1vcpu-1gb-tor1-01.ssh > 198.96.84.204.20132: Flags [P.], seq 502220:502392, ack 289, win 333, length 172
17:58:46.759772 IP lamp-s-1vcpu-1gb-tor1-01.ssh > 198.96.84.204.20132: Flags [P.], seq 502392:502564, ack 289, win 333, length 172
17:58:46.759904 IP lamp-s-1vcpu-1gb-tor1-01.ssh > 198.96.84.204.20132: Flags [P.], seq 502564:502736, ack 289, win 333, length 172
17:58:46.760021 IP lamp-s-1vcpu-1gb-tor1-01.ssh > 198.96.84.204.20132: Flags [P.], seq 502736:502908, ack 289, win 333, length 172
17:58:46.760135 IP lamp-s-1vcpu-1gb-tor1-01.ssh > 198.96.84.204.20132: Flags [P.], seq 502908:503080, ack 289, win 333, length 172
17:58:46.760310 IP lamp-s-1vcpu-1gb-tor1-01.ssh > 198.96.84.204.20132: Flags [P.], seq 503080:503252, ack 289, win 333, length 172
17:58:46.760537 IP lamp-s-1vcpu-1gb-tor1-01.ssh > 198.96.84.204.20132: Flags [P.], seq 503252:503424, ack 289, win 333, length 172
17:58:46.760591 IP 198.96.84.204.20132 > lamp-s-1vcpu-1gb-tor1-01.ssh: Flags [.], ack 500776, win 512, length 0
17:58:46.760834 IP lamp-s-1vcpu-1gb-tor1-01.ssh > 198.96.84.204.20132: Flags [P.], seq 503424:503708, ack 289, win 333, length 284
17:58:46.761038 IP lamp-s-1vcpu-1gb-tor1-01.ssh > 198.96.84.204.20132: Flags [P.], seq 503708:503880, ack 289, win 333, length 172
17:58:46.761215 IP lamp-s-1vcpu-1gb-tor1-01.ssh > 198.96.84.204.20132: Flags [P.], seq 503880:504052, ack 289, win 333, length 172
17:58:46.761376 IP lamp-s-1vcpu-1gb-tor1-01.ssh > 198.96.84.204.20132: Flags [P.], seq 504052:504224, ack 289, win 333, length 172
17:58:46.761576 IP lamp-s-1vcpu-1gb-tor1-01.ssh > 198.96.84.204.20132: Flags [P.], seq 504224:504396, ack 289, win 333, length 172
17:58:46.761732 IP lamp-s-1vcpu-1gb-tor1-01.ssh > 198.96.84.204.20132: Flags [P.], seq 504396:504568, ack 289, win 333, length 172
17:58:46.761857 IP lamp-s-1vcpu-1gb-tor1-01.ssh > 198.96.84.204.20132: Flags [P.], seq 504568:504740, ack 289, win 333, length 172
17:58:46.761973 IP lamp-s-1vcpu-1gb-tor1-01.ssh > 198.96.84.204.20132: Flags [P.], seq 504740:504912, ack 289, win 333, length 172
17:58:46.762113 IP lamp-s-1vcpu-1gb-tor1-01.ssh > 198.96.84.204.20132: Flags [P.], seq 504912:505084, ack 289, win 333, length 172
17:58:46.762272 IP lamp-s-1vcpu-1gb-tor1-01.ssh > 198.96.84.204.20132: Flags [P.], seq 505084:505256, ack 289, win 333, length 172
17:58:46.762439 IP lamp-s-1vcpu-1gb-tor1-01.ssh > 198.96.84.204.20132: Flags [P.], seq 505256:505428, ack 289, win 333, length 172
17:58:46.762566 IP lamp-s-1vcpu-1gb-tor1-01.ssh > 198.96.84.204.20132: Flags [P.], seq 505428:505600, ack 289, win 333, length 172
17:58:46.762683 IP lamp-s-1vcpu-1gb-tor1-01.ssh > 198.96.84.204.20132: Flags [P.], seq 505600:505772, ack 289, win 333, length 172
17:58:46.762833 IP lamp-s-1vcpu-1gb-tor1-01.ssh > 198.96.84.204.20132: Flags [P.], seq 505772:505944, ack 289, win 333, length 172
17:58:46.762988 IP lamp-s-1vcpu-1gb-tor1-01.ssh > 198.96.84.204.20132: Flags [P.], seq 505944:506116, ack 289, win 333, length 172
17:58:46.763154 IP lamp-s-1vcpu-1gb-tor1-01.ssh > 198.96.84.204.20132: Flags [P.], seq 506116:506288, ack 289, win 333, length 172
17:58:46.763288 IP lamp-s-1vcpu-1gb-tor1-01.ssh > 198.96.84.204.20132: Flags [P.], seq 506288:506460, ack 289, win 333, length 172
17:58:46.763429 IP lamp-s-1vcpu-1gb-tor1-01.ssh > 198.96.84.204.20132: Flags [P.], seq 506460:506632, ack 289, win 333, length 172
17:58:46.763603 IP lamp-s-1vcpu-1gb-tor1-01.ssh > 198.96.84.204.20132: Flags [P.], seq 506632:506804, ack 289, win 333, length 172
17:58:46.763759 IP lamp-s-1vcpu-1gb-tor1-01.ssh > 198.96.84.204.20132: Flags [P.], seq 506804:506976, ack 289, win 333, length 172
17:58:46.763922 IP lamp-s-1vcpu-1gb-tor1-01.ssh > 198.96.84.204.20132: Flags [P.], seq 506976:507148, ack 289, win 333, length 172
17:58:46.764050 IP lamp-s-1vcpu-1gb-tor1-01.ssh > 198.96.84.204.20132: Flags [P.], seq 507148:507320, ack 289, win 333, length 172
17:58:46.764191 IP lamp-s-1vcpu-1gb-tor1-01.ssh > 198.96.84.204.20132: Flags [P.], seq 507320:507492, ack 289, win 333, length 172
17:58:46.764355 IP lamp-s-1vcpu-1gb-tor1-01.ssh > 198.96.84.204.20132: Flags [P.], seq 507492:507664, ack 289, win 333, length 172
17:58:46.764541 IP lamp-s-1vcpu-1gb-tor1-01.ssh > 198.96.84.204.20132: Flags [P.], seq 507664:507836, ack 289, win 333, length 172
17:58:46.764670 IP lamp-s-1vcpu-1gb-tor1-01.ssh > 198.96.84.204.20132: Flags [P.], seq 507836:508008, ack 289, win 333, length 172
17:58:46.764785 IP lamp-s-1vcpu-1gb-tor1-01.ssh > 198.96.84.204.20132: Flags [P.], seq 508008:508180, ack 289, win 333, length 172
17:58:46.764903 IP lamp-s-1vcpu-1gb-tor1-01.ssh > 198.96.84.204.20132: Flags [P.], seq 508180:508352, ack 289, win 333, length 172
17:58:46.765019 IP lamp-s-1vcpu-1gb-tor1-01.ssh > 198.96.84.204.20132: Flags [P.], seq 508352:508524, ack 289, win 333, length 172
17:58:46.765192 IP lamp-s-1vcpu-1gb-tor1-01.ssh > 198.96.84.204.20132: Flags [P.], seq 508524:508696, ack 289, win 333, length 172
17:58:46.765355 IP lamp-s-1vcpu-1gb-tor1-01.ssh > 198.96.84.204.20132: Flags [P.], seq 508696:508868, ack 289, win 333, length 172
17:58:46.765535 IP lamp-s-1vcpu-1gb-tor1-01.ssh > 198.96.84.204.20132: Flags [P.], seq 508868:509040, ack 289, win 333, length 172
17:58:46.765722 IP lamp-s-1vcpu-1gb-tor1-01.ssh > 198.96.84.204.20132: Flags [P.], seq 509040:509212, ack 289, win 333, length 172
17:58:46.765917 IP lamp-s-1vcpu-1gb-tor1-01.ssh > 198.96.84.204.20132: Flags [P.], seq 509212:509384, ack 289, win 333, length 172
17:58:46.766113 IP lamp-s-1vcpu-1gb-tor1-01.ssh > 198.96.84.204.20132: Flags [P.], seq 509384:509556, ack 289, win 333, length 172
17:58:46.766293 IP lamp-s-1vcpu-1gb-tor1-01.ssh > 198.96.84.204.20132: Flags [P.], seq 509556:509728, ack 289, win 333, length 172
17:58:46.766482 IP lamp-s-1vcpu-1gb-tor1-01.ssh > 198.96.84.204.20132: Flags [P.], seq 509728:509900, ack 289, win 333, length 172
17:58:46.766669 IP lamp-s-1vcpu-1gb-tor1-01.ssh > 198.96.84.204.20132: Flags [P.], seq 509900:510072, ack 289, win 333, length 172
17:58:46.766836 IP lamp-s-1vcpu-1gb-tor1-01.ssh > 198.96.84.204.20132: Flags [P.], seq 510072:510244, ack 289, win 333, length 172
17:58:46.767030 IP lamp-s-1vcpu-1gb-tor1-01.ssh > 198.96.84.204.20132: Flags [P.], seq 510244:510416, ack 289, win 333, length 172
17:58:46.767200 IP lamp-s-1vcpu-1gb-tor1-01.ssh > 198.96.84.204.20132: Flags [P.], seq 510416:510588, ack 289, win 333, length 172
17:58:46.767338 IP lamp-s-1vcpu-1gb-tor1-01.ssh > 198.96.84.204.20132: Flags [P.], seq 510588:510760, ack 289, win 333, length 172
17:58:46.767500 IP lamp-s-1vcpu-1gb-tor1-01.ssh > 198.96.84.204.20132: Flags [P.], seq 510760:510932, ack 289, win 333, length 172
17:58:46.767683 IP lamp-s-1vcpu-1gb-tor1-01.ssh > 198.96.84.204.20132: Flags [P.], seq 510932:511104, ack 289, win 333, length 172
17:58:46.767865 IP lamp-s-1vcpu-1gb-tor1-01.ssh > 198.96.84.204.20132: Flags [P.], seq 511104:511276, ack 289, win 333, length 172
17:58:46.768840 IP 198.96.84.204.20132 > lamp-s-1vcpu-1gb-tor1-01.ssh: Flags [.], ack 506632, win 512, length 0
17:58:46.768913 IP lamp-s-1vcpu-1gb-tor1-01.ssh > 198.96.84.204.20132: Flags [P.], seq 511276:511448, ack 289, win 333, length 172
17:58:46.768949 IP 198.96.84.204.20132 > lamp-s-1vcpu-1gb-tor1-01.ssh: Flags [.], ack 507320, win 510, length 0
17:58:46.769174 IP 198.96.84.204.20132 > lamp-s-1vcpu-1gb-tor1-01.ssh: Flags [.], ack 508868, win 512, length 0
17:58:46.769265 IP lamp-s-1vcpu-1gb-tor1-01.ssh > 198.96.84.204.20132: Flags [P.], seq 511448:511844, ack 289, win 333, length 396
17:58:46.769580 IP lamp-s-1vcpu-1gb-tor1-01.ssh > 198.96.84.204.20132: Flags [P.], seq 511844:512128, ack 289, win 333, length 284
17:58:46.769775 IP lamp-s-1vcpu-1gb-tor1-01.ssh > 198.96.84.204.20132: Flags [P.], seq 512128:512300, ack 289, win 333, length 172
17:58:46.769959 IP lamp-s-1vcpu-1gb-tor1-01.ssh > 198.96.84.204.20132: Flags [P.], seq 512300:512472, ack 289, win 333, length 172
17:58:46.770129 IP lamp-s-1vcpu-1gb-tor1-01.ssh > 198.96.84.204.20132: Flags [P.], seq 512472:512644, ack 289, win 333, length 172
17:58:46.770299 IP lamp-s-1vcpu-1gb-tor1-01.ssh > 198.96.84.204.20132: Flags [P.], seq 512644:512816, ack 289, win 333, length 172
17:58:46.770476 IP lamp-s-1vcpu-1gb-tor1-01.ssh > 198.96.84.204.20132: Flags [P.], seq 512816:512988, ack 289, win 333, length 172
17:58:46.770664 IP lamp-s-1vcpu-1gb-tor1-01.ssh > 198.96.84.204.20132: Flags [P.], seq 512988:513160, ack 289, win 333, length 172
17:58:46.770781 IP 198.96.84.204.20132 > lamp-s-1vcpu-1gb-tor1-01.ssh: Flags [.], ack 510760, win 512, length 0
17:58:46.770915 IP lamp-s-1vcpu-1gb-tor1-01.ssh > 198.96.84.204.20132: Flags [P.], seq 513160:513444, ack 289, win 333, length 284
17:58:46.770951 IP 198.96.84.204.20132 > lamp-s-1vcpu-1gb-tor1-01.ssh: Flags [.], ack 511448, win 510, length 0
17:58:46.771091 IP lamp-s-1vcpu-1gb-tor1-01.ssh > 198.96.84.204.20132: Flags [P.], seq 513444:513728, ack 289, win 333, length 284
17:58:46.771217 IP lamp-s-1vcpu-1gb-tor1-01.ssh > 198.96.84.204.20132: Flags [P.], seq 513728:513900, ack 289, win 333, length 172
17:58:46.771384 IP lamp-s-1vcpu-1gb-tor1-01.ssh > 198.96.84.204.20132: Flags [P.], seq 513900:514072, ack 289, win 333, length 172
17:58:46.771511 IP lamp-s-1vcpu-1gb-tor1-01.ssh > 198.96.84.204.20132: Flags [P.], seq 514072:514244, ack 289, win 333, length 172
17:58:46.771675 IP lamp-s-1vcpu-1gb-tor1-01.ssh > 198.96.84.204.20132: Flags [P.], seq 514244:514416, ack 289, win 333, length 172
17:58:46.771866 IP lamp-s-1vcpu-1gb-tor1-01.ssh > 198.96.84.204.20132: Flags [P.], seq 514416:514588, ack 289, win 333, length 172
17:58:46.772060 IP lamp-s-1vcpu-1gb-tor1-01.ssh > 198.96.84.204.20132: Flags [P.], seq 514588:514760, ack 289, win 333, length 172
17:58:46.772253 IP lamp-s-1vcpu-1gb-tor1-01.ssh > 198.96.84.204.20132: Flags [P.], seq 514760:514932, ack 289, win 333, length 172
17:58:46.772331 IP 198.96.84.204.20132 > lamp-s-1vcpu-1gb-tor1-01.ssh: Flags [.], ack 512472, win 512, length 0
17:58:46.772591 IP lamp-s-1vcpu-1gb-tor1-01.ssh > 198.96.84.204.20132: Flags [P.], seq 514932:515216, ack 289, win 333, length 284
17:58:46.772739 IP lamp-s-1vcpu-1gb-tor1-01.ssh > 198.96.84.204.20132: Flags [P.], seq 515216:515388, ack 289, win 333, length 172
17:58:46.772917 IP lamp-s-1vcpu-1gb-tor1-01.ssh > 198.96.84.204.20132: Flags [P.], seq 515388:515560, ack 289, win 333, length 172
17:58:46.773092 IP lamp-s-1vcpu-1gb-tor1-01.ssh > 198.96.84.204.20132: Flags [P.], seq 515560:515732, ack 289, win 333, length 172
17:58:46.773269 IP lamp-s-1vcpu-1gb-tor1-01.ssh > 198.96.84.204.20132: Flags [P.], seq 515732:515904, ack 289, win 333, length 172
17:58:46.773480 IP lamp-s-1vcpu-1gb-tor1-01.ssh > 198.96.84.204.20132: Flags [P.], seq 515904:516076, ack 289, win 333, length 172
17:58:46.773615 IP lamp-s-1vcpu-1gb-tor1-01.ssh > 198.96.84.204.20132: Flags [P.], seq 516076:516248, ack 289, win 333, length 172
17:58:46.773794 IP lamp-s-1vcpu-1gb-tor1-01.ssh > 198.96.84.204.20132: Flags [P.], seq 516248:516420, ack 289, win 333, length 172
17:58:46.773956 IP lamp-s-1vcpu-1gb-tor1-01.ssh > 198.96.84.204.20132: Flags [P.], seq 516420:516592, ack 289, win 333, length 172
17:58:46.774105 IP lamp-s-1vcpu-1gb-tor1-01.ssh > 198.96.84.204.20132: Flags [P.], seq 516592:516764, ack 289, win 333, length 172
17:58:46.774291 IP lamp-s-1vcpu-1gb-tor1-01.ssh > 198.96.84.204.20132: Flags [P.], seq 516764:516936, ack 289, win 333, length 172
17:58:46.774434 IP lamp-s-1vcpu-1gb-tor1-01.ssh > 198.96.84.204.20132: Flags [P.], seq 516936:517108, ack 289, win 333, length 172
17:58:46.774618 IP lamp-s-1vcpu-1gb-tor1-01.ssh > 198.96.84.204.20132: Flags [P.], seq 517108:517280, ack 289, win 333, length 172
17:58:46.774813 IP lamp-s-1vcpu-1gb-tor1-01.ssh > 198.96.84.204.20132: Flags [P.], seq 517280:517452, ack 289, win 333, length 172
17:58:46.774970 IP 198.96.84.204.20132 > lamp-s-1vcpu-1gb-tor1-01.ssh: Flags [.], ack 512988, win 510, length 0
17:58:46.775160 IP lamp-s-1vcpu-1gb-tor1-01.ssh > 198.96.84.204.20132: Flags [P.], seq 517452:517736, ack 289, win 333, length 284
17:58:46.775367 IP lamp-s-1vcpu-1gb-tor1-01.ssh > 198.96.84.204.20132: Flags [P.], seq 517736:517908, ack 289, win 333, length 172
17:58:46.775565 IP lamp-s-1vcpu-1gb-tor1-01.ssh > 198.96.84.204.20132: Flags [P.], seq 517908:518080, ack 289, win 333, length 172
17:58:46.775737 IP lamp-s-1vcpu-1gb-tor1-01.ssh > 198.96.84.204.20132: Flags [P.], seq 518080:518252, ack 289, win 333, length 172
17:58:46.775905 IP lamp-s-1vcpu-1gb-tor1-01.ssh > 198.96.84.204.20132: Flags [P.], seq 518252:518424, ack 289, win 333, length 172
17:58:46.776058 IP lamp-s-1vcpu-1gb-tor1-01.ssh > 198.96.84.204.20132: Flags [P.], seq 518424:518596, ack 289, win 333, length 172
17:58:46.776217 IP lamp-s-1vcpu-1gb-tor1-01.ssh > 198.96.84.204.20132: Flags [P.], seq 518596:518768, ack 289, win 333, length 172
17:58:46.776402 IP lamp-s-1vcpu-1gb-tor1-01.ssh > 198.96.84.204.20132: Flags [P.], seq 518768:518940, ack 289, win 333, length 172
17:58:46.776528 IP lamp-s-1vcpu-1gb-tor1-01.ssh > 198.96.84.204.20132: Flags [P.], seq 518940:519112, ack 289, win 333, length 172
17:58:46.776621 IP lamp-s-1vcpu-1gb-tor1-01.ssh > 198.96.84.204.20132: Flags [P.], seq 519112:519284, ack 289, win 333, length 172
17:58:46.776743 IP lamp-s-1vcpu-1gb-tor1-01.ssh > 198.96.84.204.20132: Flags [P.], seq 519284:519456, ack 289, win 333, length 172
17:58:46.776859 IP lamp-s-1vcpu-1gb-tor1-01.ssh > 198.96.84.204.20132: Flags [P.], seq 519456:519628, ack 289, win 333, length 172
17:58:46.776944 IP 198.96.84.204.20132 > lamp-s-1vcpu-1gb-tor1-01.ssh: Flags [.], ack 517108, win 512, length 0
17:58:46.777109 IP 198.96.84.204.20132 > lamp-s-1vcpu-1gb-tor1-01.ssh: Flags [.], ack 517736, win 510, length 0
17:58:46.777215 IP lamp-s-1vcpu-1gb-tor1-01.ssh > 198.96.84.204.20132: Flags [P.], seq 519628:519912, ack 289, win 333, length 284
17:58:46.777497 IP lamp-s-1vcpu-1gb-tor1-01.ssh > 198.96.84.204.20132: Flags [P.], seq 519912:520196, ack 289, win 333, length 284
17:58:46.777686 IP lamp-s-1vcpu-1gb-tor1-01.ssh > 198.96.84.204.20132: Flags [P.], seq 520196:520368, ack 289, win 333, length 172
17:58:46.777856 IP lamp-s-1vcpu-1gb-tor1-01.ssh > 198.96.84.204.20132: Flags [P.], seq 520368:520540, ack 289, win 333, length 172
17:58:46.778029 IP lamp-s-1vcpu-1gb-tor1-01.ssh > 198.96.84.204.20132: Flags [P.], seq 520540:520712, ack 289, win 333, length 172
17:58:46.778213 IP lamp-s-1vcpu-1gb-tor1-01.ssh > 198.96.84.204.20132: Flags [P.], seq 520712:520884, ack 289, win 333, length 172
17:58:46.778393 IP lamp-s-1vcpu-1gb-tor1-01.ssh > 198.96.84.204.20132: Flags [P.], seq 520884:521056, ack 289, win 333, length 172
17:58:46.778520 IP lamp-s-1vcpu-1gb-tor1-01.ssh > 198.96.84.204.20132: Flags [P.], seq 521056:521228, ack 289, win 333, length 172
17:58:46.778658 IP 198.96.84.204.20132 > lamp-s-1vcpu-1gb-tor1-01.ssh: Flags [.], ack 518768, win 512, length 0
17:58:46.778807 IP lamp-s-1vcpu-1gb-tor1-01.ssh > 198.96.84.204.20132: Flags [P.], seq 521228:521400, ack 289, win 333, length 172
17:58:46.778855 IP 198.96.84.204.20132 > lamp-s-1vcpu-1gb-tor1-01.ssh: Flags [.], ack 519628, win 509, length 0
17:58:46.779053 IP lamp-s-1vcpu-1gb-tor1-01.ssh > 198.96.84.204.20132: Flags [P.], seq 521400:521796, ack 289, win 333, length 396
17:58:46.779184 IP lamp-s-1vcpu-1gb-tor1-01.ssh > 198.96.84.204.20132: Flags [P.], seq 521796:521968, ack 289, win 333, length 172
17:58:46.779346 IP lamp-s-1vcpu-1gb-tor1-01.ssh > 198.96.84.204.20132: Flags [P.], seq 521968:522140, ack 289, win 333, length 172
17:58:46.779513 IP lamp-s-1vcpu-1gb-tor1-01.ssh > 198.96.84.204.20132: Flags [P.], seq 522140:522312, ack 289, win 333, length 172
17:58:46.779700 IP lamp-s-1vcpu-1gb-tor1-01.ssh > 198.96.84.204.20132: Flags [P.], seq 522312:522484, ack 289, win 333, length 172
17:58:46.779871 IP lamp-s-1vcpu-1gb-tor1-01.ssh > 198.96.84.204.20132: Flags [P.], seq 522484:522656, ack 289, win 333, length 172
17:58:46.779993 IP lamp-s-1vcpu-1gb-tor1-01.ssh > 198.96.84.204.20132: Flags [P.], seq 522656:522828, ack 289, win 333, length 172
17:58:46.780175 IP lamp-s-1vcpu-1gb-tor1-01.ssh > 198.96.84.204.20132: Flags [P.], seq 522828:523000, ack 289, win 333, length 172
17:58:46.780213 IP 198.96.84.204.20132 > lamp-s-1vcpu-1gb-tor1-01.ssh: Flags [.], ack 520540, win 512, length 0
17:58:46.780255 IP 198.96.84.204.20132 > lamp-s-1vcpu-1gb-tor1-01.ssh: Flags [.], ack 521056, win 510, length 0
17:58:46.780457 IP lamp-s-1vcpu-1gb-tor1-01.ssh > 198.96.84.204.20132: Flags [P.], seq 523000:523396, ack 289, win 333, length 396
17:58:46.780658 IP lamp-s-1vcpu-1gb-tor1-01.ssh > 198.96.84.204.20132: Flags [P.], seq 523396:523568, ack 289, win 333, length 172
17:58:46.780839 IP lamp-s-1vcpu-1gb-tor1-01.ssh > 198.96.84.204.20132: Flags [P.], seq 523568:523740, ack 289, win 333, length 172
17:58:46.781024 IP lamp-s-1vcpu-1gb-tor1-01.ssh > 198.96.84.204.20132: Flags [P.], seq 523740:523912, ack 289, win 333, length 172
17:58:46.781201 IP lamp-s-1vcpu-1gb-tor1-01.ssh > 198.96.84.204.20132: Flags [P.], seq 523912:524084, ack 289, win 333, length 172
17:58:46.781325 IP 198.96.84.204.20132 > lamp-s-1vcpu-1gb-tor1-01.ssh: Flags [.], ack 522140, win 512, length 0
17:58:46.781465 IP lamp-s-1vcpu-1gb-tor1-01.ssh > 198.96.84.204.20132: Flags [P.], seq 524084:524256, ack 289, win 333, length 172
17:58:46.781577 IP lamp-s-1vcpu-1gb-tor1-01.ssh > 198.96.84.204.20132: Flags [P.], seq 524256:524404, ack 289, win 333, length 148
17:58:46.781683 IP lamp-s-1vcpu-1gb-tor1-01.ssh > 198.96.84.204.20132: Flags [P.], seq 524404:524576, ack 289, win 333, length 172
17:58:46.781786 IP lamp-s-1vcpu-1gb-tor1-01.ssh > 198.96.84.204.20132: Flags [P.], seq 524576:524748, ack 289, win 333, length 172
17:58:46.781912 IP lamp-s-1vcpu-1gb-tor1-01.ssh > 198.96.84.204.20132: Flags [P.], seq 524748:524920, ack 289, win 333, length 172
17:58:46.782071 IP lamp-s-1vcpu-1gb-tor1-01.ssh > 198.96.84.204.20132: Flags [P.], seq 524920:525092, ack 289, win 333, length 172
17:58:46.782185 IP lamp-s-1vcpu-1gb-tor1-01.ssh > 198.96.84.204.20132: Flags [P.], seq 525092:525264, ack 289, win 333, length 172
17:58:46.782288 IP lamp-s-1vcpu-1gb-tor1-01.ssh > 198.96.84.204.20132: Flags [P.], seq 525264:525436, ack 289, win 333, length 172
17:58:46.782335 IP lamp-s-1vcpu-1gb-tor1-01.ssh > 198.96.84.204.20132: Flags [P.], seq 525436:525608, ack 289, win 333, length 172
17:58:46.782522 IP lamp-s-1vcpu-1gb-tor1-01.ssh > 198.96.84.204.20132: Flags [P.], seq 525608:525908, ack 289, win 333, length 300
17:58:46.783066 IP 198.96.84.204.20132 > lamp-s-1vcpu-1gb-tor1-01.ssh: Flags [.], ack 523568, win 512, length 0
17:58:46.783154 IP lamp-s-1vcpu-1gb-tor1-01.ssh > 198.96.84.204.20132: Flags [P.], seq 525908:526080, ack 289, win 333, length 172
17:58:46.783283 IP lamp-s-1vcpu-1gb-tor1-01.ssh > 198.96.84.204.20132: Flags [P.], seq 526080:526364, ack 289, win 333, length 284
17:58:46.783399 IP lamp-s-1vcpu-1gb-tor1-01.ssh > 198.96.84.204.20132: Flags [P.], seq 526364:526536, ack 289, win 333, length 172
17:58:46.783511 IP lamp-s-1vcpu-1gb-tor1-01.ssh > 198.96.84.204.20132: Flags [P.], seq 526536:526708, ack 289, win 333, length 172
17:58:46.783624 IP lamp-s-1vcpu-1gb-tor1-01.ssh > 198.96.84.204.20132: Flags [P.], seq 526708:526880, ack 289, win 333, length 172
17:58:46.783736 IP lamp-s-1vcpu-1gb-tor1-01.ssh > 198.96.84.204.20132: Flags [P.], seq 526880:527052, ack 289, win 333, length 172
17:58:46.783847 IP lamp-s-1vcpu-1gb-tor1-01.ssh > 198.96.84.204.20132: Flags [P.], seq 527052:527224, ack 289, win 333, length 172
17:58:46.783958 IP lamp-s-1vcpu-1gb-tor1-01.ssh > 198.96.84.204.20132: Flags [P.], seq 527224:527396, ack 289, win 333, length 172
17:58:46.784069 IP lamp-s-1vcpu-1gb-tor1-01.ssh > 198.96.84.204.20132: Flags [P.], seq 527396:527568, ack 289, win 333, length 172
17:58:46.784169 IP 198.96.84.204.20132 > lamp-s-1vcpu-1gb-tor1-01.ssh: Flags [.], ack 524920, win 512, length 0
17:58:46.784280 IP lamp-s-1vcpu-1gb-tor1-01.ssh > 198.96.84.204.20132: Flags [P.], seq 527568:527852, ack 289, win 333, length 284
17:58:46.784420 IP 198.96.84.204.20132 > lamp-s-1vcpu-1gb-tor1-01.ssh: Flags [.], ack 525608, win 510, length 0
17:58:46.784506 IP lamp-s-1vcpu-1gb-tor1-01.ssh > 198.96.84.204.20132: Flags [P.], seq 527852:528024, ack 289, win 333, length 172
17:58:46.784638 IP lamp-s-1vcpu-1gb-tor1-01.ssh > 198.96.84.204.20132: Flags [P.], seq 528024:528308, ack 289, win 333, length 284
17:58:46.784754 IP lamp-s-1vcpu-1gb-tor1-01.ssh > 198.96.84.204.20132: Flags [P.], seq 528308:528480, ack 289, win 333, length 172
17:58:46.784866 IP lamp-s-1vcpu-1gb-tor1-01.ssh > 198.96.84.204.20132: Flags [P.], seq 528480:528652, ack 289, win 333, length 172
17:58:46.784976 IP lamp-s-1vcpu-1gb-tor1-01.ssh > 198.96.84.204.20132: Flags [P.], seq 528652:528824, ack 289, win 333, length 172
17:58:46.785087 IP lamp-s-1vcpu-1gb-tor1-01.ssh > 198.96.84.204.20132: Flags [P.], seq 528824:528996, ack 289, win 333, length 172
17:58:46.785198 IP lamp-s-1vcpu-1gb-tor1-01.ssh > 198.96.84.204.20132: Flags [P.], seq 528996:529168, ack 289, win 333, length 172
17:58:46.785308 IP lamp-s-1vcpu-1gb-tor1-01.ssh > 198.96.84.204.20132: Flags [P.], seq 529168:529340, ack 289, win 333, length 172
17:58:46.785450 IP lamp-s-1vcpu-1gb-tor1-01.ssh > 198.96.84.204.20132: Flags [P.], seq 529340:529512, ack 289, win 333, length 172
17:58:46.785567 IP lamp-s-1vcpu-1gb-tor1-01.ssh > 198.96.84.204.20132: Flags [P.], seq 529512:529684, ack 289, win 333, length 172
17:58:46.785680 IP lamp-s-1vcpu-1gb-tor1-01.ssh > 198.96.84.204.20132: Flags [P.], seq 529684:529856, ack 289, win 333, length 172
17:58:46.785790 IP lamp-s-1vcpu-1gb-tor1-01.ssh > 198.96.84.204.20132: Flags [P.], seq 529856:530028, ack 289, win 333, length 172
17:58:46.785902 IP lamp-s-1vcpu-1gb-tor1-01.ssh > 198.96.84.204.20132: Flags [P.], seq 530028:530200, ack 289, win 333, length 172
17:58:46.786014 IP lamp-s-1vcpu-1gb-tor1-01.ssh > 198.96.84.204.20132: Flags [P.], seq 530200:530372, ack 289, win 333, length 172
17:58:46.786125 IP lamp-s-1vcpu-1gb-tor1-01.ssh > 198.96.84.204.20132: Flags [P.], seq 530372:530544, ack 289, win 333, length 172
17:58:46.786216 IP 198.96.84.204.20132 > lamp-s-1vcpu-1gb-tor1-01.ssh: Flags [.], ack 527852, win 512, length 0
17:58:46.786333 IP lamp-s-1vcpu-1gb-tor1-01.ssh > 198.96.84.204.20132: Flags [P.], seq 530544:530828, ack 289, win 333, length 284
17:58:46.786454 IP lamp-s-1vcpu-1gb-tor1-01.ssh > 198.96.84.204.20132: Flags [P.], seq 530828:531000, ack 289, win 333, length 172
17:58:46.786565 IP lamp-s-1vcpu-1gb-tor1-01.ssh > 198.96.84.204.20132: Flags [P.], seq 531000:531172, ack 289, win 333, length 172
17:58:46.786678 IP lamp-s-1vcpu-1gb-tor1-01.ssh > 198.96.84.204.20132: Flags [P.], seq 531172:531344, ack 289, win 333, length 172
17:58:46.786792 IP lamp-s-1vcpu-1gb-tor1-01.ssh > 198.96.84.204.20132: Flags [P.], seq 531344:531516, ack 289, win 333, length 172
17:58:46.786904 IP lamp-s-1vcpu-1gb-tor1-01.ssh > 198.96.84.204.20132: Flags [P.], seq 531516:531688, ack 289, win 333, length 172
17:58:46.787016 IP lamp-s-1vcpu-1gb-tor1-01.ssh > 198.96.84.204.20132: Flags [P.], seq 531688:531860, ack 289, win 333, length 172
17:58:46.787126 IP lamp-s-1vcpu-1gb-tor1-01.ssh > 198.96.84.204.20132: Flags [P.], seq 531860:532032, ack 289, win 333, length 172
17:58:46.787237 IP lamp-s-1vcpu-1gb-tor1-01.ssh > 198.96.84.204.20132: Flags [P.], seq 532032:532204, ack 289, win 333, length 172
17:58:46.787348 IP lamp-s-1vcpu-1gb-tor1-01.ssh > 198.96.84.204.20132: Flags [P.], seq 532204:532376, ack 289, win 333, length 172
17:58:46.787459 IP lamp-s-1vcpu-1gb-tor1-01.ssh > 198.96.84.204.20132: Flags [P.], seq 532376:532548, ack 289, win 333, length 172
17:58:46.787571 IP lamp-s-1vcpu-1gb-tor1-01.ssh > 198.96.84.204.20132: Flags [P.], seq 532548:532720, ack 289, win 333, length 172
17:58:46.787683 IP lamp-s-1vcpu-1gb-tor1-01.ssh > 198.96.84.204.20132: Flags [P.], seq 532720:532892, ack 289, win 333, length 172
17:58:46.787795 IP lamp-s-1vcpu-1gb-tor1-01.ssh > 198.96.84.204.20132: Flags [P.], seq 532892:533064, ack 289, win 333, length 172
17:58:46.787906 IP lamp-s-1vcpu-1gb-tor1-01.ssh > 198.96.84.204.20132: Flags [P.], seq 533064:533236, ack 289, win 333, length 172
17:58:46.788018 IP lamp-s-1vcpu-1gb-tor1-01.ssh > 198.96.84.204.20132: Flags [P.], seq 533236:533408, ack 289, win 333, length 172
17:58:46.788128 IP lamp-s-1vcpu-1gb-tor1-01.ssh > 198.96.84.204.20132: Flags [P.], seq 533408:533580, ack 289, win 333, length 172
17:58:46.788262 IP lamp-s-1vcpu-1gb-tor1-01.ssh > 198.96.84.204.20132: Flags [P.], seq 533580:533752, ack 289, win 333, length 172
17:58:46.788330 IP 198.96.84.204.20132 > lamp-s-1vcpu-1gb-tor1-01.ssh: Flags [.], ack 530544, win 512, length 0
17:58:46.788584 IP lamp-s-1vcpu-1gb-tor1-01.ssh > 198.96.84.204.20132: Flags [P.], seq 533752:534036, ack 289, win 333, length 284
17:58:46.788787 IP lamp-s-1vcpu-1gb-tor1-01.ssh > 198.96.84.204.20132: Flags [P.], seq 534036:534208, ack 289, win 333, length 172
17:58:46.788979 IP lamp-s-1vcpu-1gb-tor1-01.ssh > 198.96.84.204.20132: Flags [P.], seq 534208:534380, ack 289, win 333, length 172
17:58:46.789165 IP lamp-s-1vcpu-1gb-tor1-01.ssh > 198.96.84.204.20132: Flags [P.], seq 534380:534552, ack 289, win 333, length 172
17:58:46.789301 IP lamp-s-1vcpu-1gb-tor1-01.ssh > 198.96.84.204.20132: Flags [P.], seq 534552:534724, ack 289, win 333, length 172
17:58:46.789518 IP lamp-s-1vcpu-1gb-tor1-01.ssh > 198.96.84.204.20132: Flags [P.], seq 534724:534896, ack 289, win 333, length 172
17:58:46.789698 IP lamp-s-1vcpu-1gb-tor1-01.ssh > 198.96.84.204.20132: Flags [P.], seq 534896:535068, ack 289, win 333, length 172
17:58:46.789843 IP lamp-s-1vcpu-1gb-tor1-01.ssh > 198.96.84.204.20132: Flags [P.], seq 535068:535240, ack 289, win 333, length 172
17:58:46.789957 IP lamp-s-1vcpu-1gb-tor1-01.ssh > 198.96.84.204.20132: Flags [P.], seq 535240:535412, ack 289, win 333, length 172
17:58:46.790068 IP lamp-s-1vcpu-1gb-tor1-01.ssh > 198.96.84.204.20132: Flags [P.], seq 535412:535584, ack 289, win 333, length 172
17:58:46.790179 IP lamp-s-1vcpu-1gb-tor1-01.ssh > 198.96.84.204.20132: Flags [P.], seq 535584:535756, ack 289, win 333, length 172
17:58:46.790327 IP 198.96.84.204.20132 > lamp-s-1vcpu-1gb-tor1-01.ssh: Flags [.], ack 533580, win 512, length 0
17:58:46.790349 IP lamp-s-1vcpu-1gb-tor1-01.ssh > 198.96.84.204.20132: Flags [P.], seq 535756:535928, ack 289, win 333, length 172
17:58:46.790579 IP lamp-s-1vcpu-1gb-tor1-01.ssh > 198.96.84.204.20132: Flags [P.], seq 535928:536212, ack 289, win 333, length 284
17:58:46.790794 IP lamp-s-1vcpu-1gb-tor1-01.ssh > 198.96.84.204.20132: Flags [P.], seq 536212:536384, ack 289, win 333, length 172
17:58:46.790942 IP lamp-s-1vcpu-1gb-tor1-01.ssh > 198.96.84.204.20132: Flags [P.], seq 536384:536556, ack 289, win 333, length 172
17:58:46.791119 IP lamp-s-1vcpu-1gb-tor1-01.ssh > 198.96.84.204.20132: Flags [P.], seq 536556:536728, ack 289, win 333, length 172
17:58:46.791255 IP 198.96.84.204.20132 > lamp-s-1vcpu-1gb-tor1-01.ssh: Flags [.], ack 534724, win 508, length 0
17:58:46.791365 IP lamp-s-1vcpu-1gb-tor1-01.ssh > 198.96.84.204.20132: Flags [P.], seq 536728:536900, ack 289, win 333, length 172
17:58:46.791485 IP lamp-s-1vcpu-1gb-tor1-01.ssh > 198.96.84.204.20132: Flags [P.], seq 536900:537048, ack 289, win 333, length 148
17:58:46.791646 IP lamp-s-1vcpu-1gb-tor1-01.ssh > 198.96.84.204.20132: Flags [P.], seq 537048:537220, ack 289, win 333, length 172
