                                 ]
]: command not found
root@lamp-s-1vcpu-1gb-tor1-01:~# tcpdump -n -i eth0
tcpdump: verbose output suppressed, use -v or -vv for full protocol decode
listening on eth0, link-type EN10MB (Ethernet), capture size 262144 bytes
17:58:10.165381 IP 138.197.150.173.22 > 198.96.84.204.20132: Flags [P.], seq 2654559217:2654559325, ack 252001595, win 333, length 108
17:58:10.166130 IP 138.197.150.173.22 > 198.96.84.204.20132: Flags [P.], seq 108:144, ack 1, win 333, length 36
17:58:10.166298 IP 138.197.150.173.22 > 198.96.84.204.20132: Flags [P.], seq 144:252, ack 1, win 333, length 108
17:58:10.166388 IP 138.197.150.173.22 > 198.96.84.204.20132: Flags [P.], seq 252:288, ack 1, win 333, length 36
17:58:10.166658 IP 138.197.150.173.22 > 198.96.84.204.20132: Flags [P.], seq 288:460, ack 1, win 333, length 172
17:58:10.166739 IP 138.197.150.173.22 > 198.96.84.204.20132: Flags [P.], seq 460:496, ack 1, win 333, length 36
17:58:10.166840 IP 138.197.150.173.22 > 198.96.84.204.20132: Flags [P.], seq 496:644, ack 1, win 333, length 148
17:58:10.178764 IP 198.96.84.204.20132 > 138.197.150.173.22: Flags [.], ack 288, win 512, length 0
17:58:10.178829 IP 138.197.150.173.22 > 198.96.84.204.20132: Flags [P.], seq 644:1600, ack 1, win 333, length 956
17:58:10.178858 IP 198.96.84.204.20132 > 138.197.150.173.22: Flags [.], ack 644, win 511, length 0
17:58:10.179109 IP 138.197.150.173.22 > 198.96.84.204.20132: Flags [P.], seq 1600:1732, ack 1, win 333, length 132
17:58:10.179259 IP 138.197.150.173.22 > 198.96.84.204.20132: Flags [P.], seq 1732:1768, ack 1, win 333, length 36
17:58:10.179376 IP 138.197.150.173.22 > 198.96.84.204.20132: Flags [P.], seq 1768:1916, ack 1, win 333, length 148
17:58:10.179453 IP 138.197.150.173.22 > 198.96.84.204.20132: Flags [P.], seq 1916:1952, ack 1, win 333, length 36
17:58:10.179549 IP 138.197.150.173.22 > 198.96.84.204.20132: Flags [P.], seq 1952:2084, ack 1, win 333, length 132
17:58:10.179620 IP 138.197.150.173.22 > 198.96.84.204.20132: Flags [P.], seq 2084:2120, ack 1, win 333, length 36
17:58:10.179715 IP 138.197.150.173.22 > 198.96.84.204.20132: Flags [P.], seq 2120:2268, ack 1, win 333, length 148
17:58:10.185336 IP 198.96.84.204.20132 > 138.197.150.173.22: Flags [.], ack 1916, win 512, length 0
17:58:10.185378 IP 138.197.150.173.22 > 198.96.84.204.20132: Flags [P.], seq 2268:3408, ack 1, win 333, length 1140
17:58:10.185476 IP 198.96.84.204.20132 > 138.197.150.173.22: Flags [.], ack 2268, win 511, length 0
17:58:10.185575 IP 138.197.150.173.22 > 198.96.84.204.20132: Flags [P.], seq 3408:3548, ack 1, win 333, length 140
17:58:10.185662 IP 138.197.150.173.22 > 198.96.84.204.20132: Flags [P.], seq 3548:3584, ack 1, win 333, length 36
17:58:10.185766 IP 138.197.150.173.22 > 198.96.84.204.20132: Flags [P.], seq 3584:3740, ack 1, win 333, length 156
17:58:10.185839 IP 138.197.150.173.22 > 198.96.84.204.20132: Flags [P.], seq 3740:3776, ack 1, win 333, length 36
17:58:10.185932 IP 138.197.150.173.22 > 198.96.84.204.20132: Flags [P.], seq 3776:3916, ack 1, win 333, length 140
17:58:10.186001 IP 138.197.150.173.22 > 198.96.84.204.20132: Flags [P.], seq 3916:3952, ack 1, win 333, length 36
17:58:10.186094 IP 138.197.150.173.22 > 198.96.84.204.20132: Flags [P.], seq 3952:4100, ack 1, win 333, length 148
17:58:10.188507 IP 198.96.84.204.20132 > 138.197.150.173.22: Flags [.], ack 4100, win 512, length 0
17:58:10.188547 IP 138.197.150.173.22 > 198.96.84.204.20132: Flags [P.], seq 4100:5240, ack 1, win 333, length 1140
17:58:10.188687 IP 138.197.150.173.22 > 198.96.84.204.20132: Flags [P.], seq 5240:5380, ack 1, win 333, length 140
17:58:10.188790 IP 138.197.150.173.22 > 198.96.84.204.20132: Flags [P.], seq 5380:5416, ack 1, win 333, length 36
17:58:10.188933 IP 138.197.150.173.22 > 198.96.84.204.20132: Flags [P.], seq 5416:5572, ack 1, win 333, length 156
17:58:10.189039 IP 138.197.150.173.22 > 198.96.84.204.20132: Flags [P.], seq 5572:5608, ack 1, win 333, length 36
17:58:10.189205 IP 138.197.150.173.22 > 198.96.84.204.20132: Flags [P.], seq 5608:5756, ack 1, win 333, length 148
17:58:10.189301 IP 138.197.150.173.22 > 198.96.84.204.20132: Flags [P.], seq 5756:5792, ack 1, win 333, length 36
17:58:10.189402 IP 138.197.150.173.22 > 198.96.84.204.20132: Flags [P.], seq 5792:5940, ack 1, win 333, length 148
17:58:10.191967 IP 198.96.84.204.20132 > 138.197.150.173.22: Flags [.], ack 5608, win 512, length 0
17:58:10.192002 IP 138.197.150.173.22 > 198.96.84.204.20132: Flags [P.], seq 5940:6896, ack 1, win 333, length 956
17:58:10.192090 IP 198.96.84.204.20132 > 138.197.150.173.22: Flags [.], ack 5940, win 511, length 0
17:58:10.192188 IP 138.197.150.173.22 > 198.96.84.204.20132: Flags [P.], seq 6896:7036, ack 1, win 333, length 140
17:58:10.192271 IP 138.197.150.173.22 > 198.96.84.204.20132: Flags [P.], seq 7036:7072, ack 1, win 333, length 36
17:58:10.192368 IP 138.197.150.173.22 > 198.96.84.204.20132: Flags [P.], seq 7072:7220, ack 1, win 333, length 148
17:58:10.192469 IP 138.197.150.173.22 > 198.96.84.204.20132: Flags [P.], seq 7220:7256, ack 1, win 333, length 36
17:58:10.192565 IP 138.197.150.173.22 > 198.96.84.204.20132: Flags [P.], seq 7256:7396, ack 1, win 333, length 140
17:58:10.192682 IP 138.197.150.173.22 > 198.96.84.204.20132: Flags [P.], seq 7396:7552, ack 1, win 333, length 156
17:58:10.192867 IP 138.197.150.173.22 > 198.96.84.204.20132: Flags [P.], seq 7552:8164, ack 1, win 333, length 612
17:58:10.194434 IP 198.96.84.204.20132 > 138.197.150.173.22: Flags [.], ack 7036, win 512, length 0
17:58:10.194497 IP 138.197.150.173.22 > 198.96.84.204.20132: Flags [P.], seq 8164:8320, ack 1, win 333, length 156
17:58:10.194701 IP 138.197.150.173.22 > 198.96.84.204.20132: Flags [P.], seq 8320:8572, ack 1, win 333, length 252
17:58:10.195210 IP 198.96.84.204.20132 > 138.197.150.173.22: Flags [.], ack 8164, win 508, length 0
17:58:10.195246 IP 138.197.150.173.22 > 198.96.84.204.20132: Flags [P.], seq 8572:8728, ack 1, win 333, length 156
17:58:10.195407 IP 138.197.150.173.22 > 198.96.84.204.20132: Flags [P.], seq 8728:8980, ack 1, win 333, length 252
17:58:10.195551 IP 138.197.150.173.22 > 198.96.84.204.20132: Flags [P.], seq 8980:9136, ack 1, win 333, length 156
17:58:10.195682 IP 138.197.150.173.22 > 198.96.84.204.20132: Flags [P.], seq 9136:9292, ack 1, win 333, length 156
17:58:10.195809 IP 138.197.150.173.22 > 198.96.84.204.20132: Flags [P.], seq 9292:9448, ack 1, win 333, length 156
17:58:10.195927 IP 138.197.150.173.22 > 198.96.84.204.20132: Flags [P.], seq 9448:9604, ack 1, win 333, length 156
17:58:10.196962 IP 198.96.84.204.20132 > 138.197.150.173.22: Flags [.], ack 8572, win 512, length 0
17:58:10.196997 IP 138.197.150.173.22 > 198.96.84.204.20132: Flags [P.], seq 9604:9760, ack 1, win 333, length 156
17:58:10.197182 IP 138.197.150.173.22 > 198.96.84.204.20132: Flags [P.], seq 9760:10012, ack 1, win 333, length 252
17:58:10.197770 IP 198.96.84.204.20132 > 138.197.150.173.22: Flags [.], ack 9604, win 508, length 0
17:58:10.197804 IP 138.197.150.173.22 > 198.96.84.204.20132: Flags [P.], seq 10012:10168, ack 1, win 333, length 156
17:58:10.197986 IP 138.197.150.173.22 > 198.96.84.204.20132: Flags [P.], seq 10168:10428, ack 1, win 333, length 260
17:58:10.198122 IP 138.197.150.173.22 > 198.96.84.204.20132: Flags [P.], seq 10428:10584, ack 1, win 333, length 156
17:58:10.198237 IP 138.197.150.173.22 > 198.96.84.204.20132: Flags [P.], seq 10584:10740, ack 1, win 333, length 156
17:58:10.198375 IP 138.197.150.173.22 > 198.96.84.204.20132: Flags [P.], seq 10740:10896, ack 1, win 333, length 156
17:58:10.198503 IP 138.197.150.173.22 > 198.96.84.204.20132: Flags [P.], seq 10896:11052, ack 1, win 333, length 156
17:58:10.199417 IP 198.96.84.204.20132 > 138.197.150.173.22: Flags [.], ack 10012, win 512, length 0
17:58:10.199453 IP 138.197.150.173.22 > 198.96.84.204.20132: Flags [P.], seq 11052:11208, ack 1, win 333, length 156
17:58:10.199629 IP 138.197.150.173.22 > 198.96.84.204.20132: Flags [P.], seq 11208:11468, ack 1, win 333, length 260
17:58:10.200487 IP 198.96.84.204.20132 > 138.197.150.173.22: Flags [.], ack 11052, win 508, length 0
17:58:10.200520 IP 138.197.150.173.22 > 198.96.84.204.20132: Flags [P.], seq 11468:11624, ack 1, win 333, length 156
17:58:10.200698 IP 138.197.150.173.22 > 198.96.84.204.20132: Flags [P.], seq 11624:11884, ack 1, win 333, length 260
17:58:10.200817 IP 138.197.150.173.22 > 198.96.84.204.20132: Flags [P.], seq 11884:12040, ack 1, win 333, length 156
17:58:10.200924 IP 138.197.150.173.22 > 198.96.84.204.20132: Flags [P.], seq 12040:12196, ack 1, win 333, length 156
17:58:10.201061 IP 138.197.150.173.22 > 198.96.84.204.20132: Flags [P.], seq 12196:12352, ack 1, win 333, length 156
17:58:10.201183 IP 138.197.150.173.22 > 198.96.84.204.20132: Flags [P.], seq 12352:12508, ack 1, win 333, length 156
17:58:10.204875 IP 198.96.84.204.20132 > 138.197.150.173.22: Flags [.], ack 12508, win 512, length 0
17:58:10.204909 IP 138.197.150.173.22 > 198.96.84.204.20132: Flags [P.], seq 12508:12664, ack 1, win 333, length 156
17:58:10.205080 IP 138.197.150.173.22 > 198.96.84.204.20132: Flags [P.], seq 12664:12924, ack 1, win 333, length 260
17:58:10.205207 IP 138.197.150.173.22 > 198.96.84.204.20132: Flags [P.], seq 12924:13080, ack 1, win 333, length 156
17:58:10.205318 IP 138.197.150.173.22 > 198.96.84.204.20132: Flags [P.], seq 13080:13236, ack 1, win 333, length 156
17:58:10.205464 IP 138.197.150.173.22 > 198.96.84.204.20132: Flags [P.], seq 13236:13392, ack 1, win 333, length 156
17:58:10.205614 IP 138.197.150.173.22 > 198.96.84.204.20132: Flags [P.], seq 13392:13548, ack 1, win 333, length 156
17:58:10.205726 IP 138.197.150.173.22 > 198.96.84.204.20132: Flags [P.], seq 13548:13704, ack 1, win 333, length 156
17:58:10.205859 IP 138.197.150.173.22 > 198.96.84.204.20132: Flags [P.], seq 13704:13860, ack 1, win 333, length 156
17:58:10.208009 IP 198.96.84.204.20132 > 138.197.150.173.22: Flags [.], ack 13860, win 512, length 0
17:58:10.208057 IP 138.197.150.173.22 > 198.96.84.204.20132: Flags [P.], seq 13860:14016, ack 1, win 333, length 156
17:58:10.208305 IP 138.197.150.173.22 > 198.96.84.204.20132: Flags [P.], seq 14016:14276, ack 1, win 333, length 260
17:58:10.208511 IP 138.197.150.173.22 > 198.96.84.204.20132: Flags [P.], seq 14276:14432, ack 1, win 333, length 156
17:58:10.208660 IP 138.197.150.173.22 > 198.96.84.204.20132: Flags [P.], seq 14432:14588, ack 1, win 333, length 156
17:58:10.208801 IP 138.197.150.173.22 > 198.96.84.204.20132: Flags [P.], seq 14588:14744, ack 1, win 333, length 156
17:58:10.208935 IP 138.197.150.173.22 > 198.96.84.204.20132: Flags [P.], seq 14744:14900, ack 1, win 333, length 156
17:58:10.209067 IP 138.197.150.173.22 > 198.96.84.204.20132: Flags [P.], seq 14900:15056, ack 1, win 333, length 156
17:58:10.209198 IP 138.197.150.173.22 > 198.96.84.204.20132: Flags [P.], seq 15056:15212, ack 1, win 333, length 156
17:58:10.211276 IP 198.96.84.204.20132 > 138.197.150.173.22: Flags [.], ack 15212, win 512, length 0
17:58:10.211311 IP 138.197.150.173.22 > 198.96.84.204.20132: Flags [P.], seq 15212:15368, ack 1, win 333, length 156
17:58:10.211486 IP 138.197.150.173.22 > 198.96.84.204.20132: Flags [P.], seq 15368:15628, ack 1, win 333, length 260
17:58:10.211599 IP 138.197.150.173.22 > 198.96.84.204.20132: Flags [P.], seq 15628:15784, ack 1, win 333, length 156
17:58:10.211704 IP 138.197.150.173.22 > 198.96.84.204.20132: Flags [P.], seq 15784:15940, ack 1, win 333, length 156
17:58:10.211807 IP 138.197.150.173.22 > 198.96.84.204.20132: Flags [P.], seq 15940:16096, ack 1, win 333, length 156
17:58:10.211911 IP 138.197.150.173.22 > 198.96.84.204.20132: Flags [P.], seq 16096:16252, ack 1, win 333, length 156
17:58:10.212013 IP 138.197.150.173.22 > 198.96.84.204.20132: Flags [P.], seq 16252:16408, ack 1, win 333, length 156
17:58:10.212115 IP 138.197.150.173.22 > 198.96.84.204.20132: Flags [P.], seq 16408:16564, ack 1, win 333, length 156
17:58:10.212218 IP 138.197.150.173.22 > 198.96.84.204.20132: Flags [P.], seq 16564:16720, ack 1, win 333, length 156
17:58:10.212323 IP 138.197.150.173.22 > 198.96.84.204.20132: Flags [P.], seq 16720:16876, ack 1, win 333, length 156
17:58:10.212461 IP 138.197.150.173.22 > 198.96.84.204.20132: Flags [P.], seq 16876:17032, ack 1, win 333, length 156
17:58:10.212571 IP 138.197.150.173.22 > 198.96.84.204.20132: Flags [P.], seq 17032:17188, ack 1, win 333, length 156
17:58:10.212691 IP 138.197.150.173.22 > 198.96.84.204.20132: Flags [P.], seq 17188:17344, ack 1, win 333, length 156
17:58:10.215566 IP 198.96.84.204.20132 > 138.197.150.173.22: Flags [.], ack 17344, win 512, length 0
17:58:10.215603 IP 138.197.150.173.22 > 198.96.84.204.20132: Flags [P.], seq 17344:17500, ack 1, win 333, length 156
17:58:10.215793 IP 138.197.150.173.22 > 198.96.84.204.20132: Flags [P.], seq 17500:17760, ack 1, win 333, length 260
17:58:10.215906 IP 138.197.150.173.22 > 198.96.84.204.20132: Flags [P.], seq 17760:17916, ack 1, win 333, length 156
17:58:10.216012 IP 138.197.150.173.22 > 198.96.84.204.20132: Flags [P.], seq 17916:18072, ack 1, win 333, length 156
17:58:10.216125 IP 138.197.150.173.22 > 198.96.84.204.20132: Flags [P.], seq 18072:18228, ack 1, win 333, length 156
17:58:10.216234 IP 138.197.150.173.22 > 198.96.84.204.20132: Flags [P.], seq 18228:18384, ack 1, win 333, length 156
17:58:10.216338 IP 138.197.150.173.22 > 198.96.84.204.20132: Flags [P.], seq 18384:18540, ack 1, win 333, length 156
17:58:10.216475 IP 138.197.150.173.22 > 198.96.84.204.20132: Flags [P.], seq 18540:18696, ack 1, win 333, length 156
17:58:10.216644 IP 138.197.150.173.22 > 198.96.84.204.20132: Flags [P.], seq 18696:18852, ack 1, win 333, length 156
17:58:10.216766 IP 138.197.150.173.22 > 198.96.84.204.20132: Flags [P.], seq 18852:19008, ack 1, win 333, length 156
17:58:10.216879 IP 138.197.150.173.22 > 198.96.84.204.20132: Flags [P.], seq 19008:19164, ack 1, win 333, length 156
17:58:10.216984 IP 138.197.150.173.22 > 198.96.84.204.20132: Flags [P.], seq 19164:19320, ack 1, win 333, length 156
17:58:10.217088 IP 138.197.150.173.22 > 198.96.84.204.20132: Flags [P.], seq 19320:19476, ack 1, win 333, length 156
17:58:10.218272 IP 198.96.84.204.20132 > 138.197.150.173.22: Flags [.], ack 17760, win 511, length 0
17:58:10.218309 IP 138.197.150.173.22 > 198.96.84.204.20132: Flags [P.], seq 19476:19632, ack 1, win 333, length 156
17:58:10.218502 IP 138.197.150.173.22 > 198.96.84.204.20132: Flags [P.], seq 19632:19892, ack 1, win 333, length 260
17:58:10.219436 IP 198.96.84.204.20132 > 138.197.150.173.22: Flags [.], ack 19476, win 512, length 0
17:58:10.219473 IP 138.197.150.173.22 > 198.96.84.204.20132: Flags [P.], seq 19892:20048, ack 1, win 333, length 156
17:58:10.219663 IP 138.197.150.173.22 > 198.96.84.204.20132: Flags [P.], seq 20048:20308, ack 1, win 333, length 260
17:58:10.219778 IP 138.197.150.173.22 > 198.96.84.204.20132: Flags [P.], seq 20308:20464, ack 1, win 333, length 156
17:58:10.219883 IP 138.197.150.173.22 > 198.96.84.204.20132: Flags [P.], seq 20464:20620, ack 1, win 333, length 156
17:58:10.219989 IP 138.197.150.173.22 > 198.96.84.204.20132: Flags [P.], seq 20620:20776, ack 1, win 333, length 156
17:58:10.220092 IP 138.197.150.173.22 > 198.96.84.204.20132: Flags [P.], seq 20776:20932, ack 1, win 333, length 156
17:58:10.220194 IP 138.197.150.173.22 > 198.96.84.204.20132: Flags [P.], seq 20932:21088, ack 1, win 333, length 156
17:58:10.220298 IP 138.197.150.173.22 > 198.96.84.204.20132: Flags [P.], seq 21088:21244, ack 1, win 333, length 156
17:58:10.220440 IP 138.197.150.173.22 > 198.96.84.204.20132: Flags [P.], seq 21244:21400, ack 1, win 333, length 156
17:58:10.220601 IP 138.197.150.173.22 > 198.96.84.204.20132: Flags [P.], seq 21400:21556, ack 1, win 333, length 156
17:58:10.220732 IP 138.197.150.173.22 > 198.96.84.204.20132: Flags [P.], seq 21556:21712, ack 1, win 333, length 156
17:58:10.222603 IP 198.96.84.204.20132 > 138.197.150.173.22: Flags [.], ack 19892, win 511, length 0
17:58:10.222644 IP 138.197.150.173.22 > 198.96.84.204.20132: Flags [P.], seq 21712:21868, ack 1, win 333, length 156
17:58:10.222716 IP 198.96.84.204.20132 > 138.197.150.173.22: Flags [.], ack 21712, win 512, length 0
17:58:10.222936 IP 138.197.150.173.22 > 198.96.84.204.20132: Flags [P.], seq 21868:22224, ack 1, win 333, length 356
17:58:10.223082 IP 138.197.150.173.22 > 198.96.84.204.20132: Flags [P.], seq 22224:22380, ack 1, win 333, length 156
17:58:10.223218 IP 138.197.150.173.22 > 198.96.84.204.20132: Flags [P.], seq 22380:22536, ack 1, win 333, length 156
17:58:10.223350 IP 138.197.150.173.22 > 198.96.84.204.20132: Flags [P.], seq 22536:22692, ack 1, win 333, length 156
17:58:10.223482 IP 138.197.150.173.22 > 198.96.84.204.20132: Flags [P.], seq 22692:22848, ack 1, win 333, length 156
17:58:10.223615 IP 138.197.150.173.22 > 198.96.84.204.20132: Flags [P.], seq 22848:23004, ack 1, win 333, length 156
17:58:10.223745 IP 138.197.150.173.22 > 198.96.84.204.20132: Flags [P.], seq 23004:23160, ack 1, win 333, length 156
17:58:10.223876 IP 138.197.150.173.22 > 198.96.84.204.20132: Flags [P.], seq 23160:23316, ack 1, win 333, length 156
17:58:10.224007 IP 138.197.150.173.22 > 198.96.84.204.20132: Flags [P.], seq 23316:23472, ack 1, win 333, length 156
17:58:10.224142 IP 138.197.150.173.22 > 198.96.84.204.20132: Flags [P.], seq 23472:23628, ack 1, win 333, length 156
17:58:10.224281 IP 138.197.150.173.22 > 198.96.84.204.20132: Flags [P.], seq 23628:23784, ack 1, win 333, length 156
17:58:10.224451 IP 138.197.150.173.22 > 198.96.84.204.20132: Flags [P.], seq 23784:23940, ack 1, win 333, length 156
17:58:10.224818 IP 198.96.84.204.20132 > 138.197.150.173.22: Flags [.], ack 21868, win 512, length 0
17:58:10.224851 IP 138.197.150.173.22 > 198.96.84.204.20132: Flags [P.], seq 23940:24096, ack 1, win 333, length 156
17:58:10.226434 IP 198.96.84.204.20132 > 138.197.150.173.22: Flags [.], ack 23628, win 512, length 0
17:58:10.226474 IP 138.197.150.173.22 > 198.96.84.204.20132: Flags [P.], seq 24096:24356, ack 1, win 333, length 260
17:58:10.226667 IP 138.197.150.173.22 > 198.96.84.204.20132: Flags [P.], seq 24356:24616, ack 1, win 333, length 260
17:58:10.226740 IP 198.96.84.204.20132 > 138.197.150.173.22: Flags [.], ack 23940, win 511, length 0
17:58:10.226857 IP 138.197.150.173.22 > 198.96.84.204.20132: Flags [P.], seq 24616:24876, ack 1, win 333, length 260
17:58:10.226977 IP 138.197.150.173.22 > 198.96.84.204.20132: Flags [P.], seq 24876:25032, ack 1, win 333, length 156
17:58:10.227086 IP 138.197.150.173.22 > 198.96.84.204.20132: Flags [P.], seq 25032:25188, ack 1, win 333, length 156
17:58:10.227191 IP 138.197.150.173.22 > 198.96.84.204.20132: Flags [P.], seq 25188:25344, ack 1, win 333, length 156
17:58:10.227295 IP 138.197.150.173.22 > 198.96.84.204.20132: Flags [P.], seq 25344:25500, ack 1, win 333, length 156
17:58:10.227398 IP 138.197.150.173.22 > 198.96.84.204.20132: Flags [P.], seq 25500:25656, ack 1, win 333, length 156
17:58:10.227501 IP 138.197.150.173.22 > 198.96.84.204.20132: Flags [P.], seq 25656:25812, ack 1, win 333, length 156
17:58:10.227605 IP 138.197.150.173.22 > 198.96.84.204.20132: Flags [P.], seq 25812:25968, ack 1, win 333, length 156
17:58:10.227707 IP 138.197.150.173.22 > 198.96.84.204.20132: Flags [P.], seq 25968:26124, ack 1, win 333, length 156
17:58:10.227811 IP 138.197.150.173.22 > 198.96.84.204.20132: Flags [P.], seq 26124:26280, ack 1, win 333, length 156
17:58:10.229876 IP 198.96.84.204.20132 > 138.197.150.173.22: Flags [.], ack 26280, win 512, length 0
17:58:10.229924 IP 138.197.150.173.22 > 198.96.84.204.20132: Flags [P.], seq 26280:26436, ack 1, win 333, length 156
17:58:10.230103 IP 138.197.150.173.22 > 198.96.84.204.20132: Flags [P.], seq 26436:26696, ack 1, win 333, length 260
17:58:10.230216 IP 138.197.150.173.22 > 198.96.84.204.20132: Flags [P.], seq 26696:26852, ack 1, win 333, length 156
17:58:10.230321 IP 138.197.150.173.22 > 198.96.84.204.20132: Flags [P.], seq 26852:27008, ack 1, win 333, length 156
17:58:10.230496 IP 138.197.150.173.22 > 198.96.84.204.20132: Flags [P.], seq 27008:27164, ack 1, win 333, length 156
17:58:10.230618 IP 138.197.150.173.22 > 198.96.84.204.20132: Flags [P.], seq 27164:27320, ack 1, win 333, length 156
17:58:10.230723 IP 138.197.150.173.22 > 198.96.84.204.20132: Flags [P.], seq 27320:27476, ack 1, win 333, length 156
17:58:10.230827 IP 138.197.150.173.22 > 198.96.84.204.20132: Flags [P.], seq 27476:27632, ack 1, win 333, length 156
17:58:10.230930 IP 138.197.150.173.22 > 198.96.84.204.20132: Flags [P.], seq 27632:27788, ack 1, win 333, length 156
17:58:10.231032 IP 138.197.150.173.22 > 198.96.84.204.20132: Flags [P.], seq 27788:27944, ack 1, win 333, length 156
17:58:10.231135 IP 138.197.150.173.22 > 198.96.84.204.20132: Flags [P.], seq 27944:28100, ack 1, win 333, length 156
17:58:10.231237 IP 138.197.150.173.22 > 198.96.84.204.20132: Flags [P.], seq 28100:28256, ack 1, win 333, length 156
17:58:10.231340 IP 138.197.150.173.22 > 198.96.84.204.20132: Flags [P.], seq 28256:28412, ack 1, win 333, length 156
17:58:10.233619 IP 198.96.84.204.20132 > 138.197.150.173.22: Flags [.], ack 28412, win 512, length 0
17:58:10.233670 IP 138.197.150.173.22 > 198.96.84.204.20132: Flags [P.], seq 28412:28568, ack 1, win 333, length 156
17:58:10.233892 IP 138.197.150.173.22 > 198.96.84.204.20132: Flags [P.], seq 28568:28828, ack 1, win 333, length 260
17:58:10.234038 IP 138.197.150.173.22 > 198.96.84.204.20132: Flags [P.], seq 28828:28984, ack 1, win 333, length 156
17:58:10.234181 IP 138.197.150.173.22 > 198.96.84.204.20132: Flags [P.], seq 28984:29140, ack 1, win 333, length 156
17:58:10.234308 IP 138.197.150.173.22 > 198.96.84.204.20132: Flags [P.], seq 29140:29296, ack 1, win 333, length 156
17:58:10.234418 IP 138.197.150.173.22 > 198.96.84.204.20132: Flags [P.], seq 29296:29452, ack 1, win 333, length 156
17:58:10.234594 IP 138.197.150.173.22 > 198.96.84.204.20132: Flags [P.], seq 29452:29608, ack 1, win 333, length 156
17:58:10.234730 IP 138.197.150.173.22 > 198.96.84.204.20132: Flags [P.], seq 29608:29764, ack 1, win 333, length 156
17:58:10.234844 IP 138.197.150.173.22 > 198.96.84.204.20132: Flags [P.], seq 29764:29920, ack 1, win 333, length 156
17:58:10.234960 IP 138.197.150.173.22 > 198.96.84.204.20132: Flags [P.], seq 29920:30076, ack 1, win 333, length 156
17:58:10.235122 IP 138.197.150.173.22 > 198.96.84.204.20132: Flags [P.], seq 30076:30232, ack 1, win 333, length 156
17:58:10.235300 IP 138.197.150.173.22 > 198.96.84.204.20132: Flags [P.], seq 30232:30388, ack 1, win 333, length 156
17:58:10.235422 IP 138.197.150.173.22 > 198.96.84.204.20132: Flags [P.], seq 30388:30544, ack 1, win 333, length 156
17:58:10.236332 IP 198.96.84.204.20132 > 138.197.150.173.22: Flags [.], ack 29452, win 508, length 0
17:58:10.236371 IP 138.197.150.173.22 > 198.96.84.204.20132: Flags [P.], seq 30544:30700, ack 1, win 333, length 156
17:58:10.236564 IP 138.197.150.173.22 > 198.96.84.204.20132: Flags [P.], seq 30700:30960, ack 1, win 333, length 260
17:58:10.236676 IP 138.197.150.173.22 > 198.96.84.204.20132: Flags [P.], seq 30960:31116, ack 1, win 333, length 156
17:58:10.236783 IP 138.197.150.173.22 > 198.96.84.204.20132: Flags [P.], seq 31116:31272, ack 1, win 333, length 156
17:58:10.236886 IP 138.197.150.173.22 > 198.96.84.204.20132: Flags [P.], seq 31272:31428, ack 1, win 333, length 156
17:58:10.236989 IP 138.197.150.173.22 > 198.96.84.204.20132: Flags [P.], seq 31428:31584, ack 1, win 333, length 156
17:58:10.237878 IP 198.96.84.204.20132 > 138.197.150.173.22: Flags [.], ack 30232, win 512, length 0
17:58:10.237923 IP 138.197.150.173.22 > 198.96.84.204.20132: Flags [P.], seq 31584:31740, ack 1, win 333, length 156
17:58:10.238101 IP 138.197.150.173.22 > 198.96.84.204.20132: Flags [P.], seq 31740:32000, ack 1, win 333, length 260
17:58:10.238234 IP 138.197.150.173.22 > 198.96.84.204.20132: Flags [P.], seq 32000:32156, ack 1, win 333, length 156
17:58:10.238356 IP 138.197.150.173.22 > 198.96.84.204.20132: Flags [P.], seq 32156:32312, ack 1, win 333, length 156
17:58:10.238393 IP 198.96.84.204.20132 > 138.197.150.173.22: Flags [.], ack 30544, win 511, length 0
17:58:10.238528 IP 138.197.150.173.22 > 198.96.84.204.20132: Flags [P.], seq 32312:32572, ack 1, win 333, length 260
17:58:10.238665 IP 138.197.150.173.22 > 198.96.84.204.20132: Flags [P.], seq 32572:32728, ack 1, win 333, length 156
17:58:10.238818 IP 138.197.150.173.22 > 198.96.84.204.20132: Flags [P.], seq 32728:32884, ack 1, win 333, length 156
17:58:10.242002 IP 198.96.84.204.20132 > 138.197.150.173.22: Flags [.], ack 31116, win 509, length 0
17:58:10.242045 IP 138.197.150.173.22 > 198.96.84.204.20132: Flags [P.], seq 32884:33040, ack 1, win 333, length 156
17:58:10.242238 IP 138.197.150.173.22 > 198.96.84.204.20132: Flags [P.], seq 33040:33300, ack 1, win 333, length 260
17:58:10.242360 IP 138.197.150.173.22 > 198.96.84.204.20132: Flags [P.], seq 33300:33456, ack 1, win 333, length 156
17:58:10.243343 IP 198.96.84.204.20132 > 138.197.150.173.22: Flags [.], ack 31584, win 512, length 0
17:58:10.243381 IP 138.197.150.173.22 > 198.96.84.204.20132: Flags [P.], seq 33456:33612, ack 1, win 333, length 156
17:58:10.243404 IP 198.96.84.204.20132 > 138.197.150.173.22: Flags [.], ack 32884, win 512, length 0
17:58:10.243606 IP 138.197.150.173.22 > 198.96.84.204.20132: Flags [P.], seq 33612:33968, ack 1, win 333, length 356
17:58:10.243732 IP 138.197.150.173.22 > 198.96.84.204.20132: Flags [P.], seq 33968:34124, ack 1, win 333, length 156
17:58:10.243843 IP 138.197.150.173.22 > 198.96.84.204.20132: Flags [P.], seq 34124:34280, ack 1, win 333, length 156
17:58:10.243949 IP 138.197.150.173.22 > 198.96.84.204.20132: Flags [P.], seq 34280:34436, ack 1, win 333, length 156
17:58:10.244057 IP 138.197.150.173.22 > 198.96.84.204.20132: Flags [P.], seq 34436:34592, ack 1, win 333, length 156
17:58:10.244164 IP 138.197.150.173.22 > 198.96.84.204.20132: Flags [P.], seq 34592:34748, ack 1, win 333, length 156
17:58:10.244268 IP 138.197.150.173.22 > 198.96.84.204.20132: Flags [P.], seq 34748:34904, ack 1, win 333, length 156
17:58:10.244371 IP 138.197.150.173.22 > 198.96.84.204.20132: Flags [P.], seq 34904:35060, ack 1, win 333, length 156
17:58:10.244517 IP 138.197.150.173.22 > 198.96.84.204.20132: Flags [P.], seq 35060:35216, ack 1, win 333, length 156
17:58:10.247245 IP 198.96.84.204.20132 > 138.197.150.173.22: Flags [.], ack 33612, win 510, length 0
17:58:10.247284 IP 138.197.150.173.22 > 198.96.84.204.20132: Flags [P.], seq 35216:35372, ack 1, win 333, length 156
17:58:10.247478 IP 138.197.150.173.22 > 198.96.84.204.20132: Flags [P.], seq 35372:35632, ack 1, win 333, length 260
17:58:10.247600 IP 138.197.150.173.22 > 198.96.84.204.20132: Flags [P.], seq 35632:35788, ack 1, win 333, length 156
17:58:10.247717 IP 138.197.150.173.22 > 198.96.84.204.20132: Flags [P.], seq 35788:35944, ack 1, win 333, length 156
17:58:10.247826 IP 138.197.150.173.22 > 198.96.84.204.20132: Flags [P.], seq 35944:36100, ack 1, win 333, length 156
17:58:10.247932 IP 138.197.150.173.22 > 198.96.84.204.20132: Flags [P.], seq 36100:36256, ack 1, win 333, length 156
17:58:10.248171 IP 198.96.84.204.20132 > 138.197.150.173.22: Flags [.], ack 35216, win 512, length 0
17:58:10.248202 IP 138.197.150.173.22 > 198.96.84.204.20132: Flags [P.], seq 36256:36412, ack 1, win 333, length 156
17:58:10.248361 IP 138.197.150.173.22 > 198.96.84.204.20132: Flags [P.], seq 36412:36672, ack 1, win 333, length 260
17:58:10.248502 IP 138.197.150.173.22 > 198.96.84.204.20132: Flags [P.], seq 36672:36828, ack 1, win 333, length 156
17:58:10.248608 IP 138.197.150.173.22 > 198.96.84.204.20132: Flags [P.], seq 36828:36984, ack 1, win 333, length 156
17:58:10.248712 IP 138.197.150.173.22 > 198.96.84.204.20132: Flags [P.], seq 36984:37140, ack 1, win 333, length 156
17:58:10.248814 IP 138.197.150.173.22 > 198.96.84.204.20132: Flags [P.], seq 37140:37296, ack 1, win 333, length 156
17:58:10.248933 IP 138.197.150.173.22 > 198.96.84.204.20132: Flags [P.], seq 37296:37452, ack 1, win 333, length 156
17:58:10.249063 IP 138.197.150.173.22 > 198.96.84.204.20132: Flags [P.], seq 37452:37608, ack 1, win 333, length 156
17:58:10.249177 IP 138.197.150.173.22 > 198.96.84.204.20132: Flags [P.], seq 37608:37764, ack 1, win 333, length 156
17:58:10.249281 IP 138.197.150.173.22 > 198.96.84.204.20132: Flags [P.], seq 37764:37920, ack 1, win 333, length 156
17:58:10.249386 IP 138.197.150.173.22 > 198.96.84.204.20132: Flags [P.], seq 37920:38076, ack 1, win 333, length 156
17:58:10.249912 IP 198.96.84.204.20132 > 138.197.150.173.22: Flags [.], ack 36256, win 508, length 0
17:58:10.249946 IP 138.197.150.173.22 > 198.96.84.204.20132: Flags [P.], seq 38076:38232, ack 1, win 333, length 156
17:58:10.250111 IP 138.197.150.173.22 > 198.96.84.204.20132: Flags [P.], seq 38232:38492, ack 1, win 333, length 260
17:58:10.250229 IP 138.197.150.173.22 > 198.96.84.204.20132: Flags [P.], seq 38492:38648, ack 1, win 333, length 156
17:58:10.250334 IP 138.197.150.173.22 > 198.96.84.204.20132: Flags [P.], seq 38648:38804, ack 1, win 333, length 156
17:58:10.250466 IP 138.197.150.173.22 > 198.96.84.204.20132: Flags [P.], seq 38804:38960, ack 1, win 333, length 156
17:58:10.250649 IP 138.197.150.173.22 > 198.96.84.204.20132: Flags [P.], seq 38960:39116, ack 1, win 333, length 156
17:58:10.252234 IP 198.96.84.204.20132 > 138.197.150.173.22: Flags [.], ack 38076, win 512, length 0
17:58:10.252298 IP 138.197.150.173.22 > 198.96.84.204.20132: Flags [P.], seq 39116:39272, ack 1, win 333, length 156
17:58:10.252542 IP 138.197.150.173.22 > 198.96.84.204.20132: Flags [P.], seq 39272:39532, ack 1, win 333, length 260
17:58:10.252684 IP 138.197.150.173.22 > 198.96.84.204.20132: Flags [P.], seq 39532:39688, ack 1, win 333, length 156
17:58:10.252799 IP 138.197.150.173.22 > 198.96.84.204.20132: Flags [P.], seq 39688:39844, ack 1, win 333, length 156
17:58:10.252923 IP 138.197.150.173.22 > 198.96.84.204.20132: Flags [P.], seq 39844:40000, ack 1, win 333, length 156
17:58:10.253032 IP 138.197.150.173.22 > 198.96.84.204.20132: Flags [P.], seq 40000:40156, ack 1, win 333, length 156
17:58:10.253095 IP 198.96.84.204.20132 > 138.197.150.173.22: Flags [.], ack 39116, win 508, length 0
17:58:10.253216 IP 138.197.150.173.22 > 198.96.84.204.20132: Flags [P.], seq 40156:40416, ack 1, win 333, length 260
17:58:10.253348 IP 138.197.150.173.22 > 198.96.84.204.20132: Flags [P.], seq 40416:40572, ack 1, win 333, length 156
17:58:10.253529 IP 138.197.150.173.22 > 198.96.84.204.20132: Flags [P.], seq 40572:40728, ack 1, win 333, length 156
17:58:10.253644 IP 138.197.150.173.22 > 198.96.84.204.20132: Flags [P.], seq 40728:40884, ack 1, win 333, length 156
17:58:10.253752 IP 138.197.150.173.22 > 198.96.84.204.20132: Flags [P.], seq 40884:41040, ack 1, win 333, length 156
17:58:10.253870 IP 138.197.150.173.22 > 198.96.84.204.20132: Flags [P.], seq 41040:41196, ack 1, win 333, length 156
17:58:10.253993 IP 138.197.150.173.22 > 198.96.84.204.20132: Flags [P.], seq 41196:41352, ack 1, win 333, length 156
17:58:10.254101 IP 138.197.150.173.22 > 198.96.84.204.20132: Flags [P.], seq 41352:41508, ack 1, win 333, length 156
17:58:10.254214 IP 138.197.150.173.22 > 198.96.84.204.20132: Flags [P.], seq 41508:41664, ack 1, win 333, length 156
17:58:10.254336 IP 138.197.150.173.22 > 198.96.84.204.20132: Flags [P.], seq 41664:41820, ack 1, win 333, length 156
17:58:10.254455 IP 138.197.150.173.22 > 198.96.84.204.20132: Flags [P.], seq 41820:41976, ack 1, win 333, length 156
17:58:10.256825 IP 198.96.84.204.20132 > 138.197.150.173.22: Flags [.], ack 41976, win 512, length 0
17:58:10.256864 IP 138.197.150.173.22 > 198.96.84.204.20132: Flags [P.], seq 41976:42132, ack 1, win 333, length 156
17:58:10.257034 IP 138.197.150.173.22 > 198.96.84.204.20132: Flags [P.], seq 42132:42392, ack 1, win 333, length 260
17:58:10.257151 IP 138.197.150.173.22 > 198.96.84.204.20132: Flags [P.], seq 42392:42548, ack 1, win 333, length 156
17:58:10.257255 IP 138.197.150.173.22 > 198.96.84.204.20132: Flags [P.], seq 42548:42704, ack 1, win 333, length 156
17:58:10.257390 IP 138.197.150.173.22 > 198.96.84.204.20132: Flags [P.], seq 42704:42860, ack 1, win 333, length 156
17:58:10.257544 IP 138.197.150.173.22 > 198.96.84.204.20132: Flags [P.], seq 42860:43016, ack 1, win 333, length 156
17:58:10.257675 IP 138.197.150.173.22 > 198.96.84.204.20132: Flags [P.], seq 43016:43172, ack 1, win 333, length 156
17:58:10.257805 IP 138.197.150.173.22 > 198.96.84.204.20132: Flags [P.], seq 43172:43328, ack 1, win 333, length 156
17:58:10.257927 IP 138.197.150.173.22 > 198.96.84.204.20132: Flags [P.], seq 43328:43484, ack 1, win 333, length 156
17:58:10.258040 IP 138.197.150.173.22 > 198.96.84.204.20132: Flags [P.], seq 43484:43640, ack 1, win 333, length 156
17:58:10.258164 IP 138.197.150.173.22 > 198.96.84.204.20132: Flags [P.], seq 43640:43796, ack 1, win 333, length 156
17:58:10.258288 IP 138.197.150.173.22 > 198.96.84.204.20132: Flags [P.], seq 43796:43952, ack 1, win 333, length 156
17:58:10.258396 IP 138.197.150.173.22 > 198.96.84.204.20132: Flags [P.], seq 43952:44108, ack 1, win 333, length 156
17:58:10.258498 IP 138.197.150.173.22 > 198.96.84.204.20132: Flags [P.], seq 44108:44264, ack 1, win 333, length 156
17:58:10.258634 IP 138.197.150.173.22 > 198.96.84.204.20132: Flags [P.], seq 44264:44420, ack 1, win 333, length 156
17:58:10.258746 IP 138.197.150.173.22 > 198.96.84.204.20132: Flags [P.], seq 44420:44576, ack 1, win 333, length 156
17:58:10.258850 IP 138.197.150.173.22 > 198.96.84.204.20132: Flags [P.], seq 44576:44732, ack 1, win 333, length 156
17:58:10.261235 IP 198.96.84.204.20132 > 138.197.150.173.22: Flags [.], ack 44732, win 512, length 0
17:58:10.261270 IP 138.197.150.173.22 > 198.96.84.204.20132: Flags [P.], seq 44732:44888, ack 1, win 333, length 156
17:58:10.261466 IP 138.197.150.173.22 > 198.96.84.204.20132: Flags [P.], seq 44888:45148, ack 1, win 333, length 260
17:58:10.261578 IP 138.197.150.173.22 > 198.96.84.204.20132: Flags [P.], seq 45148:45304, ack 1, win 333, length 156
17:58:10.261681 IP 138.197.150.173.22 > 198.96.84.204.20132: Flags [P.], seq 45304:45460, ack 1, win 333, length 156
17:58:10.261784 IP 138.197.150.173.22 > 198.96.84.204.20132: Flags [P.], seq 45460:45616, ack 1, win 333, length 156
17:58:10.261889 IP 138.197.150.173.22 > 198.96.84.204.20132: Flags [P.], seq 45616:45772, ack 1, win 333, length 156
17:58:10.261992 IP 138.197.150.173.22 > 198.96.84.204.20132: Flags [P.], seq 45772:45928, ack 1, win 333, length 156
17:58:10.262092 IP 138.197.150.173.22 > 198.96.84.204.20132: Flags [P.], seq 45928:46084, ack 1, win 333, length 156
17:58:10.262194 IP 138.197.150.173.22 > 198.96.84.204.20132: Flags [P.], seq 46084:46240, ack 1, win 333, length 156
17:58:10.262315 IP 138.197.150.173.22 > 198.96.84.204.20132: Flags [P.], seq 46240:46396, ack 1, win 333, length 156
17:58:10.262443 IP 138.197.150.173.22 > 198.96.84.204.20132: Flags [P.], seq 46396:46552, ack 1, win 333, length 156
17:58:10.262549 IP 138.197.150.173.22 > 198.96.84.204.20132: Flags [P.], seq 46552:46708, ack 1, win 333, length 156
17:58:10.262655 IP 138.197.150.173.22 > 198.96.84.204.20132: Flags [P.], seq 46708:46864, ack 1, win 333, length 156
17:58:10.262777 IP 138.197.150.173.22 > 198.96.84.204.20132: Flags [P.], seq 46864:47020, ack 1, win 333, length 156
17:58:10.262886 IP 138.197.150.173.22 > 198.96.84.204.20132: Flags [P.], seq 47020:47176, ack 1, win 333, length 156
17:58:10.262990 IP 138.197.150.173.22 > 198.96.84.204.20132: Flags [P.], seq 47176:47332, ack 1, win 333, length 156
17:58:10.263105 IP 138.197.150.173.22 > 198.96.84.204.20132: Flags [P.], seq 47332:47488, ack 1, win 333, length 156
17:58:10.265693 IP 198.96.84.204.20132 > 138.197.150.173.22: Flags [.], ack 47488, win 512, length 0
17:58:10.265735 IP 138.197.150.173.22 > 198.96.84.204.20132: Flags [P.], seq 47488:47644, ack 1, win 333, length 156
17:58:10.265919 IP 138.197.150.173.22 > 198.96.84.204.20132: Flags [P.], seq 47644:47904, ack 1, win 333, length 260
17:58:10.266039 IP 138.197.150.173.22 > 198.96.84.204.20132: Flags [P.], seq 47904:48060, ack 1, win 333, length 156
17:58:10.266238 IP 138.197.150.173.22 > 198.96.84.204.20132: Flags [P.], seq 48060:48216, ack 1, win 333, length 156
17:58:10.266353 IP 138.197.150.173.22 > 198.96.84.204.20132: Flags [P.], seq 48216:48372, ack 1, win 333, length 156
17:58:10.266457 IP 138.197.150.173.22 > 198.96.84.204.20132: Flags [P.], seq 48372:48528, ack 1, win 333, length 156
17:58:10.266561 IP 138.197.150.173.22 > 198.96.84.204.20132: Flags [P.], seq 48528:48684, ack 1, win 333, length 156
17:58:10.266663 IP 138.197.150.173.22 > 198.96.84.204.20132: Flags [P.], seq 48684:48840, ack 1, win 333, length 156
17:58:10.266765 IP 138.197.150.173.22 > 198.96.84.204.20132: Flags [P.], seq 48840:48996, ack 1, win 333, length 156
17:58:10.266866 IP 138.197.150.173.22 > 198.96.84.204.20132: Flags [P.], seq 48996:49152, ack 1, win 333, length 156
17:58:10.266969 IP 138.197.150.173.22 > 198.96.84.204.20132: Flags [P.], seq 49152:49308, ack 1, win 333, length 156
17:58:10.267071 IP 138.197.150.173.22 > 198.96.84.204.20132: Flags [P.], seq 49308:49464, ack 1, win 333, length 156
17:58:10.267173 IP 138.197.150.173.22 > 198.96.84.204.20132: Flags [P.], seq 49464:49620, ack 1, win 333, length 156
17:58:10.267274 IP 138.197.150.173.22 > 198.96.84.204.20132: Flags [P.], seq 49620:49776, ack 1, win 333, length 156
17:58:10.267376 IP 138.197.150.173.22 > 198.96.84.204.20132: Flags [P.], seq 49776:49932, ack 1, win 333, length 156
17:58:10.267526 IP 138.197.150.173.22 > 198.96.84.204.20132: Flags [P.], seq 49932:50088, ack 1, win 333, length 156
17:58:10.267682 IP 138.197.150.173.22 > 198.96.84.204.20132: Flags [P.], seq 50088:50244, ack 1, win 333, length 156
17:58:10.268611 IP 198.96.84.204.20132 > 138.197.150.173.22: Flags [.], ack 48060, win 510, length 0
17:58:10.268648 IP 138.197.150.173.22 > 198.96.84.204.20132: Flags [P.], seq 50244:50400, ack 1, win 333, length 156
17:58:10.268842 IP 138.197.150.173.22 > 198.96.84.204.20132: Flags [P.], seq 50400:50660, ack 1, win 333, length 260
17:58:10.268962 IP 138.197.150.173.22 > 198.96.84.204.20132: Flags [P.], seq 50660:50816, ack 1, win 333, length 156
17:58:10.269884 IP 198.96.84.204.20132 > 138.197.150.173.22: Flags [.], ack 50244, win 512, length 0
17:58:10.269926 IP 138.197.150.173.22 > 198.96.84.204.20132: Flags [P.], seq 50816:50972, ack 1, win 333, length 156
17:58:10.270134 IP 138.197.150.173.22 > 198.96.84.204.20132: Flags [P.], seq 50972:51232, ack 1, win 333, length 260
17:58:10.270254 IP 138.197.150.173.22 > 198.96.84.204.20132: Flags [P.], seq 51232:51388, ack 1, win 333, length 156
17:58:10.270365 IP 138.197.150.173.22 > 198.96.84.204.20132: Flags [P.], seq 51388:51544, ack 1, win 333, length 156
17:58:10.270469 IP 138.197.150.173.22 > 198.96.84.204.20132: Flags [P.], seq 51544:51700, ack 1, win 333, length 156
17:58:10.270572 IP 138.197.150.173.22 > 198.96.84.204.20132: Flags [P.], seq 51700:51856, ack 1, win 333, length 156
17:58:10.270672 IP 138.197.150.173.22 > 198.96.84.204.20132: Flags [P.], seq 51856:52012, ack 1, win 333, length 156
17:58:10.270774 IP 138.197.150.173.22 > 198.96.84.204.20132: Flags [P.], seq 52012:52168, ack 1, win 333, length 156
17:58:10.270876 IP 138.197.150.173.22 > 198.96.84.204.20132: Flags [P.], seq 52168:52324, ack 1, win 333, length 156
17:58:10.270978 IP 138.197.150.173.22 > 198.96.84.204.20132: Flags [P.], seq 52324:52480, ack 1, win 333, length 156
17:58:10.271079 IP 138.197.150.173.22 > 198.96.84.204.20132: Flags [P.], seq 52480:52636, ack 1, win 333, length 156
17:58:10.271182 IP 138.197.150.173.22 > 198.96.84.204.20132: Flags [P.], seq 52636:52792, ack 1, win 333, length 156
17:58:10.271284 IP 138.197.150.173.22 > 198.96.84.204.20132: Flags [P.], seq 52792:52948, ack 1, win 333, length 156
17:58:10.271386 IP 138.197.150.173.22 > 198.96.84.204.20132: Flags [P.], seq 52948:53104, ack 1, win 333, length 156
