], seq 210488:210832, ack 109, win 333, length 344
17:59:29.768837 IP 198.96.84.204.20132 > lamp-s-1vcpu-1gb-tor1-01.ssh: Flags [.], ack 207392, win 512, length 0
17:59:29.768971 IP lamp-s-1vcpu-1gb-tor1-01.ssh > 198.96.84.204.20132: Flags [P.], seq 210832:211228, ack 109, win 333, length 396
17:59:29.769092 IP lamp-s-1vcpu-1gb-tor1-01.ssh > 198.96.84.204.20132: Flags [P.], seq 211228:211400, ack 109, win 333, length 172
17:59:29.769196 IP lamp-s-1vcpu-1gb-tor1-01.ssh > 198.96.84.204.20132: Flags [P.], seq 211400:211572, ack 109, win 333, length 172
17:59:29.769323 IP lamp-s-1vcpu-1gb-tor1-01.ssh > 198.96.84.204.20132: Flags [P.], seq 211572:211744, ack 109, win 333, length 172
17:59:29.769465 IP 198.96.84.204.20132 > lamp-s-1vcpu-1gb-tor1-01.ssh: Flags [.], ack 210488, win 512, length 0
17:59:29.769558 IP lamp-s-1vcpu-1gb-tor1-01.ssh > 198.96.84.204.20132: Flags [P.], seq 211744:211916, ack 109, win 333, length 172
17:59:29.769688 IP lamp-s-1vcpu-1gb-tor1-01.ssh > 198.96.84.204.20132: Flags [P.], seq 211916:212200, ack 109, win 333, length 284
17:59:29.769812 IP lamp-s-1vcpu-1gb-tor1-01.ssh > 198.96.84.204.20132: Flags [P.], seq 212200:212372, ack 109, win 333, length 172
17:59:29.769969 IP lamp-s-1vcpu-1gb-tor1-01.ssh > 198.96.84.204.20132: Flags [P.], seq 212372:212544, ack 109, win 333, length 172
17:59:29.770067 IP 198.96.84.204.20132 > lamp-s-1vcpu-1gb-tor1-01.ssh: Flags [P.], seq 109:145, ack 210488, win 512, length 36
17:59:29.770241 IP lamp-s-1vcpu-1gb-tor1-01.ssh > 198.96.84.204.20132: Flags [P.], seq 212544:212844, ack 145, win 333, length 300
17:59:29.770411 IP lamp-s-1vcpu-1gb-tor1-01.ssh > 198.96.84.204.20132: Flags [P.], seq 212844:213016, ack 145, win 333, length 172
17:59:29.770573 IP lamp-s-1vcpu-1gb-tor1-01.ssh > 198.96.84.204.20132: Flags [P.], seq 213016:213188, ack 145, win 333, length 172
17:59:29.770701 IP lamp-s-1vcpu-1gb-tor1-01.ssh > 198.96.84.204.20132: Flags [P.], seq 213188:213360, ack 145, win 333, length 172
17:59:29.770824 IP lamp-s-1vcpu-1gb-tor1-01.ssh > 198.96.84.204.20132: Flags [P.], seq 213360:213532, ack 145, win 333, length 172
17:59:29.770981 IP lamp-s-1vcpu-1gb-tor1-01.ssh > 198.96.84.204.20132: Flags [P.], seq 213532:213704, ack 145, win 333, length 172
17:59:29.771140 IP lamp-s-1vcpu-1gb-tor1-01.ssh > 198.96.84.204.20132: Flags [P.], seq 213704:213876, ack 145, win 333, length 172
17:59:29.771300 IP lamp-s-1vcpu-1gb-tor1-01.ssh > 198.96.84.204.20132: Flags [P.], seq 213876:214048, ack 145, win 333, length 172
17:59:29.771459 IP lamp-s-1vcpu-1gb-tor1-01.ssh > 198.96.84.204.20132: Flags [P.], seq 214048:214220, ack 145, win 333, length 172
17:59:29.771616 IP lamp-s-1vcpu-1gb-tor1-01.ssh > 198.96.84.204.20132: Flags [P.], seq 214220:214392, ack 145, win 333, length 172
17:59:29.771777 IP lamp-s-1vcpu-1gb-tor1-01.ssh > 198.96.84.204.20132: Flags [P.], seq 214392:214564, ack 145, win 333, length 172
17:59:29.771941 IP lamp-s-1vcpu-1gb-tor1-01.ssh > 198.96.84.204.20132: Flags [P.], seq 214564:214736, ack 145, win 333, length 172
17:59:29.772099 IP lamp-s-1vcpu-1gb-tor1-01.ssh > 198.96.84.204.20132: Flags [P.], seq 214736:214908, ack 145, win 333, length 172
17:59:29.772258 IP lamp-s-1vcpu-1gb-tor1-01.ssh > 198.96.84.204.20132: Flags [P.], seq 214908:215080, ack 145, win 333, length 172
17:59:29.772425 IP lamp-s-1vcpu-1gb-tor1-01.ssh > 198.96.84.204.20132: Flags [P.], seq 215080:215252, ack 145, win 333, length 172
17:59:29.772578 IP lamp-s-1vcpu-1gb-tor1-01.ssh > 198.96.84.204.20132: Flags [P.], seq 215252:215424, ack 145, win 333, length 172
17:59:29.772722 IP lamp-s-1vcpu-1gb-tor1-01.ssh > 198.96.84.204.20132: Flags [P.], seq 215424:215596, ack 145, win 333, length 172
17:59:29.772833 IP lamp-s-1vcpu-1gb-tor1-01.ssh > 198.96.84.204.20132: Flags [P.], seq 215596:215768, ack 145, win 333, length 172
17:59:29.772952 IP lamp-s-1vcpu-1gb-tor1-01.ssh > 198.96.84.204.20132: Flags [P.], seq 215768:215940, ack 145, win 333, length 172
17:59:29.772970 IP 198.96.84.204.20132 > lamp-s-1vcpu-1gb-tor1-01.ssh: Flags [.], ack 213532, win 512, length 0
17:59:29.773108 IP lamp-s-1vcpu-1gb-tor1-01.ssh > 198.96.84.204.20132: Flags [P.], seq 215940:216224, ack 145, win 333, length 284
17:59:29.773216 IP lamp-s-1vcpu-1gb-tor1-01.ssh > 198.96.84.204.20132: Flags [P.], seq 216224:216396, ack 145, win 333, length 172
17:59:29.773326 IP lamp-s-1vcpu-1gb-tor1-01.ssh > 198.96.84.204.20132: Flags [P.], seq 216396:216568, ack 145, win 333, length 172
17:59:29.773457 IP lamp-s-1vcpu-1gb-tor1-01.ssh > 198.96.84.204.20132: Flags [P.], seq 216568:216740, ack 145, win 333, length 172
17:59:29.773562 IP lamp-s-1vcpu-1gb-tor1-01.ssh > 198.96.84.204.20132: Flags [P.], seq 216740:216912, ack 145, win 333, length 172
17:59:29.773664 IP lamp-s-1vcpu-1gb-tor1-01.ssh > 198.96.84.204.20132: Flags [P.], seq 216912:217084, ack 145, win 333, length 172
17:59:29.773772 IP lamp-s-1vcpu-1gb-tor1-01.ssh > 198.96.84.204.20132: Flags [P.], seq 217084:217256, ack 145, win 333, length 172
17:59:29.773874 IP lamp-s-1vcpu-1gb-tor1-01.ssh > 198.96.84.204.20132: Flags [P.], seq 217256:217428, ack 145, win 333, length 172
17:59:29.773975 IP lamp-s-1vcpu-1gb-tor1-01.ssh > 198.96.84.204.20132: Flags [P.], seq 217428:217600, ack 145, win 333, length 172
17:59:29.774076 IP lamp-s-1vcpu-1gb-tor1-01.ssh > 198.96.84.204.20132: Flags [P.], seq 217600:217772, ack 145, win 333, length 172
17:59:29.774178 IP lamp-s-1vcpu-1gb-tor1-01.ssh > 198.96.84.204.20132: Flags [P.], seq 217772:217944, ack 145, win 333, length 172
17:59:29.774278 IP lamp-s-1vcpu-1gb-tor1-01.ssh > 198.96.84.204.20132: Flags [P.], seq 217944:218116, ack 145, win 333, length 172
17:59:29.774350 IP 198.96.84.204.20132 > lamp-s-1vcpu-1gb-tor1-01.ssh: Flags [.], ack 215080, win 512, length 0
17:59:29.774457 IP lamp-s-1vcpu-1gb-tor1-01.ssh > 198.96.84.204.20132: Flags [P.], seq 218116:218400, ack 145, win 333, length 284
17:59:29.774569 IP lamp-s-1vcpu-1gb-tor1-01.ssh > 198.96.84.204.20132: Flags [P.], seq 218400:218572, ack 145, win 333, length 172
17:59:29.774671 IP lamp-s-1vcpu-1gb-tor1-01.ssh > 198.96.84.204.20132: Flags [P.], seq 218572:218744, ack 145, win 333, length 172
17:59:29.774774 IP lamp-s-1vcpu-1gb-tor1-01.ssh > 198.96.84.204.20132: Flags [P.], seq 218744:218916, ack 145, win 333, length 172
17:59:29.774876 IP lamp-s-1vcpu-1gb-tor1-01.ssh > 198.96.84.204.20132: Flags [P.], seq 218916:219088, ack 145, win 333, length 172
17:59:29.774977 IP lamp-s-1vcpu-1gb-tor1-01.ssh > 198.96.84.204.20132: Flags [P.], seq 219088:219260, ack 145, win 333, length 172
17:59:29.775079 IP lamp-s-1vcpu-1gb-tor1-01.ssh > 198.96.84.204.20132: Flags [P.], seq 219260:219432, ack 145, win 333, length 172
17:59:29.775179 IP lamp-s-1vcpu-1gb-tor1-01.ssh > 198.96.84.204.20132: Flags [P.], seq 219432:219604, ack 145, win 333, length 172
17:59:29.775281 IP lamp-s-1vcpu-1gb-tor1-01.ssh > 198.96.84.204.20132: Flags [P.], seq 219604:219776, ack 145, win 333, length 172
17:59:29.775383 IP lamp-s-1vcpu-1gb-tor1-01.ssh > 198.96.84.204.20132: Flags [P.], seq 219776:219948, ack 145, win 333, length 172
17:59:29.775485 IP lamp-s-1vcpu-1gb-tor1-01.ssh > 198.96.84.204.20132: Flags [P.], seq 219948:220120, ack 145, win 333, length 172
17:59:29.775586 IP lamp-s-1vcpu-1gb-tor1-01.ssh > 198.96.84.204.20132: Flags [P.], seq 220120:220292, ack 145, win 333, length 172
17:59:29.775688 IP lamp-s-1vcpu-1gb-tor1-01.ssh > 198.96.84.204.20132: Flags [P.], seq 220292:220464, ack 145, win 333, length 172
17:59:29.775790 IP lamp-s-1vcpu-1gb-tor1-01.ssh > 198.96.84.204.20132: Flags [P.], seq 220464:220636, ack 145, win 333, length 172
17:59:29.775893 IP lamp-s-1vcpu-1gb-tor1-01.ssh > 198.96.84.204.20132: Flags [P.], seq 220636:220808, ack 145, win 333, length 172
17:59:29.775996 IP lamp-s-1vcpu-1gb-tor1-01.ssh > 198.96.84.204.20132: Flags [P.], seq 220808:220980, ack 145, win 333, length 172
17:59:29.776098 IP lamp-s-1vcpu-1gb-tor1-01.ssh > 198.96.84.204.20132: Flags [P.], seq 220980:221152, ack 145, win 333, length 172
17:59:29.776199 IP lamp-s-1vcpu-1gb-tor1-01.ssh > 198.96.84.204.20132: Flags [P.], seq 221152:221324, ack 145, win 333, length 172
17:59:29.776302 IP lamp-s-1vcpu-1gb-tor1-01.ssh > 198.96.84.204.20132: Flags [P.], seq 221324:221496, ack 145, win 333, length 172
17:59:29.776431 IP lamp-s-1vcpu-1gb-tor1-01.ssh > 198.96.84.204.20132: Flags [P.], seq 221496:221668, ack 145, win 333, length 172
17:59:29.776539 IP lamp-s-1vcpu-1gb-tor1-01.ssh > 198.96.84.204.20132: Flags [P.], seq 221668:221840, ack 145, win 333, length 172
17:59:29.776643 IP lamp-s-1vcpu-1gb-tor1-01.ssh > 198.96.84.204.20132: Flags [P.], seq 221840:222012, ack 145, win 333, length 172
17:59:29.776746 IP lamp-s-1vcpu-1gb-tor1-01.ssh > 198.96.84.204.20132: Flags [P.], seq 222012:222184, ack 145, win 333, length 172
17:59:29.776848 IP lamp-s-1vcpu-1gb-tor1-01.ssh > 198.96.84.204.20132: Flags [P.], seq 222184:222356, ack 145, win 333, length 172
17:59:29.776953 IP lamp-s-1vcpu-1gb-tor1-01.ssh > 198.96.84.204.20132: Flags [P.], seq 222356:222528, ack 145, win 333, length 172
17:59:29.777056 IP lamp-s-1vcpu-1gb-tor1-01.ssh > 198.96.84.204.20132: Flags [P.], seq 222528:222700, ack 145, win 333, length 172
17:59:29.777158 IP lamp-s-1vcpu-1gb-tor1-01.ssh > 198.96.84.204.20132: Flags [P.], seq 222700:222872, ack 145, win 333, length 172
17:59:29.777261 IP lamp-s-1vcpu-1gb-tor1-01.ssh > 198.96.84.204.20132: Flags [P.], seq 222872:223044, ack 145, win 333, length 172
17:59:29.777363 IP lamp-s-1vcpu-1gb-tor1-01.ssh > 198.96.84.204.20132: Flags [P.], seq 223044:223216, ack 145, win 333, length 172
17:59:29.777502 IP lamp-s-1vcpu-1gb-tor1-01.ssh > 198.96.84.204.20132: Flags [P.], seq 223216:223388, ack 145, win 333, length 172
17:59:29.777610 IP lamp-s-1vcpu-1gb-tor1-01.ssh > 198.96.84.204.20132: Flags [P.], seq 223388:223560, ack 145, win 333, length 172
17:59:29.777714 IP lamp-s-1vcpu-1gb-tor1-01.ssh > 198.96.84.204.20132: Flags [P.], seq 223560:223732, ack 145, win 333, length 172
17:59:29.777815 IP lamp-s-1vcpu-1gb-tor1-01.ssh > 198.96.84.204.20132: Flags [P.], seq 223732:223904, ack 145, win 333, length 172
17:59:29.777917 IP lamp-s-1vcpu-1gb-tor1-01.ssh > 198.96.84.204.20132: Flags [P.], seq 223904:224076, ack 145, win 333, length 172
17:59:29.778020 IP lamp-s-1vcpu-1gb-tor1-01.ssh > 198.96.84.204.20132: Flags [P.], seq 224076:224248, ack 145, win 333, length 172
17:59:29.778121 IP lamp-s-1vcpu-1gb-tor1-01.ssh > 198.96.84.204.20132: Flags [P.], seq 224248:224420, ack 145, win 333, length 172
17:59:29.778224 IP lamp-s-1vcpu-1gb-tor1-01.ssh > 198.96.84.204.20132: Flags [P.], seq 224420:224592, ack 145, win 333, length 172
17:59:29.778325 IP lamp-s-1vcpu-1gb-tor1-01.ssh > 198.96.84.204.20132: Flags [P.], seq 224592:224764, ack 145, win 333, length 172
17:59:29.778427 IP lamp-s-1vcpu-1gb-tor1-01.ssh > 198.96.84.204.20132: Flags [P.], seq 224764:224936, ack 145, win 333, length 172
17:59:29.778530 IP lamp-s-1vcpu-1gb-tor1-01.ssh > 198.96.84.204.20132: Flags [P.], seq 224936:225108, ack 145, win 333, length 172
17:59:29.778636 IP lamp-s-1vcpu-1gb-tor1-01.ssh > 198.96.84.204.20132: Flags [P.], seq 225108:225280, ack 145, win 333, length 172
17:59:29.778740 IP lamp-s-1vcpu-1gb-tor1-01.ssh > 198.96.84.204.20132: Flags [P.], seq 225280:225452, ack 145, win 333, length 172
17:59:29.781950 IP 198.96.84.204.20132 > lamp-s-1vcpu-1gb-tor1-01.ssh: Flags [.], ack 218916, win 512, length 0
17:59:29.781991 IP lamp-s-1vcpu-1gb-tor1-01.ssh > 198.96.84.204.20132: Flags [P.], seq 225452:225624, ack 145, win 333, length 172
17:59:29.782092 IP 198.96.84.204.20132 > lamp-s-1vcpu-1gb-tor1-01.ssh: Flags [.], ack 223216, win 512, length 0
17:59:29.782233 IP lamp-s-1vcpu-1gb-tor1-01.ssh > 198.96.84.204.20132: Flags [P.], seq 225624:226020, ack 145, win 333, length 396
17:59:29.782350 IP lamp-s-1vcpu-1gb-tor1-01.ssh > 198.96.84.204.20132: Flags [P.], seq 226020:226192, ack 145, win 333, length 172
17:59:29.782454 IP lamp-s-1vcpu-1gb-tor1-01.ssh > 198.96.84.204.20132: Flags [P.], seq 226192:226364, ack 145, win 333, length 172
17:59:29.782560 IP lamp-s-1vcpu-1gb-tor1-01.ssh > 198.96.84.204.20132: Flags [P.], seq 226364:226536, ack 145, win 333, length 172
17:59:29.782664 IP lamp-s-1vcpu-1gb-tor1-01.ssh > 198.96.84.204.20132: Flags [P.], seq 226536:226708, ack 145, win 333, length 172
17:59:29.782766 IP lamp-s-1vcpu-1gb-tor1-01.ssh > 198.96.84.204.20132: Flags [P.], seq 226708:226880, ack 145, win 333, length 172
17:59:29.782867 IP lamp-s-1vcpu-1gb-tor1-01.ssh > 198.96.84.204.20132: Flags [P.], seq 226880:227052, ack 145, win 333, length 172
17:59:29.782970 IP lamp-s-1vcpu-1gb-tor1-01.ssh > 198.96.84.204.20132: Flags [P.], seq 227052:227224, ack 145, win 333, length 172
17:59:29.783073 IP lamp-s-1vcpu-1gb-tor1-01.ssh > 198.96.84.204.20132: Flags [P.], seq 227224:227396, ack 145, win 333, length 172
17:59:29.783175 IP lamp-s-1vcpu-1gb-tor1-01.ssh > 198.96.84.204.20132: Flags [P.], seq 227396:227568, ack 145, win 333, length 172
17:59:29.783280 IP lamp-s-1vcpu-1gb-tor1-01.ssh > 198.96.84.204.20132: Flags [P.], seq 227568:227740, ack 145, win 333, length 172
17:59:29.783383 IP lamp-s-1vcpu-1gb-tor1-01.ssh > 198.96.84.204.20132: Flags [P.], seq 227740:227912, ack 145, win 333, length 172
17:59:29.783485 IP lamp-s-1vcpu-1gb-tor1-01.ssh > 198.96.84.204.20132: Flags [P.], seq 227912:228084, ack 145, win 333, length 172
17:59:29.783641 IP lamp-s-1vcpu-1gb-tor1-01.ssh > 198.96.84.204.20132: Flags [P.], seq 228084:228256, ack 145, win 333, length 172
17:59:29.784162 IP lamp-s-1vcpu-1gb-tor1-01.ssh > 198.96.84.204.20132: Flags [P.], seq 228256:228428, ack 145, win 333, length 172
17:59:29.784283 IP lamp-s-1vcpu-1gb-tor1-01.ssh > 198.96.84.204.20132: Flags [P.], seq 228428:228600, ack 145, win 333, length 172
17:59:29.784390 IP 198.96.84.204.20132 > lamp-s-1vcpu-1gb-tor1-01.ssh: Flags [.], ack 225452, win 512, length 0
17:59:29.784511 IP lamp-s-1vcpu-1gb-tor1-01.ssh > 198.96.84.204.20132: Flags [P.], seq 228600:228884, ack 145, win 333, length 284
17:59:29.784624 IP lamp-s-1vcpu-1gb-tor1-01.ssh > 198.96.84.204.20132: Flags [P.], seq 228884:229056, ack 145, win 333, length 172
17:59:29.784728 IP lamp-s-1vcpu-1gb-tor1-01.ssh > 198.96.84.204.20132: Flags [P.], seq 229056:229228, ack 145, win 333, length 172
17:59:29.784834 IP lamp-s-1vcpu-1gb-tor1-01.ssh > 198.96.84.204.20132: Flags [P.], seq 229228:229400, ack 145, win 333, length 172
17:59:29.784938 IP lamp-s-1vcpu-1gb-tor1-01.ssh > 198.96.84.204.20132: Flags [P.], seq 229400:229572, ack 145, win 333, length 172
17:59:29.785040 IP lamp-s-1vcpu-1gb-tor1-01.ssh > 198.96.84.204.20132: Flags [P.], seq 229572:229744, ack 145, win 333, length 172
17:59:29.785143 IP lamp-s-1vcpu-1gb-tor1-01.ssh > 198.96.84.204.20132: Flags [P.], seq 229744:229916, ack 145, win 333, length 172
17:59:29.785245 IP lamp-s-1vcpu-1gb-tor1-01.ssh > 198.96.84.204.20132: Flags [P.], seq 229916:230088, ack 145, win 333, length 172
17:59:29.785348 IP lamp-s-1vcpu-1gb-tor1-01.ssh > 198.96.84.204.20132: Flags [P.], seq 230088:230260, ack 145, win 333, length 172
17:59:29.785485 IP lamp-s-1vcpu-1gb-tor1-01.ssh > 198.96.84.204.20132: Flags [P.], seq 230260:230432, ack 145, win 333, length 172
17:59:29.785594 IP lamp-s-1vcpu-1gb-tor1-01.ssh > 198.96.84.204.20132: Flags [P.], seq 230432:230604, ack 145, win 333, length 172
17:59:29.785698 IP lamp-s-1vcpu-1gb-tor1-01.ssh > 198.96.84.204.20132: Flags [P.], seq 230604:230776, ack 145, win 333, length 172
17:59:29.785802 IP lamp-s-1vcpu-1gb-tor1-01.ssh > 198.96.84.204.20132: Flags [P.], seq 230776:230948, ack 145, win 333, length 172
17:59:29.785904 IP lamp-s-1vcpu-1gb-tor1-01.ssh > 198.96.84.204.20132: Flags [P.], seq 230948:231120, ack 145, win 333, length 172
17:59:29.786136 IP 198.96.84.204.20132 > lamp-s-1vcpu-1gb-tor1-01.ssh: Flags [.], ack 228256, win 512, length 0
17:59:29.786153 IP lamp-s-1vcpu-1gb-tor1-01.ssh > 198.96.84.204.20132: Flags [P.], seq 231120:231292, ack 145, win 333, length 172
17:59:29.786296 IP lamp-s-1vcpu-1gb-tor1-01.ssh > 198.96.84.204.20132: Flags [P.], seq 231292:231576, ack 145, win 333, length 284
17:59:29.786403 IP lamp-s-1vcpu-1gb-tor1-01.ssh > 198.96.84.204.20132: Flags [P.], seq 231576:231748, ack 145, win 333, length 172
17:59:29.786506 IP lamp-s-1vcpu-1gb-tor1-01.ssh > 198.96.84.204.20132: Flags [P.], seq 231748:231920, ack 145, win 333, length 172
17:59:29.786608 IP lamp-s-1vcpu-1gb-tor1-01.ssh > 198.96.84.204.20132: Flags [P.], seq 231920:232092, ack 145, win 333, length 172
17:59:29.786730 IP lamp-s-1vcpu-1gb-tor1-01.ssh > 198.96.84.204.20132: Flags [P.], seq 232092:232264, ack 145, win 333, length 172
17:59:29.786836 IP lamp-s-1vcpu-1gb-tor1-01.ssh > 198.96.84.204.20132: Flags [P.], seq 232264:232436, ack 145, win 333, length 172
17:59:29.786939 IP lamp-s-1vcpu-1gb-tor1-01.ssh > 198.96.84.204.20132: Flags [P.], seq 232436:232608, ack 145, win 333, length 172
17:59:29.787041 IP lamp-s-1vcpu-1gb-tor1-01.ssh > 198.96.84.204.20132: Flags [P.], seq 232608:232780, ack 145, win 333, length 172
17:59:29.787143 IP lamp-s-1vcpu-1gb-tor1-01.ssh > 198.96.84.204.20132: Flags [P.], seq 232780:232952, ack 145, win 333, length 172
17:59:29.787245 IP lamp-s-1vcpu-1gb-tor1-01.ssh > 198.96.84.204.20132: Flags [P.], seq 232952:233124, ack 145, win 333, length 172
17:59:29.787353 IP lamp-s-1vcpu-1gb-tor1-01.ssh > 198.96.84.204.20132: Flags [P.], seq 233124:233296, ack 145, win 333, length 172
17:59:29.787455 IP lamp-s-1vcpu-1gb-tor1-01.ssh > 198.96.84.204.20132: Flags [P.], seq 233296:233468, ack 145, win 333, length 172
17:59:29.787558 IP lamp-s-1vcpu-1gb-tor1-01.ssh > 198.96.84.204.20132: Flags [P.], seq 233468:233640, ack 145, win 333, length 172
17:59:29.787659 IP lamp-s-1vcpu-1gb-tor1-01.ssh > 198.96.84.204.20132: Flags [P.], seq 233640:233812, ack 145, win 333, length 172
17:59:29.787760 IP lamp-s-1vcpu-1gb-tor1-01.ssh > 198.96.84.204.20132: Flags [P.], seq 233812:233984, ack 145, win 333, length 172
17:59:29.787867 IP lamp-s-1vcpu-1gb-tor1-01.ssh > 198.96.84.204.20132: Flags [P.], seq 233984:234156, ack 145, win 333, length 172
17:59:29.787947 IP 198.96.84.204.20132 > lamp-s-1vcpu-1gb-tor1-01.ssh: Flags [.], ack 231120, win 512, length 0
17:59:29.788056 IP lamp-s-1vcpu-1gb-tor1-01.ssh > 198.96.84.204.20132: Flags [P.], seq 234156:234440, ack 145, win 333, length 284
17:59:29.788164 IP lamp-s-1vcpu-1gb-tor1-01.ssh > 198.96.84.204.20132: Flags [P.], seq 234440:234612, ack 145, win 333, length 172
17:59:29.788267 IP lamp-s-1vcpu-1gb-tor1-01.ssh > 198.96.84.204.20132: Flags [P.], seq 234612:234784, ack 145, win 333, length 172
17:59:29.788392 IP lamp-s-1vcpu-1gb-tor1-01.ssh > 198.96.84.204.20132: Flags [P.], seq 234784:234956, ack 145, win 333, length 172
17:59:29.788497 IP lamp-s-1vcpu-1gb-tor1-01.ssh > 198.96.84.204.20132: Flags [P.], seq 234956:235128, ack 145, win 333, length 172
17:59:29.788600 IP lamp-s-1vcpu-1gb-tor1-01.ssh > 198.96.84.204.20132: Flags [P.], seq 235128:235300, ack 145, win 333, length 172
17:59:29.788702 IP lamp-s-1vcpu-1gb-tor1-01.ssh > 198.96.84.204.20132: Flags [P.], seq 235300:235472, ack 145, win 333, length 172
17:59:29.788803 IP lamp-s-1vcpu-1gb-tor1-01.ssh > 198.96.84.204.20132: Flags [P.], seq 235472:235644, ack 145, win 333, length 172
17:59:29.788906 IP lamp-s-1vcpu-1gb-tor1-01.ssh > 198.96.84.204.20132: Flags [P.], seq 235644:235816, ack 145, win 333, length 172
17:59:29.789008 IP lamp-s-1vcpu-1gb-tor1-01.ssh > 198.96.84.204.20132: Flags [P.], seq 235816:235988, ack 145, win 333, length 172
17:59:29.789109 IP lamp-s-1vcpu-1gb-tor1-01.ssh > 198.96.84.204.20132: Flags [P.], seq 235988:236160, ack 145, win 333, length 172
17:59:29.789211 IP lamp-s-1vcpu-1gb-tor1-01.ssh > 198.96.84.204.20132: Flags [P.], seq 236160:236332, ack 145, win 333, length 172
17:59:29.789312 IP lamp-s-1vcpu-1gb-tor1-01.ssh > 198.96.84.204.20132: Flags [P.], seq 236332:236504, ack 145, win 333, length 172
17:59:29.789443 IP lamp-s-1vcpu-1gb-tor1-01.ssh > 198.96.84.204.20132: Flags [P.], seq 236504:236676, ack 145, win 333, length 172
17:59:29.789551 IP lamp-s-1vcpu-1gb-tor1-01.ssh > 198.96.84.204.20132: Flags [P.], seq 236676:236848, ack 145, win 333, length 172
17:59:29.789654 IP lamp-s-1vcpu-1gb-tor1-01.ssh > 198.96.84.204.20132: Flags [P.], seq 236848:237020, ack 145, win 333, length 172
17:59:29.789756 IP lamp-s-1vcpu-1gb-tor1-01.ssh > 198.96.84.204.20132: Flags [P.], seq 237020:237192, ack 145, win 333, length 172
17:59:29.789868 IP lamp-s-1vcpu-1gb-tor1-01.ssh > 198.96.84.204.20132: Flags [P.], seq 237192:237364, ack 145, win 333, length 172
17:59:29.789975 IP lamp-s-1vcpu-1gb-tor1-01.ssh > 198.96.84.204.20132: Flags [P.], seq 237364:237536, ack 145, win 333, length 172
17:59:29.790085 IP lamp-s-1vcpu-1gb-tor1-01.ssh > 198.96.84.204.20132: Flags [P.], seq 237536:237708, ack 145, win 333, length 172
17:59:29.790190 IP lamp-s-1vcpu-1gb-tor1-01.ssh > 198.96.84.204.20132: Flags [P.], seq 237708:237880, ack 145, win 333, length 172
17:59:29.790292 IP lamp-s-1vcpu-1gb-tor1-01.ssh > 198.96.84.204.20132: Flags [P.], seq 237880:238052, ack 145, win 333, length 172
17:59:29.790395 IP lamp-s-1vcpu-1gb-tor1-01.ssh > 198.96.84.204.20132: Flags [P.], seq 238052:238224, ack 145, win 333, length 172
17:59:29.790497 IP lamp-s-1vcpu-1gb-tor1-01.ssh > 198.96.84.204.20132: Flags [P.], seq 238224:238396, ack 145, win 333, length 172
17:59:29.790604 IP lamp-s-1vcpu-1gb-tor1-01.ssh > 198.96.84.204.20132: Flags [P.], seq 238396:238568, ack 145, win 333, length 172
17:59:29.790706 IP lamp-s-1vcpu-1gb-tor1-01.ssh > 198.96.84.204.20132: Flags [P.], seq 238568:238740, ack 145, win 333, length 172
17:59:29.790809 IP lamp-s-1vcpu-1gb-tor1-01.ssh > 198.96.84.204.20132: Flags [P.], seq 238740:238912, ack 145, win 333, length 172
17:59:29.790912 IP lamp-s-1vcpu-1gb-tor1-01.ssh > 198.96.84.204.20132: Flags [P.], seq 238912:239084, ack 145, win 333, length 172
17:59:29.791017 IP lamp-s-1vcpu-1gb-tor1-01.ssh > 198.96.84.204.20132: Flags [P.], seq 239084:239256, ack 145, win 333, length 172
17:59:29.791120 IP lamp-s-1vcpu-1gb-tor1-01.ssh > 198.96.84.204.20132: Flags [P.], seq 239256:239428, ack 145, win 333, length 172
17:59:29.791222 IP lamp-s-1vcpu-1gb-tor1-01.ssh > 198.96.84.204.20132: Flags [P.], seq 239428:239600, ack 145, win 333, length 172
17:59:29.791326 IP lamp-s-1vcpu-1gb-tor1-01.ssh > 198.96.84.204.20132: Flags [P.], seq 239600:239772, ack 145, win 333, length 172
17:59:29.791429 IP lamp-s-1vcpu-1gb-tor1-01.ssh > 198.96.84.204.20132: Flags [P.], seq 239772:239944, ack 145, win 333, length 172
17:59:29.791532 IP lamp-s-1vcpu-1gb-tor1-01.ssh > 198.96.84.204.20132: Flags [P.], seq 239944:240116, ack 145, win 333, length 172
17:59:29.791635 IP lamp-s-1vcpu-1gb-tor1-01.ssh > 198.96.84.204.20132: Flags [P.], seq 240116:240288, ack 145, win 333, length 172
17:59:29.791738 IP lamp-s-1vcpu-1gb-tor1-01.ssh > 198.96.84.204.20132: Flags [P.], seq 240288:240460, ack 145, win 333, length 172
17:59:29.791840 IP lamp-s-1vcpu-1gb-tor1-01.ssh > 198.96.84.204.20132: Flags [P.], seq 240460:240632, ack 145, win 333, length 172
17:59:29.791942 IP lamp-s-1vcpu-1gb-tor1-01.ssh > 198.96.84.204.20132: Flags [P.], seq 240632:240804, ack 145, win 333, length 172
17:59:29.792045 IP lamp-s-1vcpu-1gb-tor1-01.ssh > 198.96.84.204.20132: Flags [P.], seq 240804:240976, ack 145, win 333, length 172
17:59:29.792147 IP lamp-s-1vcpu-1gb-tor1-01.ssh > 198.96.84.204.20132: Flags [P.], seq 240976:241148, ack 145, win 333, length 172
17:59:29.792254 IP lamp-s-1vcpu-1gb-tor1-01.ssh > 198.96.84.204.20132: Flags [P.], seq 241148:241320, ack 145, win 333, length 172
17:59:29.792377 IP lamp-s-1vcpu-1gb-tor1-01.ssh > 198.96.84.204.20132: Flags [P.], seq 241320:241492, ack 145, win 333, length 172
17:59:29.793032 IP 198.96.84.204.20132 > lamp-s-1vcpu-1gb-tor1-01.ssh: Flags [.], ack 234956, win 512, length 0
17:59:29.793072 IP lamp-s-1vcpu-1gb-tor1-01.ssh > 198.96.84.204.20132: Flags [P.], seq 241492:241664, ack 145, win 333, length 172
17:59:29.793238 IP lamp-s-1vcpu-1gb-tor1-01.ssh > 198.96.84.204.20132: Flags [P.], seq 241664:241948, ack 145, win 333, length 284
17:59:29.793280 IP 198.96.84.204.20132 > lamp-s-1vcpu-1gb-tor1-01.ssh: Flags [.], ack 238568, win 512, length 0
17:59:29.793440 IP lamp-s-1vcpu-1gb-tor1-01.ssh > 198.96.84.204.20132: Flags [P.], seq 241948:242232, ack 145, win 333, length 284
17:59:29.793551 IP lamp-s-1vcpu-1gb-tor1-01.ssh > 198.96.84.204.20132: Flags [P.], seq 242232:242404, ack 145, win 333, length 172
17:59:29.793654 IP lamp-s-1vcpu-1gb-tor1-01.ssh > 198.96.84.204.20132: Flags [P.], seq 242404:242576, ack 145, win 333, length 172
17:59:29.793757 IP lamp-s-1vcpu-1gb-tor1-01.ssh > 198.96.84.204.20132: Flags [P.], seq 242576:242748, ack 145, win 333, length 172
17:59:29.793860 IP lamp-s-1vcpu-1gb-tor1-01.ssh > 198.96.84.204.20132: Flags [P.], seq 242748:242920, ack 145, win 333, length 172
17:59:29.793962 IP lamp-s-1vcpu-1gb-tor1-01.ssh > 198.96.84.204.20132: Flags [P.], seq 242920:243092, ack 145, win 333, length 172
17:59:29.794064 IP lamp-s-1vcpu-1gb-tor1-01.ssh > 198.96.84.204.20132: Flags [P.], seq 243092:243264, ack 145, win 333, length 172
17:59:29.794166 IP lamp-s-1vcpu-1gb-tor1-01.ssh > 198.96.84.204.20132: Flags [P.], seq 243264:243436, ack 145, win 333, length 172
17:59:29.794268 IP lamp-s-1vcpu-1gb-tor1-01.ssh > 198.96.84.204.20132: Flags [P.], seq 243436:243608, ack 145, win 333, length 172
17:59:29.794370 IP lamp-s-1vcpu-1gb-tor1-01.ssh > 198.96.84.204.20132: Flags [P.], seq 243608:243780, ack 145, win 333, length 172
17:59:29.794471 IP lamp-s-1vcpu-1gb-tor1-01.ssh > 198.96.84.204.20132: Flags [P.], seq 243780:243952, ack 145, win 333, length 172
17:59:29.794573 IP lamp-s-1vcpu-1gb-tor1-01.ssh > 198.96.84.204.20132: Flags [P.], seq 243952:244124, ack 145, win 333, length 172
17:59:29.794675 IP lamp-s-1vcpu-1gb-tor1-01.ssh > 198.96.84.204.20132: Flags [P.], seq 244124:244296, ack 145, win 333, length 172
17:59:29.794777 IP lamp-s-1vcpu-1gb-tor1-01.ssh > 198.96.84.204.20132: Flags [P.], seq 244296:244468, ack 145, win 333, length 172
17:59:29.794878 IP lamp-s-1vcpu-1gb-tor1-01.ssh > 198.96.84.204.20132: Flags [P.], seq 244468:244640, ack 145, win 333, length 172
17:59:29.794979 IP lamp-s-1vcpu-1gb-tor1-01.ssh > 198.96.84.204.20132: Flags [P.], seq 244640:244812, ack 145, win 333, length 172
17:59:29.795081 IP lamp-s-1vcpu-1gb-tor1-01.ssh > 198.96.84.204.20132: Flags [P.], seq 244812:244984, ack 145, win 333, length 172
17:59:29.795183 IP lamp-s-1vcpu-1gb-tor1-01.ssh > 198.96.84.204.20132: Flags [P.], seq 244984:245156, ack 145, win 333, length 172
17:59:29.795285 IP lamp-s-1vcpu-1gb-tor1-01.ssh > 198.96.84.204.20132: Flags [P.], seq 245156:245328, ack 145, win 333, length 172
17:59:29.795386 IP lamp-s-1vcpu-1gb-tor1-01.ssh > 198.96.84.204.20132: Flags [P.], seq 245328:245500, ack 145, win 333, length 172
17:59:29.795492 IP lamp-s-1vcpu-1gb-tor1-01.ssh > 198.96.84.204.20132: Flags [P.], seq 245500:245672, ack 145, win 333, length 172
17:59:29.795595 IP lamp-s-1vcpu-1gb-tor1-01.ssh > 198.96.84.204.20132: Flags [P.], seq 245672:245844, ack 145, win 333, length 172
17:59:29.795696 IP lamp-s-1vcpu-1gb-tor1-01.ssh > 198.96.84.204.20132: Flags [P.], seq 245844:246016, ack 145, win 333, length 172
17:59:29.795798 IP lamp-s-1vcpu-1gb-tor1-01.ssh > 198.96.84.204.20132: Flags [P.], seq 246016:246188, ack 145, win 333, length 172
17:59:29.795901 IP lamp-s-1vcpu-1gb-tor1-01.ssh > 198.96.84.204.20132: Flags [P.], seq 246188:246360, ack 145, win 333, length 172
17:59:29.796002 IP lamp-s-1vcpu-1gb-tor1-01.ssh > 198.96.84.204.20132: Flags [P.], seq 246360:246532, ack 145, win 333, length 172
17:59:29.796104 IP lamp-s-1vcpu-1gb-tor1-01.ssh > 198.96.84.204.20132: Flags [P.], seq 246532:246704, ack 145, win 333, length 172
17:59:29.796207 IP lamp-s-1vcpu-1gb-tor1-01.ssh > 198.96.84.204.20132: Flags [P.], seq 246704:246876, ack 145, win 333, length 172
17:59:29.796309 IP lamp-s-1vcpu-1gb-tor1-01.ssh > 198.96.84.204.20132: Flags [P.], seq 246876:247048, ack 145, win 333, length 172
17:59:29.796445 IP lamp-s-1vcpu-1gb-tor1-01.ssh > 198.96.84.204.20132: Flags [P.], seq 247048:247220, ack 145, win 333, length 172
17:59:29.796597 IP lamp-s-1vcpu-1gb-tor1-01.ssh > 198.96.84.204.20132: Flags [P.], seq 247220:247392, ack 145, win 333, length 172
17:59:29.796731 IP lamp-s-1vcpu-1gb-tor1-01.ssh > 198.96.84.204.20132: Flags [P.], seq 247392:247564, ack 145, win 333, length 172
17:59:29.796841 IP lamp-s-1vcpu-1gb-tor1-01.ssh > 198.96.84.204.20132: Flags [P.], seq 247564:247736, ack 145, win 333, length 172
17:59:29.796935 IP lamp-s-1vcpu-1gb-tor1-01.ssh > 198.96.84.204.20132: Flags [P.], seq 247736:247908, ack 145, win 333, length 172
17:59:29.797019 IP lamp-s-1vcpu-1gb-tor1-01.ssh > 198.96.84.204.20132: Flags [P.], seq 247908:248080, ack 145, win 333, length 172
17:59:29.797102 IP lamp-s-1vcpu-1gb-tor1-01.ssh > 198.96.84.204.20132: Flags [P.], seq 248080:248252, ack 145, win 333, length 172
17:59:29.797185 IP lamp-s-1vcpu-1gb-tor1-01.ssh > 198.96.84.204.20132: Flags [P.], seq 248252:248424, ack 145, win 333, length 172
17:59:29.797268 IP lamp-s-1vcpu-1gb-tor1-01.ssh > 198.96.84.204.20132: Flags [P.], seq 248424:248596, ack 145, win 333, length 172
17:59:29.797353 IP lamp-s-1vcpu-1gb-tor1-01.ssh > 198.96.84.204.20132: Flags [P.], seq 248596:248768, ack 145, win 333, length 172
17:59:29.797469 IP lamp-s-1vcpu-1gb-tor1-01.ssh > 198.96.84.204.20132: Flags [P.], seq 248768:248940, ack 145, win 333, length 172
17:59:29.797775 IP 198.96.84.204.20132 > lamp-s-1vcpu-1gb-tor1-01.ssh: Flags [.], ack 241492, win 512, length 0
17:59:29.797828 IP lamp-s-1vcpu-1gb-tor1-01.ssh > 198.96.84.204.20132: Flags [P.], seq 248940:249112, ack 145, win 333, length 172
17:59:29.797860 IP 198.96.84.204.20132 > lamp-s-1vcpu-1gb-tor1-01.ssh: Flags [.], ack 242232, win 510, length 0
17:59:29.798095 IP lamp-s-1vcpu-1gb-tor1-01.ssh > 198.96.84.204.20132: Flags [P.], seq 249112:249508, ack 145, win 333, length 396
17:59:29.798219 IP lamp-s-1vcpu-1gb-tor1-01.ssh > 198.96.84.204.20132: Flags [P.], seq 249508:249680, ack 145, win 333, length 172
17:59:29.798326 IP lamp-s-1vcpu-1gb-tor1-01.ssh > 198.96.84.204.20132: Flags [P.], seq 249680:249852, ack 145, win 333, length 172
17:59:29.798465 IP lamp-s-1vcpu-1gb-tor1-01.ssh > 198.96.84.204.20132: Flags [P.], seq 249852:250024, ack 145, win 333, length 172
17:59:29.798570 IP lamp-s-1vcpu-1gb-tor1-01.ssh > 198.96.84.204.20132: Flags [P.], seq 250024:250196, ack 145, win 333, length 172
17:59:29.798674 IP lamp-s-1vcpu-1gb-tor1-01.ssh > 198.96.84.204.20132: Flags [P.], seq 250196:250368, ack 145, win 333, length 172
17:59:29.798765 IP 198.96.84.204.20132 > lamp-s-1vcpu-1gb-tor1-01.ssh: Flags [.], ack 247048, win 512, length 0
17:59:29.798880 IP lamp-s-1vcpu-1gb-tor1-01.ssh > 198.96.84.204.20132: Flags [P.], seq 250368:250652, ack 145, win 333, length 284
17:59:29.798993 IP lamp-s-1vcpu-1gb-tor1-01.ssh > 198.96.84.204.20132: Flags [P.], seq 250652:250824, ack 145, win 333, length 172
17:59:29.799104 IP lamp-s-1vcpu-1gb-tor1-01.ssh > 198.96.84.204.20132: Flags [P.], seq 250824:250996, ack 145, win 333, length 172
17:59:29.799207 IP lamp-s-1vcpu-1gb-tor1-01.ssh > 198.96.84.204.20132: Flags [P.], seq 250996:251168, ack 145, win 333, length 172
17:59:29.799309 IP lamp-s-1vcpu-1gb-tor1-01.ssh > 198.96.84.204.20132: Flags [P.], seq 251168:251340, ack 145, win 333, length 172
17:59:29.799412 IP lamp-s-1vcpu-1gb-tor1-01.ssh > 198.96.84.204.20132: Flags [P.], seq 251340:251512, ack 145, win 333, length 172
17:59:29.799527 IP lamp-s-1vcpu-1gb-tor1-01.ssh > 198.96.84.204.20132: Flags [P.], seq 251512:251684, ack 145, win 333, length 172
17:59:29.799634 IP lamp-s-1vcpu-1gb-tor1-01.ssh > 198.96.84.204.20132: Flags [P.], seq 251684:251856, ack 145, win 333, length 172
17:59:29.799736 IP lamp-s-1vcpu-1gb-tor1-01.ssh > 198.96.84.204.20132: Flags [P.], seq 251856:252028, ack 145, win 333, length 172
17:59:29.799840 IP lamp-s-1vcpu-1gb-tor1-01.ssh > 198.96.84.204.20132: Flags [P.], seq 252028:252200, ack 145, win 333, length 172
17:59:29.799943 IP lamp-s-1vcpu-1gb-tor1-01.ssh > 198.96.84.204.20132: Flags [P.], seq 252200:252372, ack 145, win 333, length 172
17:59:29.800050 IP lamp-s-1vcpu-1gb-tor1-01.ssh > 198.96.84.204.20132: Flags [P.], seq 252372:252544, ack 145, win 333, length 172
17:59:29.800112 IP 198.96.84.204.20132 > lamp-s-1vcpu-1gb-tor1-01.ssh: Flags [.], ack 249112, win 512, length 0
17:59:29.800267 IP lamp-s-1vcpu-1gb-tor1-01.ssh > 198.96.84.204.20132: Flags [P.], seq 252544:252828, ack 145, win 333, length 284
17:59:29.800421 IP lamp-s-1vcpu-1gb-tor1-01.ssh > 198.96.84.204.20132: Flags [P.], seq 252828:253000, ack 145, win 333, length 172
17:59:29.800557 IP lamp-s-1vcpu-1gb-tor1-01.ssh > 198.96.84.204.20132: Flags [P.], seq 253000:253172, ack 145, win 333, length 172
17:59:29.800700 IP lamp-s-1vcpu-1gb-tor1-01.ssh > 198.96.84.204.20132: Flags [P.], seq 253172:253344, ack 145, win 333, length 172
17:59:29.800812 IP lamp-s-1vcpu-1gb-tor1-01.ssh > 198.96.84.204.20132: Flags [P.], seq 253344:253516, ack 145, win 333, length 172
17:59:29.800919 IP lamp-s-1vcpu-1gb-tor1-01.ssh > 198.96.84.204.20132: Flags [P.], seq 253516:253688, ack 145, win 333, length 172
17:59:29.801025 IP lamp-s-1vcpu-1gb-tor1-01.ssh > 198.96.84.204.20132: Flags [P.], seq 253688:253860, ack 145, win 333, length 172
17:59:29.801133 IP lamp-s-1vcpu-1gb-tor1-01.ssh > 198.96.84.204.20132: Flags [P.], seq 253860:254032, ack 145, win 333, length 172
17:59:29.801236 IP lamp-s-1vcpu-1gb-tor1-01.ssh > 198.96.84.204.20132: Flags [P.], seq 254032:254204, ack 145, win 333, length 172
17:59:29.801339 IP lamp-s-1vcpu-1gb-tor1-01.ssh > 198.96.84.204.20132: Flags [P.], seq 254204:254376, ack 145, win 333, length 172
17:59:29.801486 IP lamp-s-1vcpu-1gb-tor1-01.ssh > 198.96.84.204.20132: Flags [P.], seq 254376:254548, ack 145, win 333, length 172
17:59:29.801594 IP lamp-s-1vcpu-1gb-tor1-01.ssh > 198.96.84.204.20132: Flags [P.], seq 254548:254720, ack 145, win 333, length 172
17:59:29.801701 IP lamp-s-1vcpu-1gb-tor1-01.ssh > 198.96.84.204.20132: Flags [P.], seq 254720:254892, ack 145, win 333, length 172
17:59:29.801805 IP lamp-s-1vcpu-1gb-tor1-01.ssh > 198.96.84.204.20132: Flags [P.], seq 254892:255064, ack 145, win 333, length 172
17:59:29.801906 IP lamp-s-1vcpu-1gb-tor1-01.ssh > 198.96.84.204.20132: Flags [P.], seq 255064:255236, ack 145, win 333, length 172
17:59:29.802008 IP lamp-s-1vcpu-1gb-tor1-01.ssh > 198.96.84.204.20132: Flags [P.], seq 255236:255408, ack 145, win 333, length 172
17:59:29.802111 IP lamp-s-1vcpu-1gb-tor1-01.ssh > 198.96.84.204.20132: Flags [P.], seq 255408:255580, ack 145, win 333, length 172
17:59:29.802215 IP lamp-s-1vcpu-1gb-tor1-01.ssh > 198.96.84.204.20132: Flags [P.], seq 255580:255752, ack 145, win 333, length 172
17:59:29.802317 IP lamp-s-1vcpu-1gb-tor1-01.ssh > 198.96.84.204.20132: Flags [P.], seq 255752:255924, ack 145, win 333, length 172
17:59:29.802443 IP lamp-s-1vcpu-1gb-tor1-01.ssh > 198.96.84.204.20132: Flags [P.], seq 255924:256096, ack 145, win 333, length 172
17:59:29.802549 IP lamp-s-1vcpu-1gb-tor1-01.ssh > 198.96.84.204.20132: Flags [P.], seq 256096:256268, ack 145, win 333, length 172
17:59:29.802652 IP lamp-s-1vcpu-1gb-tor1-01.ssh > 198.96.84.204.20132: Flags [P.], seq 256268:256440, ack 145, win 333, length 172
17:59:29.802755 IP lamp-s-1vcpu-1gb-tor1-01.ssh > 198.96.84.204.20132: Flags [P.], seq 256440:256612, ack 145, win 333, length 172
17:59:29.802857 IP lamp-s-1vcpu-1gb-tor1-01.ssh > 198.96.84.204.20132: Flags [P.], seq 256612:256784, ack 145, win 333, length 172
17:59:29.802959 IP lamp-s-1vcpu-1gb-tor1-01.ssh > 198.96.84.204.20132: Flags [P.], seq 256784:256956, ack 145, win 333, length 172
17:59:29.803062 IP lamp-s-1vcpu-1gb-tor1-01.ssh > 198.96.84.204.20132: Flags [P.], seq 256956:257128, ack 145, win 333, length 172
17:59:29.803165 IP lamp-s-1vcpu-1gb-tor1-01.ssh > 198.96.84.204.20132: Flags [P.], seq 257128:257300, ack 145, win 333, length 172
17:59:29.803268 IP lamp-s-1vcpu-1gb-tor1-01.ssh > 198.96.84.204.20132: Flags [P.], seq 257300:257472, ack 145, win 333, length 172
17:59:29.803370 IP lamp-s-1vcpu-1gb-tor1-01.ssh > 198.96.84.204.20132: Flags [P.], seq 257472:257644, ack 145, win 333, length 172
17:59:29.803532 IP lamp-s-1vcpu-1gb-tor1-01.ssh > 198.96.84.204.20132: Flags [P.], seq 257644:257816, ack 145, win 333, length 172
17:59:29.803675 IP lamp-s-1vcpu-1gb-tor1-01.ssh > 198.96.84.204.20132: Flags [P.], seq 257816:257988, ack 145, win 333, length 172
17:59:29.803790 IP lamp-s-1vcpu-1gb-tor1-01.ssh > 198.96.84.204.20132: Flags [P.], seq 257988:258160, ack 145, win 333, length 172
17:59:29.803895 IP lamp-s-1vcpu-1gb-tor1-01.ssh > 198.96.84.204.20132: Flags [P.], seq 258160:258332, ack 145, win 333, length 172
17:59:29.804001 IP lamp-s-1vcpu-1gb-tor1-01.ssh > 198.96.84.204.20132: Flags [P.], seq 258332:258504, ack 145, win 333, length 172
17:59:29.804107 IP lamp-s-1vcpu-1gb-tor1-01.ssh > 198.96.84.204.20132: Flags [P.], seq 258504:258676, ack 145, win 333, length 172
17:59:29.804211 IP lamp-s-1vcpu-1gb-tor1-01.ssh > 198.96.84.204.20132: Flags [P.], seq 258676:258848, ack 145, win 333, length 172
17:59:29.804315 IP lamp-s-1vcpu-1gb-tor1-01.ssh > 198.96.84.204.20132: Flags [P.], seq 258848:259020, ack 145, win 333, length 172
17:59:29.804477 IP lamp-s-1vcpu-1gb-tor1-01.ssh > 198.96.84.204.20132: Flags [P.], seq 259020:259192, ack 145, win 333, length 172
17:59:29.804590 IP lamp-s-1vcpu-1gb-tor1-01.ssh > 198.96.84.204.20132: Flags [P.], seq 259192:259364, ack 145, win 333, length 172
17:59:29.804693 IP lamp-s-1vcpu-1gb-tor1-01.ssh > 198.96.84.204.20132: Flags [P.], seq 259364:259536, ack 145, win 333, length 172
17:59:29.804796 IP lamp-s-1vcpu-1gb-tor1-01.ssh > 198.96.84.204.20132: Flags [P.], seq 259536:259708, ack 145, win 333, length 172
17:59:29.807716 IP 198.96.84.204.20132 > lamp-s-1vcpu-1gb-tor1-01.ssh: Flags [.], ack 252544, win 512, length 0
17:59:29.807771 IP lamp-s-1vcpu-1gb-tor1-01.ssh > 198.96.84.204.20132: Flags [P.], seq 259708:259880, ack 145, win 333, length 172
17:59:29.807792 IP 198.96.84.204.20132 > lamp-s-1vcpu-1gb-tor1-01.ssh: Flags [.], ack 258160, win 512, length 0
17:59:29.807830 IP 198.96.84.204.20132 > lamp-s-1vcpu-1gb-tor1-01.ssh: Flags [.], ack 259708, win 512, length 0
17:59:29.808068 IP lamp-s-1vcpu-1gb-tor1-01.ssh > 198.96.84.204.20132: Flags [P.], seq 259880:260388, ack 145, win 333, length 508
17:59:29.808201 IP lamp-s-1vcpu-1gb-tor1-01.ssh > 198.96.84.204.20132: Flags [P.], seq 260388:260560, ack 145, win 333, length 172
17:59:29.808329 IP lamp-s-1vcpu-1gb-tor1-01.ssh > 198.96.84.204.20132: Flags [P.], seq 260560:260732, ack 145, win 333, length 172
17:59:29.808480 IP lamp-s-1vcpu-1gb-tor1-01.ssh > 198.96.84.204.20132: Flags [P.], seq 260732:260904, ack 145, win 333, length 172
17:59:29.808611 IP lamp-s-1vcpu-1gb-tor1-01.ssh > 198.96.84.204.20132: Flags [P.], seq 260904:261076, ack 145, win 333, length 172
17:59:29.808744 IP lamp-s-1vcpu-1gb-tor1-01.ssh > 198.96.84.204.20132: Flags [P.], seq 261076:261248, ack 145, win 333, length 172
17:59:29.808871 IP lamp-s-1vcpu-1gb-tor1-01.ssh > 198.96.84.204.20132: Flags [P.], seq 261248:261420, ack 145, win 333, length 172
17:59:29.808995 IP lamp-s-1vcpu-1gb-tor1-01.ssh > 198.96.84.204.20132: Flags [P.], seq 261420:261592, ack 145, win 333, length 172
17:59:29.809123 IP lamp-s-1vcpu-1gb-tor1-01.ssh > 198.96.84.204.20132: Flags [P.], seq 261592:261764, ack 145, win 333, length 172
17:59:29.809250 IP lamp-s-1vcpu-1gb-tor1-01.ssh > 198.96.84.204.20132: Flags [P.], seq 261764:261936, ack 145, win 333, length 172
17:59:29.809375 IP lamp-s-1vcpu-1gb-tor1-01.ssh > 198.96.84.204.20132: Flags [P.], seq 261936:262108, ack 145, win 333, length 172
17:59:29.809547 IP lamp-s-1vcpu-1gb-tor1-01.ssh > 198.96.84.204.20132: Flags [P.], seq 262108:262280, ack 145, win 333, length 172
17:59:29.809681 IP lamp-s-1vcpu-1gb-tor1-01.ssh > 198.96.84.204.20132: Flags [P.], seq 262280:262452, ack 145, win 333, length 172
17:59:29.809808 IP lamp-s-1vcpu-1gb-tor1-01.ssh > 198.96.84.204.20132: Flags [P.], seq 262452:262624, ack 145, win 333, length 172
