
root@lamp-s-1vcpu-1gb-tor1-01:~# tcpdump -i eth0
tcpdump: verbose output suppressed, use -v or -vv for full protocol decode
listening on eth0, link-type EN10MB (Ethernet), capture size 262144 bytes
17:52:04.955440 IP lamp-s-1vcpu-1gb-tor1-01.ssh > 198.96.84.204.20132: Flags [P.], seq 2647768977:2647769085, ack 251990303, win 313, length 108
17:52:04.955539 IP lamp-s-1vcpu-1gb-tor1-01.ssh > 198.96.84.204.20132: Flags [P.], seq 108:144, ack 1, win 313, length 36
17:52:04.955633 IP lamp-s-1vcpu-1gb-tor1-01.ssh > 198.96.84.204.20132: Flags [P.], seq 144:252, ack 1, win 313, length 108
17:52:04.955759 IP lamp-s-1vcpu-1gb-tor1-01.ssh > 198.96.84.204.20132: Flags [P.], seq 252:288, ack 1, win 313, length 36
17:52:04.957819 IP lamp-s-1vcpu-1gb-tor1-01.ssh > 198.96.84.204.20132: Flags [P.], seq 288:468, ack 1, win 313, length 180
17:52:04.957919 IP lamp-s-1vcpu-1gb-tor1-01.ssh > 198.96.84.204.20132: Flags [P.], seq 468:504, ack 1, win 313, length 36
17:52:04.958027 IP lamp-s-1vcpu-1gb-tor1-01.ssh > 198.96.84.204.20132: Flags [P.], seq 504:660, ack 1, win 313, length 156
17:52:04.958102 IP lamp-s-1vcpu-1gb-tor1-01.ssh > 198.96.84.204.20132: Flags [P.], seq 660:696, ack 1, win 313, length 36
17:52:04.958200 IP lamp-s-1vcpu-1gb-tor1-01.ssh > 198.96.84.204.20132: Flags [P.], seq 696:852, ack 1, win 313, length 156
17:52:04.960665 IP 198.96.84.204.20132 > lamp-s-1vcpu-1gb-tor1-01.ssh: Flags [.], ack 288, win 509, length 0
17:52:04.960717 IP lamp-s-1vcpu-1gb-tor1-01.ssh > 198.96.84.204.20132: Flags [P.], seq 852:2040, ack 1, win 313, length 1188
17:52:04.960890 IP lamp-s-1vcpu-1gb-tor1-01.ssh > 198.96.84.204.20132: Flags [P.], seq 2040:2188, ack 1, win 313, length 148
17:52:04.960982 IP lamp-s-1vcpu-1gb-tor1-01.ssh > 198.96.84.204.20132: Flags [P.], seq 2188:2224, ack 1, win 313, length 36
17:52:04.961089 IP lamp-s-1vcpu-1gb-tor1-01.ssh > 198.96.84.204.20132: Flags [P.], seq 2224:2388, ack 1, win 313, length 164
17:52:04.961166 IP lamp-s-1vcpu-1gb-tor1-01.ssh > 198.96.84.204.20132: Flags [P.], seq 2388:2424, ack 1, win 313, length 36
17:52:04.961264 IP lamp-s-1vcpu-1gb-tor1-01.ssh > 198.96.84.204.20132: Flags [P.], seq 2424:2588, ack 1, win 313, length 164
17:52:04.961338 IP lamp-s-1vcpu-1gb-tor1-01.ssh > 198.96.84.204.20132: Flags [P.], seq 2588:2624, ack 1, win 313, length 36
17:52:04.961635 IP lamp-s-1vcpu-1gb-tor1-01.ssh > 198.96.84.204.20132: Flags [P.], seq 2624:2788, ack 1, win 313, length 164
17:52:04.961765 IP lamp-s-1vcpu-1gb-tor1-01.ssh > 198.96.84.204.20132: Flags [P.], seq 2788:2824, ack 1, win 313, length 36
17:52:04.961874 IP 198.96.84.204.20132 > lamp-s-1vcpu-1gb-tor1-01.ssh: Flags [.], ack 852, win 512, length 0
17:52:04.962214 IP lamp-s-1vcpu-1gb-tor1-01.ssh > 198.96.84.204.20132: Flags [P.], seq 3024:3188, ack 1, win 313, length 164
17:52:04.962484 IP lamp-s-1vcpu-1gb-tor1-01.ssh > 198.96.84.204.20132: Flags [P.], seq 3224:3388, ack 1, win 313, length 164
17:52:04.962733 IP lamp-s-1vcpu-1gb-tor1-01.ssh > 198.96.84.204.20132: Flags [P.], seq 3424:3588, ack 1, win 313, length 164
17:52:04.963013 IP lamp-s-1vcpu-1gb-tor1-01.ssh > 198.96.84.204.20132: Flags [P.], seq 3624:3788, ack 1, win 313, length 164
17:52:04.963251 IP lamp-s-1vcpu-1gb-tor1-01.ssh > 198.96.84.204.20132: Flags [P.], seq 3824:3988, ack 1, win 313, length 164
17:52:04.964717 IP 198.96.84.204.20132 > lamp-s-1vcpu-1gb-tor1-01.ssh: Flags [.], ack 2624, win 512, length 0
17:52:04.964753 IP lamp-s-1vcpu-1gb-tor1-01.ssh > 198.96.84.204.20132: Flags [P.], seq 3988:5208, ack 1, win 313, length 1220
17:52:04.964895 IP lamp-s-1vcpu-1gb-tor1-01.ssh > 198.96.84.204.20132: Flags [P.], seq 5208:5356, ack 1, win 313, length 148
17:52:04.965000 IP lamp-s-1vcpu-1gb-tor1-01.ssh > 198.96.84.204.20132: Flags [P.], seq 5356:5392, ack 1, win 313, length 36
17:52:04.965124 IP lamp-s-1vcpu-1gb-tor1-01.ssh > 198.96.84.204.20132: Flags [P.], seq 5392:5556, ack 1, win 313, length 164
17:52:04.965199 IP lamp-s-1vcpu-1gb-tor1-01.ssh > 198.96.84.204.20132: Flags [P.], seq 5556:5592, ack 1, win 313, length 36
17:52:04.965381 IP lamp-s-1vcpu-1gb-tor1-01.ssh > 198.96.84.204.20132: Flags [P.], seq 5592:5756, ack 1, win 313, length 164
17:52:04.965561 IP lamp-s-1vcpu-1gb-tor1-01.ssh > 198.96.84.204.20132: Flags [P.], seq 5756:5792, ack 1, win 313, length 36
17:52:04.965703 IP lamp-s-1vcpu-1gb-tor1-01.ssh > 198.96.84.204.20132: Flags [P.], seq 5792:5956, ack 1, win 313, length 164
17:52:04.965781 IP lamp-s-1vcpu-1gb-tor1-01.ssh > 198.96.84.204.20132: Flags [P.], seq 5956:5992, ack 1, win 313, length 36
17:52:04.965854 IP 198.96.84.204.20132 > lamp-s-1vcpu-1gb-tor1-01.ssh: Flags [.], ack 3224, win 510, length 0
17:52:04.966115 IP lamp-s-1vcpu-1gb-tor1-01.ssh > 198.96.84.204.20132: Flags [P.], seq 6192:6356, ack 1, win 313, length 164
17:52:04.966283 IP lamp-s-1vcpu-1gb-tor1-01.ssh > 198.96.84.204.20132: Flags [P.], seq 6392:6556, ack 1, win 313, length 164
17:52:04.966461 IP lamp-s-1vcpu-1gb-tor1-01.ssh > 198.96.84.204.20132: Flags [P.], seq 6592:6756, ack 1, win 313, length 164
17:52:04.966654 IP lamp-s-1vcpu-1gb-tor1-01.ssh > 198.96.84.204.20132: Flags [P.], seq 6792:7076, ack 1, win 313, length 284
17:52:04.966850 IP lamp-s-1vcpu-1gb-tor1-01.ssh > 198.96.84.204.20132: Flags [P.], seq 7076:7728, ack 1, win 313, length 652
17:52:04.966967 IP lamp-s-1vcpu-1gb-tor1-01.ssh > 198.96.84.204.20132: Flags [P.], seq 7728:7892, ack 1, win 313, length 164
17:52:04.967078 IP lamp-s-1vcpu-1gb-tor1-01.ssh > 198.96.84.204.20132: Flags [P.], seq 7892:8056, ack 1, win 313, length 164
17:52:04.967185 IP lamp-s-1vcpu-1gb-tor1-01.ssh > 198.96.84.204.20132: Flags [P.], seq 8056:8220, ack 1, win 313, length 164
17:52:04.967306 IP lamp-s-1vcpu-1gb-tor1-01.ssh > 198.96.84.204.20132: Flags [P.], seq 8220:8384, ack 1, win 313, length 164
17:52:04.967436 IP lamp-s-1vcpu-1gb-tor1-01.ssh > 198.96.84.204.20132: Flags [P.], seq 8384:8548, ack 1, win 313, length 164
17:52:04.967547 IP lamp-s-1vcpu-1gb-tor1-01.ssh > 198.96.84.204.20132: Flags [P.], seq 8548:8712, ack 1, win 313, length 164
17:52:04.967653 IP lamp-s-1vcpu-1gb-tor1-01.ssh > 198.96.84.204.20132: Flags [P.], seq 8712:8876, ack 1, win 313, length 164
17:52:04.975513 IP 198.96.84.204.20132 > lamp-s-1vcpu-1gb-tor1-01.ssh: Flags [.], ack 3988, win 512, length 0
17:52:04.975583 IP lamp-s-1vcpu-1gb-tor1-01.ssh > 198.96.84.204.20132: Flags [P.], seq 8876:9040, ack 1, win 313, length 164
17:52:04.975611 IP 198.96.84.204.20132 > lamp-s-1vcpu-1gb-tor1-01.ssh: Flags [.], ack 5592, win 512, length 0
17:52:04.975907 IP lamp-s-1vcpu-1gb-tor1-01.ssh > 198.96.84.204.20132: Flags [P.], seq 9040:9428, ack 1, win 313, length 388
17:52:04.976036 IP lamp-s-1vcpu-1gb-tor1-01.ssh > 198.96.84.204.20132: Flags [P.], seq 9428:9592, ack 1, win 313, length 164
17:52:04.976154 IP lamp-s-1vcpu-1gb-tor1-01.ssh > 198.96.84.204.20132: Flags [P.], seq 9592:9756, ack 1, win 313, length 164
17:52:04.976374 IP lamp-s-1vcpu-1gb-tor1-01.ssh > 198.96.84.204.20132: Flags [P.], seq 9756:9920, ack 1, win 313, length 164
17:52:04.976533 IP lamp-s-1vcpu-1gb-tor1-01.ssh > 198.96.84.204.20132: Flags [P.], seq 9920:10084, ack 1, win 313, length 164
17:52:04.976648 IP lamp-s-1vcpu-1gb-tor1-01.ssh > 198.96.84.204.20132: Flags [P.], seq 10084:10248, ack 1, win 313, length 164
17:52:04.976755 IP lamp-s-1vcpu-1gb-tor1-01.ssh > 198.96.84.204.20132: Flags [P.], seq 10248:10412, ack 1, win 313, length 164
17:52:04.976861 IP lamp-s-1vcpu-1gb-tor1-01.ssh > 198.96.84.204.20132: Flags [P.], seq 10412:10576, ack 1, win 313, length 164
17:52:04.976966 IP lamp-s-1vcpu-1gb-tor1-01.ssh > 198.96.84.204.20132: Flags [P.], seq 10576:10740, ack 1, win 313, length 164
17:52:04.977071 IP lamp-s-1vcpu-1gb-tor1-01.ssh > 198.96.84.204.20132: Flags [P.], seq 10740:10904, ack 1, win 313, length 164
17:52:04.977175 IP lamp-s-1vcpu-1gb-tor1-01.ssh > 198.96.84.204.20132: Flags [P.], seq 10904:11068, ack 1, win 313, length 164
17:52:04.977280 IP lamp-s-1vcpu-1gb-tor1-01.ssh > 198.96.84.204.20132: Flags [P.], seq 11068:11232, ack 1, win 313, length 164
17:52:04.977392 IP lamp-s-1vcpu-1gb-tor1-01.ssh > 198.96.84.204.20132: Flags [P.], seq 11232:11396, ack 1, win 313, length 164
17:52:04.977537 IP lamp-s-1vcpu-1gb-tor1-01.ssh > 198.96.84.204.20132: Flags [P.], seq 11396:11560, ack 1, win 313, length 164
17:52:04.977645 IP lamp-s-1vcpu-1gb-tor1-01.ssh > 198.96.84.204.20132: Flags [P.], seq 11560:11724, ack 1, win 313, length 164
17:52:04.977753 IP lamp-s-1vcpu-1gb-tor1-01.ssh > 198.96.84.204.20132: Flags [P.], seq 11724:11888, ack 1, win 313, length 164
17:52:04.977863 IP lamp-s-1vcpu-1gb-tor1-01.ssh > 198.96.84.204.20132: Flags [P.], seq 11888:12052, ack 1, win 313, length 164
17:52:04.977965 IP lamp-s-1vcpu-1gb-tor1-01.ssh > 198.96.84.204.20132: Flags [P.], seq 12052:12216, ack 1, win 313, length 164
17:52:04.978066 IP lamp-s-1vcpu-1gb-tor1-01.ssh > 198.96.84.204.20132: Flags [P.], seq 12216:12380, ack 1, win 313, length 164
17:52:04.978169 IP lamp-s-1vcpu-1gb-tor1-01.ssh > 198.96.84.204.20132: Flags [P.], seq 12380:12544, ack 1, win 313, length 164
17:52:04.978279 IP lamp-s-1vcpu-1gb-tor1-01.ssh > 198.96.84.204.20132: Flags [P.], seq 12544:12708, ack 1, win 313, length 164
17:52:04.978365 IP lamp-s-1vcpu-1gb-tor1-01.ssh > 198.96.84.204.20132: Flags [P.], seq 12708:12872, ack 1, win 313, length 164
17:52:04.978469 IP lamp-s-1vcpu-1gb-tor1-01.ssh > 198.96.84.204.20132: Flags [P.], seq 12872:13036, ack 1, win 313, length 164
17:52:04.980635 IP 198.96.84.204.20132 > lamp-s-1vcpu-1gb-tor1-01.ssh: Flags [.], ack 8876, win 512, length 0
17:52:04.980695 IP lamp-s-1vcpu-1gb-tor1-01.ssh > 198.96.84.204.20132: Flags [P.], seq 13036:13200, ack 1, win 313, length 164
17:52:04.980915 IP lamp-s-1vcpu-1gb-tor1-01.ssh > 198.96.84.204.20132: Flags [P.], seq 13200:13476, ack 1, win 313, length 276
17:52:04.981045 IP lamp-s-1vcpu-1gb-tor1-01.ssh > 198.96.84.204.20132: Flags [P.], seq 13476:13640, ack 1, win 313, length 164
17:52:04.981159 IP lamp-s-1vcpu-1gb-tor1-01.ssh > 198.96.84.204.20132: Flags [P.], seq 13640:13804, ack 1, win 313, length 164
17:52:04.981265 IP lamp-s-1vcpu-1gb-tor1-01.ssh > 198.96.84.204.20132: Flags [P.], seq 13804:13968, ack 1, win 313, length 164
17:52:04.981378 IP lamp-s-1vcpu-1gb-tor1-01.ssh > 198.96.84.204.20132: Flags [P.], seq 13968:14132, ack 1, win 313, length 164
17:52:04.981523 IP lamp-s-1vcpu-1gb-tor1-01.ssh > 198.96.84.204.20132: Flags [P.], seq 14132:14296, ack 1, win 313, length 164
17:52:04.981634 IP lamp-s-1vcpu-1gb-tor1-01.ssh > 198.96.84.204.20132: Flags [P.], seq 14296:14460, ack 1, win 313, length 164
17:52:04.981741 IP lamp-s-1vcpu-1gb-tor1-01.ssh > 198.96.84.204.20132: Flags [P.], seq 14460:14624, ack 1, win 313, length 164
17:52:04.981844 IP lamp-s-1vcpu-1gb-tor1-01.ssh > 198.96.84.204.20132: Flags [P.], seq 14624:14788, ack 1, win 313, length 164
17:52:04.981946 IP lamp-s-1vcpu-1gb-tor1-01.ssh > 198.96.84.204.20132: Flags [P.], seq 14788:14952, ack 1, win 313, length 164
17:52:04.982049 IP lamp-s-1vcpu-1gb-tor1-01.ssh > 198.96.84.204.20132: Flags [P.], seq 14952:15116, ack 1, win 313, length 164
17:52:04.982151 IP lamp-s-1vcpu-1gb-tor1-01.ssh > 198.96.84.204.20132: Flags [P.], seq 15116:15280, ack 1, win 313, length 164
17:52:04.982252 IP lamp-s-1vcpu-1gb-tor1-01.ssh > 198.96.84.204.20132: Flags [P.], seq 15280:15444, ack 1, win 313, length 164
17:52:04.982354 IP lamp-s-1vcpu-1gb-tor1-01.ssh > 198.96.84.204.20132: Flags [P.], seq 15444:15608, ack 1, win 313, length 164
17:52:04.982470 IP lamp-s-1vcpu-1gb-tor1-01.ssh > 198.96.84.204.20132: Flags [P.], seq 15608:15772, ack 1, win 313, length 164
17:52:04.982637 IP lamp-s-1vcpu-1gb-tor1-01.ssh > 198.96.84.204.20132: Flags [P.], seq 15772:15936, ack 1, win 313, length 164
17:52:04.982773 IP lamp-s-1vcpu-1gb-tor1-01.ssh > 198.96.84.204.20132: Flags [P.], seq 15936:16100, ack 1, win 313, length 164
17:52:04.982898 IP lamp-s-1vcpu-1gb-tor1-01.ssh > 198.96.84.204.20132: Flags [P.], seq 16100:16264, ack 1, win 313, length 164
17:52:04.983043 IP lamp-s-1vcpu-1gb-tor1-01.ssh > 198.96.84.204.20132: Flags [P.], seq 16264:16428, ack 1, win 313, length 164
17:52:04.983171 IP lamp-s-1vcpu-1gb-tor1-01.ssh > 198.96.84.204.20132: Flags [P.], seq 16428:16592, ack 1, win 313, length 164
17:52:04.983293 IP lamp-s-1vcpu-1gb-tor1-01.ssh > 198.96.84.204.20132: Flags [P.], seq 16592:16756, ack 1, win 313, length 164
17:52:04.983422 IP lamp-s-1vcpu-1gb-tor1-01.ssh > 198.96.84.204.20132: Flags [P.], seq 16756:16920, ack 1, win 313, length 164
17:52:04.983550 IP lamp-s-1vcpu-1gb-tor1-01.ssh > 198.96.84.204.20132: Flags [P.], seq 16920:17084, ack 1, win 313, length 164
17:52:04.989834 IP 198.96.84.204.20132 > lamp-s-1vcpu-1gb-tor1-01.ssh: Flags [.], ack 13036, win 512, length 0
17:52:04.989912 IP lamp-s-1vcpu-1gb-tor1-01.ssh > 198.96.84.204.20132: Flags [P.], seq 17084:17248, ack 1, win 313, length 164
17:52:04.989933 IP 198.96.84.204.20132 > lamp-s-1vcpu-1gb-tor1-01.ssh: Flags [.], ack 14132, win 508, length 0
17:52:04.989946 IP 198.96.84.204.20132 > lamp-s-1vcpu-1gb-tor1-01.ssh: Flags [.], ack 17084, win 512, length 0
17:52:04.990218 IP lamp-s-1vcpu-1gb-tor1-01.ssh > 198.96.84.204.20132: Flags [P.], seq 17248:17748, ack 1, win 313, length 500
17:52:04.990266 IP 111.205.14.22.29828 > lamp-s-1vcpu-1gb-tor1-01.ssh: Flags [.], ack 2169559813, win 172, options [nop,nop,TS val 55277751 ecr 358061602], length 0
17:52:04.993842 IP lamp-s-1vcpu-1gb-tor1-01.ssh > 198.96.84.204.20132: Flags [P.], seq 17748:17912, ack 1, win 313, length 164
17:52:04.994228 IP lamp-s-1vcpu-1gb-tor1-01.42804 > 67.207.67.2.domain: 25342+ [1au] PTR? 22.14.205.111.in-addr.arpa. (55)
17:52:04.999365 IP 111.205.14.22.29828 > lamp-s-1vcpu-1gb-tor1-01.ssh: Flags [P.], seq 0:27, ack 1, win 172, options [nop,nop,TS val 55277752 ecr 358061602], length 27
17:52:05.001712 IP 198.96.84.204.20132 > lamp-s-1vcpu-1gb-tor1-01.ssh: Flags [.], ack 17912, win 509, length 0
17:52:05.003007 IP lamp-s-1vcpu-1gb-tor1-01.ssh > 111.205.14.22.29828: Flags [P.], seq 1:42, ack 0, win 227, options [nop,nop,TS val 358061911 ecr 55277751], length 41
17:52:05.007067 IP 111.205.14.22.29828 > lamp-s-1vcpu-1gb-tor1-01.ssh: Flags [P.], seq 27:28, ack 1, win 172, options [nop,nop,TS val 55277752 ecr 358061602], length 1
17:52:05.268887 IP lamp-s-1vcpu-1gb-tor1-01.ssh > 198.96.84.204.20132: Flags [P.], seq 17912:18244, ack 1, win 313, length 332
17:52:05.269627 IP lamp-s-1vcpu-1gb-tor1-01.ssh > 198.96.84.204.20132: Flags [P.], seq 18244:19152, ack 1, win 313, length 908
17:52:05.269755 IP lamp-s-1vcpu-1gb-tor1-01.ssh > 198.96.84.204.20132: Flags [P.], seq 19152:19316, ack 1, win 313, length 164
17:52:05.269899 IP lamp-s-1vcpu-1gb-tor1-01.ssh > 198.96.84.204.20132: Flags [P.], seq 19316:19480, ack 1, win 313, length 164
17:52:05.270079 IP lamp-s-1vcpu-1gb-tor1-01.ssh > 198.96.84.204.20132: Flags [P.], seq 19480:19644, ack 1, win 313, length 164
17:52:05.270274 IP lamp-s-1vcpu-1gb-tor1-01.ssh > 198.96.84.204.20132: Flags [P.], seq 19644:19808, ack 1, win 313, length 164
17:52:05.270423 IP lamp-s-1vcpu-1gb-tor1-01.ssh > 198.96.84.204.20132: Flags [P.], seq 19808:19972, ack 1, win 313, length 164
17:52:05.270546 IP lamp-s-1vcpu-1gb-tor1-01.ssh > 198.96.84.204.20132: Flags [P.], seq 19972:20136, ack 1, win 313, length 164
17:52:05.270659 IP lamp-s-1vcpu-1gb-tor1-01.ssh > 198.96.84.204.20132: Flags [P.], seq 20136:20300, ack 1, win 313, length 164
17:52:05.270766 IP lamp-s-1vcpu-1gb-tor1-01.ssh > 198.96.84.204.20132: Flags [P.], seq 20300:20464, ack 1, win 313, length 164
17:52:05.270873 IP lamp-s-1vcpu-1gb-tor1-01.ssh > 198.96.84.204.20132: Flags [P.], seq 20464:20628, ack 1, win 313, length 164
17:52:05.271005 IP lamp-s-1vcpu-1gb-tor1-01.ssh > 198.96.84.204.20132: Flags [P.], seq 20628:20792, ack 1, win 313, length 164
17:52:05.271170 IP lamp-s-1vcpu-1gb-tor1-01.ssh > 198.96.84.204.20132: Flags [P.], seq 20792:20956, ack 1, win 313, length 164
17:52:05.271303 IP lamp-s-1vcpu-1gb-tor1-01.ssh > 198.96.84.204.20132: Flags [P.], seq 20956:21120, ack 1, win 313, length 164
17:52:05.271411 IP lamp-s-1vcpu-1gb-tor1-01.ssh > 198.96.84.204.20132: Flags [P.], seq 21120:21284, ack 1, win 313, length 164
17:52:05.271522 IP lamp-s-1vcpu-1gb-tor1-01.ssh > 198.96.84.204.20132: Flags [P.], seq 21284:21448, ack 1, win 313, length 164
17:52:05.271625 IP lamp-s-1vcpu-1gb-tor1-01.ssh > 198.96.84.204.20132: Flags [P.], seq 21448:21612, ack 1, win 313, length 164
17:52:05.271728 IP lamp-s-1vcpu-1gb-tor1-01.ssh > 198.96.84.204.20132: Flags [P.], seq 21612:21776, ack 1, win 313, length 164
17:52:05.271830 IP lamp-s-1vcpu-1gb-tor1-01.ssh > 198.96.84.204.20132: Flags [P.], seq 21776:21940, ack 1, win 313, length 164
17:52:05.272308 IP lamp-s-1vcpu-1gb-tor1-01.ssh > 198.96.84.204.20132: Flags [P.], seq 21940:22104, ack 1, win 313, length 164
17:52:05.272471 IP lamp-s-1vcpu-1gb-tor1-01.ssh > 198.96.84.204.20132: Flags [P.], seq 22104:22268, ack 1, win 313, length 164
17:52:05.272722 IP lamp-s-1vcpu-1gb-tor1-01.ssh > 198.96.84.204.20132: Flags [P.], seq 22268:22432, ack 1, win 313, length 164
17:52:05.272873 IP lamp-s-1vcpu-1gb-tor1-01.ssh > 198.96.84.204.20132: Flags [P.], seq 22432:22596, ack 1, win 313, length 164
17:52:05.273022 IP lamp-s-1vcpu-1gb-tor1-01.ssh > 198.96.84.204.20132: Flags [P.], seq 22596:22760, ack 1, win 313, length 164
17:52:05.292526 IP 198.96.84.204.20132 > lamp-s-1vcpu-1gb-tor1-01.ssh: Flags [.], ack 22760, win 512, length 0
17:52:05.292620 IP lamp-s-1vcpu-1gb-tor1-01.ssh > 198.96.84.204.20132: Flags [P.], seq 22760:22924, ack 1, win 313, length 164
17:52:05.292913 IP lamp-s-1vcpu-1gb-tor1-01.ssh > 198.96.84.204.20132: Flags [P.], seq 22924:23200, ack 1, win 313, length 276
17:52:05.293047 IP lamp-s-1vcpu-1gb-tor1-01.ssh > 198.96.84.204.20132: Flags [P.], seq 23200:23364, ack 1, win 313, length 164
17:52:05.293157 IP lamp-s-1vcpu-1gb-tor1-01.ssh > 198.96.84.204.20132: Flags [P.], seq 23364:23528, ack 1, win 313, length 164
17:52:05.293263 IP lamp-s-1vcpu-1gb-tor1-01.ssh > 198.96.84.204.20132: Flags [P.], seq 23528:23692, ack 1, win 313, length 164
17:52:05.293375 IP lamp-s-1vcpu-1gb-tor1-01.ssh > 198.96.84.204.20132: Flags [P.], seq 23692:23856, ack 1, win 313, length 164
17:52:05.293548 IP lamp-s-1vcpu-1gb-tor1-01.ssh > 198.96.84.204.20132: Flags [P.], seq 23856:24020, ack 1, win 313, length 164
17:52:05.293683 IP lamp-s-1vcpu-1gb-tor1-01.ssh > 198.96.84.204.20132: Flags [P.], seq 24020:24184, ack 1, win 313, length 164
17:52:05.293796 IP lamp-s-1vcpu-1gb-tor1-01.ssh > 198.96.84.204.20132: Flags [P.], seq 24184:24348, ack 1, win 313, length 164
17:52:05.293980 IP lamp-s-1vcpu-1gb-tor1-01.ssh > 198.96.84.204.20132: Flags [P.], seq 24348:24512, ack 1, win 313, length 164
17:52:05.294155 IP lamp-s-1vcpu-1gb-tor1-01.ssh > 198.96.84.204.20132: Flags [P.], seq 24512:24676, ack 1, win 313, length 164
17:52:05.294283 IP lamp-s-1vcpu-1gb-tor1-01.ssh > 198.96.84.204.20132: Flags [P.], seq 24676:24840, ack 1, win 313, length 164
17:52:05.294389 IP lamp-s-1vcpu-1gb-tor1-01.ssh > 198.96.84.204.20132: Flags [P.], seq 24840:25004, ack 1, win 313, length 164
17:52:05.294519 IP lamp-s-1vcpu-1gb-tor1-01.ssh > 198.96.84.204.20132: Flags [P.], seq 25004:25168, ack 1, win 313, length 164
17:52:05.294629 IP lamp-s-1vcpu-1gb-tor1-01.ssh > 198.96.84.204.20132: Flags [P.], seq 25168:25332, ack 1, win 313, length 164
17:52:05.294733 IP lamp-s-1vcpu-1gb-tor1-01.ssh > 198.96.84.204.20132: Flags [P.], seq 25332:25496, ack 1, win 313, length 164
17:52:05.294854 IP lamp-s-1vcpu-1gb-tor1-01.ssh > 198.96.84.204.20132: Flags [P.], seq 25496:25660, ack 1, win 313, length 164
17:52:05.294963 IP lamp-s-1vcpu-1gb-tor1-01.ssh > 198.96.84.204.20132: Flags [P.], seq 25660:25824, ack 1, win 313, length 164
17:52:05.295073 IP lamp-s-1vcpu-1gb-tor1-01.ssh > 198.96.84.204.20132: Flags [P.], seq 25824:25988, ack 1, win 313, length 164
17:52:05.295193 IP lamp-s-1vcpu-1gb-tor1-01.ssh > 198.96.84.204.20132: Flags [P.], seq 25988:26152, ack 1, win 313, length 164
17:52:05.295314 IP lamp-s-1vcpu-1gb-tor1-01.ssh > 198.96.84.204.20132: Flags [P.], seq 26152:26316, ack 1, win 313, length 164
17:52:05.295451 IP lamp-s-1vcpu-1gb-tor1-01.ssh > 198.96.84.204.20132: Flags [P.], seq 26316:26480, ack 1, win 313, length 164
17:52:05.295572 IP lamp-s-1vcpu-1gb-tor1-01.ssh > 198.96.84.204.20132: Flags [P.], seq 26480:26644, ack 1, win 313, length 164
17:52:05.295685 IP lamp-s-1vcpu-1gb-tor1-01.ssh > 198.96.84.204.20132: Flags [P.], seq 26644:26808, ack 1, win 313, length 164
17:52:05.295807 IP lamp-s-1vcpu-1gb-tor1-01.ssh > 198.96.84.204.20132: Flags [P.], seq 26808:26972, ack 1, win 313, length 164
17:52:05.295918 IP lamp-s-1vcpu-1gb-tor1-01.ssh > 198.96.84.204.20132: Flags [P.], seq 26972:27136, ack 1, win 313, length 164
17:52:05.296047 IP lamp-s-1vcpu-1gb-tor1-01.ssh > 198.96.84.204.20132: Flags [P.], seq 27136:27300, ack 1, win 313, length 164
17:52:05.296172 IP lamp-s-1vcpu-1gb-tor1-01.ssh > 198.96.84.204.20132: Flags [P.], seq 27300:27464, ack 1, win 313, length 164
17:52:05.296322 IP lamp-s-1vcpu-1gb-tor1-01.ssh > 198.96.84.204.20132: Flags [P.], seq 27464:27628, ack 1, win 313, length 164
17:52:05.296460 IP lamp-s-1vcpu-1gb-tor1-01.ssh > 198.96.84.204.20132: Flags [P.], seq 27628:27792, ack 1, win 313, length 164
17:52:05.296586 IP lamp-s-1vcpu-1gb-tor1-01.ssh > 198.96.84.204.20132: Flags [P.], seq 27792:27956, ack 1, win 313, length 164
17:52:05.296702 IP lamp-s-1vcpu-1gb-tor1-01.ssh > 198.96.84.204.20132: Flags [P.], seq 27956:28120, ack 1, win 313, length 164
17:52:05.296807 IP lamp-s-1vcpu-1gb-tor1-01.ssh > 198.96.84.204.20132: Flags [P.], seq 28120:28284, ack 1, win 313, length 164
17:52:05.296968 IP lamp-s-1vcpu-1gb-tor1-01.ssh > 198.96.84.204.20132: Flags [P.], seq 28284:28448, ack 1, win 313, length 164
17:52:05.297156 IP lamp-s-1vcpu-1gb-tor1-01.ssh > 198.96.84.204.20132: Flags [P.], seq 28448:28612, ack 1, win 313, length 164
17:52:05.297343 IP lamp-s-1vcpu-1gb-tor1-01.ssh > 198.96.84.204.20132: Flags [P.], seq 28612:28776, ack 1, win 313, length 164
17:52:05.297561 IP lamp-s-1vcpu-1gb-tor1-01.ssh > 198.96.84.204.20132: Flags [P.], seq 28776:28940, ack 1, win 313, length 164
17:52:05.297687 IP lamp-s-1vcpu-1gb-tor1-01.ssh > 198.96.84.204.20132: Flags [P.], seq 28940:29104, ack 1, win 313, length 164
17:52:05.297794 IP lamp-s-1vcpu-1gb-tor1-01.ssh > 198.96.84.204.20132: Flags [P.], seq 29104:29268, ack 1, win 313, length 164
17:52:05.297898 IP lamp-s-1vcpu-1gb-tor1-01.ssh > 198.96.84.204.20132: Flags [P.], seq 29268:29432, ack 1, win 313, length 164
17:52:05.298002 IP lamp-s-1vcpu-1gb-tor1-01.ssh > 198.96.84.204.20132: Flags [P.], seq 29432:29596, ack 1, win 313, length 164
17:52:05.298109 IP lamp-s-1vcpu-1gb-tor1-01.ssh > 198.96.84.204.20132: Flags [P.], seq 29596:29760, ack 1, win 313, length 164
17:52:05.298254 IP lamp-s-1vcpu-1gb-tor1-01.ssh > 198.96.84.204.20132: Flags [P.], seq 29760:29924, ack 1, win 313, length 164
17:52:05.298372 IP lamp-s-1vcpu-1gb-tor1-01.ssh > 198.96.84.204.20132: Flags [P.], seq 29924:30088, ack 1, win 313, length 164
17:52:05.298476 IP lamp-s-1vcpu-1gb-tor1-01.ssh > 198.96.84.204.20132: Flags [P.], seq 30088:30252, ack 1, win 313, length 164
17:52:05.298586 IP lamp-s-1vcpu-1gb-tor1-01.ssh > 198.96.84.204.20132: Flags [P.], seq 30252:30416, ack 1, win 313, length 164
17:52:05.310650 IP 198.96.84.204.20132 > lamp-s-1vcpu-1gb-tor1-01.ssh: Flags [.], ack 23364, win 510, length 0
17:52:05.310719 IP lamp-s-1vcpu-1gb-tor1-01.ssh > 198.96.84.204.20132: Flags [P.], seq 30416:30580, ack 1, win 313, length 164
17:52:05.310950 IP lamp-s-1vcpu-1gb-tor1-01.ssh > 198.96.84.204.20132: Flags [P.], seq 30580:30856, ack 1, win 313, length 276
17:52:05.311076 IP lamp-s-1vcpu-1gb-tor1-01.ssh > 198.96.84.204.20132: Flags [P.], seq 30856:31020, ack 1, win 313, length 164
17:52:05.344407 IP 198.96.84.204.20132 > lamp-s-1vcpu-1gb-tor1-01.ssh: Flags [.], ack 28612, win 512, length 0
17:52:05.344561 IP lamp-s-1vcpu-1gb-tor1-01.ssh > 198.96.84.204.20132: Flags [P.], seq 31020:31184, ack 1, win 313, length 164
17:52:05.344595 IP 198.96.84.204.20132 > lamp-s-1vcpu-1gb-tor1-01.ssh: Flags [.], ack 30416, win 512, length 0
17:52:05.344894 IP lamp-s-1vcpu-1gb-tor1-01.ssh > 198.96.84.204.20132: Flags [P.], seq 31184:31572, ack 1, win 313, length 388
17:52:05.345023 IP lamp-s-1vcpu-1gb-tor1-01.ssh > 198.96.84.204.20132: Flags [P.], seq 31572:31736, ack 1, win 313, length 164
17:52:05.345133 IP lamp-s-1vcpu-1gb-tor1-01.ssh > 198.96.84.204.20132: Flags [P.], seq 31736:31900, ack 1, win 313, length 164
17:52:05.345239 IP lamp-s-1vcpu-1gb-tor1-01.ssh > 198.96.84.204.20132: Flags [P.], seq 31900:32064, ack 1, win 313, length 164
17:52:05.345343 IP lamp-s-1vcpu-1gb-tor1-01.ssh > 198.96.84.204.20132: Flags [P.], seq 32064:32228, ack 1, win 313, length 164
17:52:05.345483 IP lamp-s-1vcpu-1gb-tor1-01.ssh > 198.96.84.204.20132: Flags [P.], seq 32228:32392, ack 1, win 313, length 164
17:52:05.345598 IP lamp-s-1vcpu-1gb-tor1-01.ssh > 198.96.84.204.20132: Flags [P.], seq 32392:32556, ack 1, win 313, length 164
17:52:05.345734 IP lamp-s-1vcpu-1gb-tor1-01.ssh > 198.96.84.204.20132: Flags [P.], seq 32556:32720, ack 1, win 313, length 164
17:52:05.345843 IP lamp-s-1vcpu-1gb-tor1-01.ssh > 198.96.84.204.20132: Flags [P.], seq 32720:32884, ack 1, win 313, length 164
17:52:05.345951 IP lamp-s-1vcpu-1gb-tor1-01.ssh > 198.96.84.204.20132: Flags [P.], seq 32884:33048, ack 1, win 313, length 164
17:52:05.346053 IP lamp-s-1vcpu-1gb-tor1-01.ssh > 198.96.84.204.20132: Flags [P.], seq 33048:33212, ack 1, win 313, length 164
17:52:05.346155 IP lamp-s-1vcpu-1gb-tor1-01.ssh > 198.96.84.204.20132: Flags [P.], seq 33212:33376, ack 1, win 313, length 164
17:52:05.346257 IP lamp-s-1vcpu-1gb-tor1-01.ssh > 198.96.84.204.20132: Flags [P.], seq 33376:33540, ack 1, win 313, length 164
17:52:05.346363 IP lamp-s-1vcpu-1gb-tor1-01.ssh > 198.96.84.204.20132: Flags [P.], seq 33540:33704, ack 1, win 313, length 164
17:52:05.346467 IP lamp-s-1vcpu-1gb-tor1-01.ssh > 198.96.84.204.20132: Flags [P.], seq 33704:33868, ack 1, win 313, length 164
17:52:05.346569 IP lamp-s-1vcpu-1gb-tor1-01.ssh > 198.96.84.204.20132: Flags [P.], seq 33868:34032, ack 1, win 313, length 164
17:52:05.346672 IP lamp-s-1vcpu-1gb-tor1-01.ssh > 198.96.84.204.20132: Flags [P.], seq 34032:34196, ack 1, win 313, length 164
17:52:05.346776 IP lamp-s-1vcpu-1gb-tor1-01.ssh > 198.96.84.204.20132: Flags [P.], seq 34196:34360, ack 1, win 313, length 164
17:52:05.346878 IP lamp-s-1vcpu-1gb-tor1-01.ssh > 198.96.84.204.20132: Flags [P.], seq 34360:34524, ack 1, win 313, length 164
17:52:05.346980 IP lamp-s-1vcpu-1gb-tor1-01.ssh > 198.96.84.204.20132: Flags [P.], seq 34524:34688, ack 1, win 313, length 164
17:52:05.347081 IP lamp-s-1vcpu-1gb-tor1-01.ssh > 198.96.84.204.20132: Flags [P.], seq 34688:34852, ack 1, win 313, length 164
17:52:05.347184 IP lamp-s-1vcpu-1gb-tor1-01.ssh > 198.96.84.204.20132: Flags [P.], seq 34852:35016, ack 1, win 313, length 164
17:52:05.347289 IP lamp-s-1vcpu-1gb-tor1-01.ssh > 198.96.84.204.20132: Flags [P.], seq 35016:35180, ack 1, win 313, length 164
17:52:05.347392 IP lamp-s-1vcpu-1gb-tor1-01.ssh > 198.96.84.204.20132: Flags [P.], seq 35180:35344, ack 1, win 313, length 164
17:52:05.347495 IP lamp-s-1vcpu-1gb-tor1-01.ssh > 198.96.84.204.20132: Flags [P.], seq 35344:35508, ack 1, win 313, length 164
17:52:05.347599 IP lamp-s-1vcpu-1gb-tor1-01.ssh > 198.96.84.204.20132: Flags [P.], seq 35508:35672, ack 1, win 313, length 164
17:52:05.347702 IP lamp-s-1vcpu-1gb-tor1-01.ssh > 198.96.84.204.20132: Flags [P.], seq 35672:35836, ack 1, win 313, length 164
17:52:05.347804 IP lamp-s-1vcpu-1gb-tor1-01.ssh > 198.96.84.204.20132: Flags [P.], seq 35836:36000, ack 1, win 313, length 164
17:52:05.347906 IP lamp-s-1vcpu-1gb-tor1-01.ssh > 198.96.84.204.20132: Flags [P.], seq 36000:36164, ack 1, win 313, length 164
17:52:05.348009 IP lamp-s-1vcpu-1gb-tor1-01.ssh > 198.96.84.204.20132: Flags [P.], seq 36164:36328, ack 1, win 313, length 164
17:52:05.348112 IP lamp-s-1vcpu-1gb-tor1-01.ssh > 198.96.84.204.20132: Flags [P.], seq 36328:36492, ack 1, win 313, length 164
17:52:05.348243 IP lamp-s-1vcpu-1gb-tor1-01.ssh > 198.96.84.204.20132: Flags [P.], seq 36492:36656, ack 1, win 313, length 164
17:52:05.348440 IP lamp-s-1vcpu-1gb-tor1-01.ssh > 198.96.84.204.20132: Flags [P.], seq 36656:36820, ack 1, win 313, length 164
17:52:05.348573 IP lamp-s-1vcpu-1gb-tor1-01.ssh > 198.96.84.204.20132: Flags [P.], seq 36820:36984, ack 1, win 313, length 164
17:52:05.348687 IP lamp-s-1vcpu-1gb-tor1-01.ssh > 198.96.84.204.20132: Flags [P.], seq 36984:37148, ack 1, win 313, length 164
17:52:05.348795 IP lamp-s-1vcpu-1gb-tor1-01.ssh > 198.96.84.204.20132: Flags [P.], seq 37148:37312, ack 1, win 313, length 164
17:52:05.348952 IP lamp-s-1vcpu-1gb-tor1-01.ssh > 198.96.84.204.20132: Flags [P.], seq 37312:37476, ack 1, win 313, length 164
17:52:05.349088 IP lamp-s-1vcpu-1gb-tor1-01.ssh > 198.96.84.204.20132: Flags [P.], seq 37476:37640, ack 1, win 313, length 164
17:52:05.349197 IP lamp-s-1vcpu-1gb-tor1-01.ssh > 198.96.84.204.20132: Flags [P.], seq 37640:37804, ack 1, win 313, length 164
17:52:05.349301 IP lamp-s-1vcpu-1gb-tor1-01.ssh > 198.96.84.204.20132: Flags [P.], seq 37804:37968, ack 1, win 313, length 164
17:52:05.349403 IP lamp-s-1vcpu-1gb-tor1-01.ssh > 198.96.84.204.20132: Flags [P.], seq 37968:38132, ack 1, win 313, length 164
17:52:05.349539 IP lamp-s-1vcpu-1gb-tor1-01.ssh > 198.96.84.204.20132: Flags [P.], seq 38132:38296, ack 1, win 313, length 164
17:52:05.349663 IP lamp-s-1vcpu-1gb-tor1-01.ssh > 198.96.84.204.20132: Flags [P.], seq 38296:38460, ack 1, win 313, length 164
17:52:05.349796 IP lamp-s-1vcpu-1gb-tor1-01.ssh > 198.96.84.204.20132: Flags [P.], seq 38460:38624, ack 1, win 313, length 164
17:52:05.349906 IP lamp-s-1vcpu-1gb-tor1-01.ssh > 198.96.84.204.20132: Flags [P.], seq 38624:38788, ack 1, win 313, length 164
17:52:05.350018 IP lamp-s-1vcpu-1gb-tor1-01.ssh > 198.96.84.204.20132: Flags [P.], seq 38788:38952, ack 1, win 313, length 164
17:52:05.351852 IP 198.96.84.204.20132 > lamp-s-1vcpu-1gb-tor1-01.ssh: Flags [.], ack 32064, win 512, length 0
17:52:05.351891 IP lamp-s-1vcpu-1gb-tor1-01.ssh > 198.96.84.204.20132: Flags [P.], seq 38952:39116, ack 1, win 313, length 164
17:52:05.352080 IP lamp-s-1vcpu-1gb-tor1-01.ssh > 198.96.84.204.20132: Flags [P.], seq 39116:39392, ack 1, win 313, length 276
17:52:05.352193 IP lamp-s-1vcpu-1gb-tor1-01.ssh > 198.96.84.204.20132: Flags [P.], seq 39392:39556, ack 1, win 313, length 164
17:52:05.352329 IP lamp-s-1vcpu-1gb-tor1-01.ssh > 198.96.84.204.20132: Flags [P.], seq 39556:39720, ack 1, win 313, length 164
17:52:05.352483 IP lamp-s-1vcpu-1gb-tor1-01.ssh > 198.96.84.204.20132: Flags [P.], seq 39720:39884, ack 1, win 313, length 164
17:52:05.352590 IP lamp-s-1vcpu-1gb-tor1-01.ssh > 198.96.84.204.20132: Flags [P.], seq 39884:40048, ack 1, win 313, length 164
17:52:05.352693 IP lamp-s-1vcpu-1gb-tor1-01.ssh > 198.96.84.204.20132: Flags [P.], seq 40048:40212, ack 1, win 313, length 164
17:52:05.352797 IP lamp-s-1vcpu-1gb-tor1-01.ssh > 198.96.84.204.20132: Flags [P.], seq 40212:40376, ack 1, win 313, length 164
17:52:05.376835 IP 198.96.84.204.20132 > lamp-s-1vcpu-1gb-tor1-01.ssh: Flags [.], ack 37312, win 512, length 0
17:52:05.376927 IP lamp-s-1vcpu-1gb-tor1-01.ssh > 198.96.84.204.20132: Flags [P.], seq 40376:40540, ack 1, win 313, length 164
17:52:05.376956 IP 198.96.84.204.20132 > lamp-s-1vcpu-1gb-tor1-01.ssh: Flags [.], ack 40376, win 512, length 0
17:52:05.376977 IP 198.96.84.204.20132 > lamp-s-1vcpu-1gb-tor1-01.ssh: Flags [P.], seq 1:37, ack 40376, win 512, length 36
17:52:05.377279 IP lamp-s-1vcpu-1gb-tor1-01.ssh > 198.96.84.204.20132: Flags [P.], seq 40540:41056, ack 37, win 313, length 516
17:52:05.377457 IP lamp-s-1vcpu-1gb-tor1-01.ssh > 198.96.84.204.20132: Flags [P.], seq 41056:41220, ack 37, win 313, length 164
17:52:05.377576 IP lamp-s-1vcpu-1gb-tor1-01.ssh > 198.96.84.204.20132: Flags [P.], seq 41220:41384, ack 37, win 313, length 164
17:52:05.377682 IP lamp-s-1vcpu-1gb-tor1-01.ssh > 198.96.84.204.20132: Flags [P.], seq 41384:41548, ack 37, win 313, length 164
17:52:05.377786 IP lamp-s-1vcpu-1gb-tor1-01.ssh > 198.96.84.204.20132: Flags [P.], seq 41548:41712, ack 37, win 313, length 164
17:52:05.377890 IP lamp-s-1vcpu-1gb-tor1-01.ssh > 198.96.84.204.20132: Flags [P.], seq 41712:41876, ack 37, win 313, length 164
17:52:05.377993 IP lamp-s-1vcpu-1gb-tor1-01.ssh > 198.96.84.204.20132: Flags [P.], seq 41876:42040, ack 37, win 313, length 164
17:52:05.378110 IP lamp-s-1vcpu-1gb-tor1-01.ssh > 198.96.84.204.20132: Flags [P.], seq 42040:42204, ack 37, win 313, length 164
17:52:05.378229 IP lamp-s-1vcpu-1gb-tor1-01.ssh > 198.96.84.204.20132: Flags [P.], seq 42204:42368, ack 37, win 313, length 164
17:52:05.378332 IP lamp-s-1vcpu-1gb-tor1-01.ssh > 198.96.84.204.20132: Flags [P.], seq 42368:42532, ack 37, win 313, length 164
17:52:05.378433 IP lamp-s-1vcpu-1gb-tor1-01.ssh > 198.96.84.204.20132: Flags [P.], seq 42532:42696, ack 37, win 313, length 164
17:52:05.378535 IP lamp-s-1vcpu-1gb-tor1-01.ssh > 198.96.84.204.20132: Flags [P.], seq 42696:42860, ack 37, win 313, length 164
17:52:05.378637 IP lamp-s-1vcpu-1gb-tor1-01.ssh > 198.96.84.204.20132: Flags [P.], seq 42860:43024, ack 37, win 313, length 164
17:52:05.378738 IP lamp-s-1vcpu-1gb-tor1-01.ssh > 198.96.84.204.20132: Flags [P.], seq 43024:43188, ack 37, win 313, length 164
17:52:05.378839 IP lamp-s-1vcpu-1gb-tor1-01.ssh > 198.96.84.204.20132: Flags [P.], seq 43188:43352, ack 37, win 313, length 164
17:52:05.378941 IP lamp-s-1vcpu-1gb-tor1-01.ssh > 198.96.84.204.20132: Flags [P.], seq 43352:43516, ack 37, win 313, length 164
17:52:05.379042 IP lamp-s-1vcpu-1gb-tor1-01.ssh > 198.96.84.204.20132: Flags [P.], seq 43516:43680, ack 37, win 313, length 164
17:52:05.379143 IP lamp-s-1vcpu-1gb-tor1-01.ssh > 198.96.84.204.20132: Flags [P.], seq 43680:43844, ack 37, win 313, length 164
17:52:05.379244 IP lamp-s-1vcpu-1gb-tor1-01.ssh > 198.96.84.204.20132: Flags [P.], seq 43844:44008, ack 37, win 313, length 164
17:52:05.379345 IP lamp-s-1vcpu-1gb-tor1-01.ssh > 198.96.84.204.20132: Flags [P.], seq 44008:44172, ack 37, win 313, length 164
17:52:05.379449 IP lamp-s-1vcpu-1gb-tor1-01.ssh > 198.96.84.204.20132: Flags [P.], seq 44172:44336, ack 37, win 313, length 164
17:52:05.379550 IP lamp-s-1vcpu-1gb-tor1-01.ssh > 198.96.84.204.20132: Flags [P.], seq 44336:44500, ack 37, win 313, length 164
17:52:05.379651 IP lamp-s-1vcpu-1gb-tor1-01.ssh > 198.96.84.204.20132: Flags [P.], seq 44500:44664, ack 37, win 313, length 164
17:52:05.379752 IP lamp-s-1vcpu-1gb-tor1-01.ssh > 198.96.84.204.20132: Flags [P.], seq 44664:44828, ack 37, win 313, length 164
17:52:05.379852 IP lamp-s-1vcpu-1gb-tor1-01.ssh > 198.96.84.204.20132: Flags [P.], seq 44828:44992, ack 37, win 313, length 164
17:52:05.379952 IP lamp-s-1vcpu-1gb-tor1-01.ssh > 198.96.84.204.20132: Flags [P.], seq 44992:45156, ack 37, win 313, length 164
17:52:05.380061 IP lamp-s-1vcpu-1gb-tor1-01.ssh > 198.96.84.204.20132: Flags [P.], seq 45156:45320, ack 37, win 313, length 164
17:52:05.380193 IP lamp-s-1vcpu-1gb-tor1-01.ssh > 198.96.84.204.20132: Flags [P.], seq 45320:45484, ack 37, win 313, length 164
17:52:05.380299 IP lamp-s-1vcpu-1gb-tor1-01.ssh > 198.96.84.204.20132: Flags [P.], seq 45484:45648, ack 37, win 313, length 164
17:52:05.380436 IP lamp-s-1vcpu-1gb-tor1-01.ssh > 198.96.84.204.20132: Flags [P.], seq 45648:45812, ack 37, win 313, length 164
17:52:05.380546 IP lamp-s-1vcpu-1gb-tor1-01.ssh > 198.96.84.204.20132: Flags [P.], seq 45812:45976, ack 37, win 313, length 164
17:52:05.380649 IP lamp-s-1vcpu-1gb-tor1-01.ssh > 198.96.84.204.20132: Flags [P.], seq 45976:46140, ack 37, win 313, length 164
17:52:05.380751 IP lamp-s-1vcpu-1gb-tor1-01.ssh > 198.96.84.204.20132: Flags [P.], seq 46140:46304, ack 37, win 313, length 164
17:52:05.380853 IP lamp-s-1vcpu-1gb-tor1-01.ssh > 198.96.84.204.20132: Flags [P.], seq 46304:46468, ack 37, win 313, length 164
17:52:05.380954 IP lamp-s-1vcpu-1gb-tor1-01.ssh > 198.96.84.204.20132: Flags [P.], seq 46468:46632, ack 37, win 313, length 164
17:52:05.381078 IP lamp-s-1vcpu-1gb-tor1-01.ssh > 198.96.84.204.20132: Flags [P.], seq 46632:46796, ack 37, win 313, length 164
17:52:05.381203 IP lamp-s-1vcpu-1gb-tor1-01.ssh > 198.96.84.204.20132: Flags [P.], seq 46796:46960, ack 37, win 313, length 164
17:52:05.381326 IP lamp-s-1vcpu-1gb-tor1-01.ssh > 198.96.84.204.20132: Flags [P.], seq 46960:47124, ack 37, win 313, length 164
17:52:05.381461 IP lamp-s-1vcpu-1gb-tor1-01.ssh > 198.96.84.204.20132: Flags [P.], seq 47124:47288, ack 37, win 313, length 164
17:52:05.381567 IP lamp-s-1vcpu-1gb-tor1-01.ssh > 198.96.84.204.20132: Flags [P.], seq 47288:47452, ack 37, win 313, length 164
17:52:05.381699 IP lamp-s-1vcpu-1gb-tor1-01.ssh > 198.96.84.204.20132: Flags [P.], seq 47452:47616, ack 37, win 313, length 164
17:52:05.381807 IP lamp-s-1vcpu-1gb-tor1-01.ssh > 198.96.84.204.20132: Flags [P.], seq 47616:47780, ack 37, win 313, length 164
17:52:05.381915 IP lamp-s-1vcpu-1gb-tor1-01.ssh > 198.96.84.204.20132: Flags [P.], seq 47780:47944, ack 37, win 313, length 164
17:52:05.382052 IP lamp-s-1vcpu-1gb-tor1-01.ssh > 198.96.84.204.20132: Flags [P.], seq 47944:48108, ack 37, win 313, length 164
17:52:05.382168 IP lamp-s-1vcpu-1gb-tor1-01.ssh > 198.96.84.204.20132: Flags [P.], seq 48108:48272, ack 37, win 313, length 164
17:52:05.382323 IP lamp-s-1vcpu-1gb-tor1-01.ssh > 198.96.84.204.20132: Flags [P.], seq 48272:48436, ack 37, win 313, length 164
17:52:05.382457 IP lamp-s-1vcpu-1gb-tor1-01.ssh > 198.96.84.204.20132: Flags [P.], seq 48436:48600, ack 37, win 313, length 164
17:52:05.382591 IP lamp-s-1vcpu-1gb-tor1-01.ssh > 198.96.84.204.20132: Flags [P.], seq 48600:48764, ack 37, win 313, length 164
17:52:05.382701 IP lamp-s-1vcpu-1gb-tor1-01.ssh > 198.96.84.204.20132: Flags [P.], seq 48764:48928, ack 37, win 313, length 164
17:52:05.445553 IP lamp-s-1vcpu-1gb-tor1-01.ssh > 198.96.84.204.20132: Flags [P.], seq 48928:49092, ack 37, win 313, length 164
17:52:05.451270 IP 198.96.84.204.20132 > lamp-s-1vcpu-1gb-tor1-01.ssh: Flags [.], ack 45156, win 512, length 0
17:52:05.451363 IP lamp-s-1vcpu-1gb-tor1-01.ssh > 198.96.84.204.20132: Flags [P.], seq 49092:49256, ack 37, win 313, length 164
17:52:05.451392 IP 198.96.84.204.20132 > lamp-s-1vcpu-1gb-tor1-01.ssh: Flags [.], ack 48928, win 512, length 0
17:52:05.451662 IP lamp-s-1vcpu-1gb-tor1-01.ssh > 198.96.84.204.20132: Flags [P.], seq 49256:49644, ack 37, win 313, length 388
17:52:05.451791 IP lamp-s-1vcpu-1gb-tor1-01.ssh > 198.96.84.204.20132: Flags [P.], seq 49644:49808, ack 37, win 313, length 164
17:52:05.451898 IP lamp-s-1vcpu-1gb-tor1-01.ssh > 198.96.84.204.20132: Flags [P.], seq 49808:49972, ack 37, win 313, length 164
17:52:05.452041 IP lamp-s-1vcpu-1gb-tor1-01.ssh > 198.96.84.204.20132: Flags [P.], seq 49972:50136, ack 37, win 313, length 164
17:52:05.452220 IP lamp-s-1vcpu-1gb-tor1-01.ssh > 198.96.84.204.20132: Flags [P.], seq 50136:50300, ack 37, win 313, length 164
17:52:05.452407 IP lamp-s-1vcpu-1gb-tor1-01.ssh > 198.96.84.204.20132: Flags [P.], seq 50300:50464, ack 37, win 313, length 164
17:52:05.452531 IP lamp-s-1vcpu-1gb-tor1-01.ssh > 198.96.84.204.20132: Flags [P.], seq 50464:50628, ack 37, win 313, length 164
17:52:05.452636 IP lamp-s-1vcpu-1gb-tor1-01.ssh > 198.96.84.204.20132: Flags [P.], seq 50628:50792, ack 37, win 313, length 164
17:52:05.452740 IP lamp-s-1vcpu-1gb-tor1-01.ssh > 198.96.84.204.20132: Flags [P.], seq 50792:50956, ack 37, win 313, length 164
17:52:05.452849 IP lamp-s-1vcpu-1gb-tor1-01.ssh > 198.96.84.204.20132: Flags [P.], seq 50956:51120, ack 37, win 313, length 164
17:52:05.452954 IP lamp-s-1vcpu-1gb-tor1-01.ssh > 198.96.84.204.20132: Flags [P.], seq 51120:51284, ack 37, win 313, length 164
17:52:05.453058 IP lamp-s-1vcpu-1gb-tor1-01.ssh > 198.96.84.204.20132: Flags [P.], seq 51284:51448, ack 37, win 313, length 164
17:52:05.453160 IP lamp-s-1vcpu-1gb-tor1-01.ssh > 198.96.84.204.20132: Flags [P.], seq 51448:51612, ack 37, win 313, length 164
17:52:05.453263 IP lamp-s-1vcpu-1gb-tor1-01.ssh > 198.96.84.204.20132: Flags [P.], seq 51612:51776, ack 37, win 313, length 164
