root@lamp-s-1vcpu-1gb-tor1-01:~# tcpdump -r 0001.pcap
reading from file 0001.pcap, link-type EN10MB (Ethernet)
17:57:25.155913 IP lamp-s-1vcpu-1gb-tor1-01.ssh > 198.96.84.204.20132: Flags [P.], seq 2654554669:2654554713, ack 251998987, win 313, length 44
17:57:25.156041 IP lamp-s-1vcpu-1gb-tor1-01.ssh > 198.96.84.204.20132: Flags [P.], seq 44:152, ack 1, win 313, length 108
17:57:25.156121 IP lamp-s-1vcpu-1gb-tor1-01.ssh > 198.96.84.204.20132: Flags [P.], seq 152:188, ack 1, win 313, length 36
17:57:25.159368 IP 198.96.84.204.20132 > lamp-s-1vcpu-1gb-tor1-01.ssh: Flags [.], ack 188, win 508, length 0
